business_name,phone,email,website,address,city,state,category,source,date_found,priority,contacted,notes,lead_type,market_phase
Land Rover Palm Beach,561-683-6400,,https://www.landroverpalmbeach.com/,7550 Okeechobee Blvd,West Palm Beach,FL,Auto Dealership - Land Rover,websearch,2026-02-17,High,No,Premium luxury SUV dealership with high-end showroom serving Palm Beach market,Auto Dealer,FL High-End Markets
Sarasota Ford,941-953-3700,,https://www.sarasotaford.com/,3100 Bee Ridge Rd,Sarasota,FL,Auto Dealership - Ford,websearch,2026-02-17,High,No,Large Ford dealership with expansive showroom and service areas,Auto Dealer,FL High-End Markets
Palm Beach Toyota,561-964-6600,,https://www.palmbeachtoyota.com/,2835 Ranch House Rd,West Palm Beach,FL,Auto Dealership - Toyota,websearch,2026-02-17,High,No,Large Toyota dealership with modern showroom facilities,Auto Dealer,FL High-End Markets
AutoNation Cadillac West Palm Beach,561-650-5000,,https://www.autonationcadillacwestpalmbeach.com/,3701 Okeechobee Blvd,West Palm Beach,FL,Auto Dealership - Cadillac,websearch,2026-02-17,High,No,Premium Cadillac dealership with luxury showroom,Auto Dealer,FL High-End Markets
Maserati of Naples,239-594-7500,,https://www.maseratiofnaples.com/,3885 Tamiami Trail E,Naples,FL,Auto Dealership - Maserati,websearch,2026-02-17,High,No,Ultra-luxury Maserati dealership with premium showroom design,Auto Dealer,FL High-End Markets