Business Name,Website,Phone,Email,Business Type,Location,Description/Services
Combined Warehouse,https://combinedwarehouse.com,,info@combinedwarehouse.com,Warehouse,Chicago IL,"Premier Chicago warehousing solutions, material handling, fulfillment, e-commerce fulfillment, cross-docking"
Logistics Plus Chicago,https://www.logisticsplus.com,,info@logisticsplus.com,Warehouse,Bensenville IL,"425,000 sq ft storage and fulfillment space, 3PL warehouse solutions"
Neill Cartage,https://www.neillcartage.com,,info@neillcartage.com,Warehouse,Chicago IL,"Chicago's premier full service logistics, public warehousing, and distribution since 1946"
North American Warehousing Company,https://nawarehouse.com,,info@nawarehouse.com,Warehouse,Bedford Park IL,"Privately held, full service 3PL provider, asset based warehouse in Chicago suburb"
WEL Companies,https://www.welcompanies.com,,info@welcompanies.com,Warehouse,Joliet IL,"80,000 sq ft food-grade warehouse, trucking fleet, LTL capabilities"
OLIMP Warehousing,https://olimpwarehousing.com,,info@olimpwarehousing.com,Warehouse,Chicago IL,"On-demand storage & logistics, pallet rework, cross-docking, long-term storage"
United Facilities,https://unitedfacilities.com,,info@unitedfacilities.com,Warehouse,Chicago IL,"3PL warehousing company near West Suburbs, leader in warehouse solutions"
Ware-Pak,https://ware-pak.com,,info@ware-pak.com,Warehouse,Chicago IL,"170,000 sq ft distribution facility, 13,000 pallet locations, 45,000+ SKUs managed daily"
Edler Warehousing LLC,https://www.edlerwarehousing.com,,info@edlerwarehousing.com,Warehouse,Chicago IL,"Public warehouse, 3PL, logistics services since 1938, largest Chicago area supplier"
MWD Logistics,https://www.mwdlogistics.com,,info@mwdlogistics.com,Warehouse,Chicago IL,"118,390 sq ft 3PL warehouse space, industrial warehousing and distribution"
Palisades Logistics,https://www.palisadeslogistics.com,,info@palisadeslogistics.com,Warehouse,Chicago IL,"3PL Chicago services, warehousing & distribution for food, paper & chemical industries"
Spartan Logistics,https://www.spartanlogistics.com,,info@spartanlogistics.com,Warehouse,Itasca IL,"210,641 SF modern 3PL space, easy access to Chicago's major interstates"
Buske Logistics,https://www.buske.com,,info@buske.com,Warehouse,Chicago IL,"Comprehensive logistics services including warehousing, retail consolidation"
Nexus Distribution,https://www.nexusdistribution.com,,info@nexusdistribution.com,Warehouse,Chicago IL,"Food grade warehouse space, 3PL & logistics services, order fulfillment"
Crane Worldwide Logistics,https://www.craneww.com,,info@craneww.com,Warehouse,Chicago IL,"130,000 sq ft 3PL warehouse next to Chicago O'Hare International Airport"
Bob Loquercio Auto Group,https://www.blautogroup.com,847-628-2800,info@blautogroup.com,Auto Dealer,Streamwood IL,"Multiple dealerships: Chrysler, Dodge, Ford, GMC, Genesis, Honda, Hyundai, Kia, Lexus, Toyota"
MCC of Chicago,https://mcofchicago.com,,info@mcofchicago.com,Auto Dealer,Joliet IL,"America's top exotic car dealership, luxury vehicles, custom builds, supercars"
City Auto Group,https://www.cityautogroup.com,,info@cityautogroup.com,Auto Dealer,Chicago IL,"Chicago group dealer serving Cicero, Oak Park, Stickney, finest Chicago group dealers"
Napleton Downtown,https://napletondowntown.com,,info@napletondowntown.com,Auto Dealer,Chicago IL,"Chicagoland's largest selection of new & used cars, trucks, and SUVs"
Toyota On Western,https://www.toyotaonwestern.com,,info@toyotaonwestern.com,Auto Dealer,Chicago IL,"New and used Toyota dealer serving Chicago, IL area"
Chicago Northside Toyota,https://www.chicagotoyota.com,773-433-1036,info@chicagotoyota.com,Auto Dealer,Chicago IL,"Chicago Northside Toyota, trusted used car dealer for Chicago car shoppers"
Chicago Motor Cars,https://www.chicagomotorcars.com,,info@chicagomotorcars.com,Auto Dealer,Chicago Suburbs IL,"Luxury & exotic car dealer, three locations in Chicago suburbs, high-quality pre-owned vehicles"
Murgado Ford of Chicago,https://www.murgadofordchicago.com,,info@murgadofordchicago.com,Auto Dealer,Chicago IL,"New & used cars for sale, serving Chicago, Evanston, Oak Park neighborhoods"
Chrysler Dodge Jeep RAM of Chicago,https://www.jeepofchicago.com,,info@jeepofchicago.com,Auto Dealer,Chicago IL,"New & used cars for sale CDJR dealership in Chicago IL"
Western Avenue Nissan,https://www.westernavenissan.com,773-776-8200,info@westernavenissan.com,Auto Dealer,Chicago IL,"Nissan dealer Chicago IL, new & used cars for sale near Berwyn IL"
Berman Subaru of Chicago,https://www.subaruchicago.com,,info@subaruchicago.com,Auto Dealer,Chicago IL,"New Subaru & used car dealer in Chicago, serving Harwood Heights, Roscoe Village, Lincoln Park"
Your Choice Autos,https://www.yourchoiceautos.com,,info@yourchoiceautos.com,Auto Dealer,Chicagoland IL,"Over 1,000 affordable used cars, trucks, and SUVs in Chicagoland"
Chicagoland Automotive Group,https://www.chicagolandautogroup.com,,info@chicagolandautogroup.com,Auto Dealer,Lisle IL,"New and used cars for sale in Lisle IL, Honda, Infiniti, Volvo cars and SUVs"
Chicago Auto Place,https://www.chicagoautoplace.com,630-422-1122,sales@chicagoautoplace.com,Auto Dealer,Downers Grove IL,"Used vehicle dealership, 2150 Ogden Ave Downers Grove IL 60515"
Perillo BMW,https://www.perillobmw.com,,info@perillobmw.com,Auto Dealer,Chicago IL,"BMW dealership serving Northfield, Naperville, Chicago, St. Charles IL, new BMW vehicles"