business_name,phone,email,website,address,city,state,category,source,date_found,priority,contacted,notes,lead_type,market_phase
Treasure Coast Home Buyers,(772) 237-0519,,https://www.treasurecoasthomebuyers.com/,1729 NW St. Lucie West Blvd #1115,Port Saint Lucie,FL,Real Estate Investor,websearch,2026-02-24,High,No,Cash home buyers serving Melbourne, Port St Lucie - Vero Beach - Fort Pierce - Hobe Sound - Stuart. Offer fair cash offers, no hassles. Helps homeowners avoid foreclosure. HOT LEAD - property maintenance and renovation partnership.,hot_lead,Phase 1
Sell My PSL Home For Cash,(772) 879-5010,,https://www.sellmypslhomeforcash.com/,Port St. Lucie FL,Port St. Lucie,FL,Real Estate Investor,websearch,2026-02-24,High,No,We buy houses fast for cash in Port St Lucie, Vero Beach, Stuart, Ft. Local real estate investor. Risk-free, you have nothing to lose. HOT LEAD - property maintenance and renovation partnership.,hot_lead,Phase 1
Florida Cash Home Buyers Martin County,(954) 549-7566,,https://www.floridacashhomebuyers.com/martin-county/,Martin County FL,Martin County,FL,Real Estate Investor,websearch,2026-02-24,High No,Fully licensed & accredited cash home buyers. Closed over 900+ transactions since 2011. Owners: Gabriel Garcia, Omar Reiner. Specialize in foreclosure, inherited homes, bad tenants, vacant homes. HOT LEAD - property renovation partnership.,hot_lead,Phase 1
Solution Home Buyers Port St Lucie,704-870-2100,,https://www.solutionhomeinvestors.com/port-st-lucie-investment-properties/,Port St. Lucie FL,Port St. Lucie,FL,Real Estate Investor,websearch,2026-02-24,High No,Real estate investment company. Full-time property investors in Port St Lucie. Find hidden house deals at 30-50% off retail value. Properties under $100k. HOT LEAD - property renovation partnership.,hot_lead,Phase 1
Solution Home Buyers Fort Pierce,,https://www.solutionhomeinvestors.com/fort-pierce-investment-properties/,Fort Pierce FL,Fort Pierce,FL,Real Estate Investor,websearch,2026-02-24,High No,Real estate investment company. Full-time property investors in Fort Pierce. Find hidden house deals at 30-50% off retail value. HOT LEAD - property renovation partnership.,hot_lead,Phase 1
MCD Properties Group LLC,1860 SW Fountainview Blvd Port Saint Lucie FL 34986,,https://www.webuyhomesfastneasy.com/,Port Saint Lucie,FL,Real Estate Investor,websearch,2026-02-24,High No,Port Saint Lucie area leading real estate solutions company. Experts at finding solutions for people who want to sell quickly. Work with clients throughout Florida and nationwide. Warm LEAD.,warm_lead,Phase 1
Port St Lucie Real Estate Investors Association,800-617-2884,,https://www.meetup.com/port-st-lucie-real-estate-investors-association/,Port St. Lucie,FL,Real Estate Investor,websearch,2026-02-24,Medium No,Treasure Coast Real Estate Investors Association (TCREIA). Monthly meetings on first Tuesday of every month at 6:30 PM. Contact: Mike Perl. Email: tcreia@yahoo.com. Warm LEAD - networking opportunity.,warm_lead,Phase 1
Build Back Better Investment Inc,,info@tcreia.com,,Port St. Lucie,FL,Real Estate Investor,websearch,2026-02-24,Medium No,Boutique real estate re-developer and investment company. Founder: AQB "The Savant" Sellassie. Work with owners to purchase, rebuild, and rehabilitate properties. Warm LEAD.,warm_lead,Phase 1
RT Commercial Real Estate,772-220-4096,,https://rt-cre.com/about-us-%2F-meet-our-team/,Stuart FL,Stuart,FL,Real Estate Investor,websearch,2026-02-24,High No,19 years experience in real estate, specializes in commercial investments and creative deal structures. Alex is licensed Certified Building Contractor since 2005. Closed over $195 million in transactions. HOT LEAD - commercial property maintenance partnership.,hot_lead,Phase 1
Premier Group at ONE Sotheby's International Realty,(772) 287-1777,,https://premierrealtygroup.com/,Stuart FL,Stuart,FL,Real Estate Investor,websearch,2026-02-24,High No,Committed to Treasure Coast real estate community since 1958. Family of Realtors. Experts equipped with knowledge and specialized experience for buying and selling. Warm LEAD - property renovation partnership.,warm_lead,Phase 1
SLC Commercial Realty,(772) 220-4096,,https://www.slccommercial.com/,Stuart FL,Stuart,FL,Real Estate Investor,websearch,2026-02-24,High No,Expert in sales, leasing, and management in Stuart, Vero Beach, Port St. Lucie, and West Palm Beach. Leading commercial real estate firm since 1993. HOT LEAD - property maintenance partnership.,hot_lead,Phase 1
Connected Investors - Richard Costanzo,,info@tcreia.com,,Vero Beach,FL,Real Estate Investor,websearch,2026-02-24,Medium No,Investor based out of Vero Beach FL area. Looking for Single-family fix & flip deals in Vero Beach, Fort Pierce, Sebastian FL. Warm LEAD.,warm_lead,Phase 1
Sell My House Fast Stuart,,(772) 370-6424,,https://www.portstluciehomebuyer.com/sell-my-house-fast-in-stuart-fl/,Stuart,FL,Real Estate Investor,websearch,2026-02-24,High No,Josh Bradley, Bradley & Associates Real Estate. Fast cash home buyer. Professional real estate investors that buy houses. HOT LEAD - property renovation partnership.,hot_lead,Phase 1
Priority Home Buyers Stuart,,(772) 370-6424,,https://priorityhomebuyers.com/sell-my-house-fast-stuart-florida/,Stuart,FL,Real Estate Investor,websearch,2026-02-24,High No,Cash home buyers in Stuart FL. Seasoned real estate consultants and reputable cash home buyers. Network of local real estate investors. HOT LEAD - property renovation partnership.,hot_lead,Phase 1
Modern Property Solutions Stuart,,(772) 370-6424,,https://modernpropertysolutions.com/sell-my-house-fast-stuart-florida/,Stuart,FL,Real Estate Investor,websearch,2026-02-24,High No,Local, trustworthy investing organization. Prioritizes transparency and clarity. Won't waste time or offend. Can provide price range by phone. HOT LEAD - property renovation partnership.,hot_lead,Phase 1
Liz Buys Houses Florida,,(772) 370-6424,,https://www.lizbuyshouses.net/sell-my-house-fast-florida/,Stuart,FL,Real Estate Investor,websearch,2026-02-24,High No,Investors are happy to answer questions from first phone call to closing. Cash offers for homes. Specializing in fix-and-flip and buy-and-hold strategies. HOT LEAD - property renovation partnership.,hot_lead,Phase 1
