Business Name,Phone,Email,Website,Address,City,Type,Notes
MarineMax Stuart,(772) 287-4495,,https://www.marinemax.com/stores/stuart,"2370 SW Palm City Rd, Stuart, FL 34994",Stuart,Boat Dealer,Large boat dealer with multiple brands, marina facilities
Gaston's Seagate Marine Sales Inc,(772) 221-2105,tgaston@seagatemarine.com,https://www.seagatemarine.com/,"4900 SE Federal HWY, Stuart, FL 34997",Stuart,Boat Dealer,New and pre-owned boats, parts and service
Legacy Marine,(772) 288-1191,,https://www.legacymarine.com/,"3050 SE Dixie Hwy, Stuart, FL 34997",Stuart,Boat Dealer,Pontoons, center consoles, sport-fishing yachts
Marine Connection of Stuart,(772) 210-1120,,https://www.marineconnection.com/locations/stuart,"200 SW Monterey Rd, Stuart, FL 34994",Stuart,Boat Dealer,Cobia, Hurricane, Sea Hunt, Pathfinder boats
Sand N Sea Marine Group,(772) 600-7789,shane@sandnseamarine.com,https://www.sandnseamarine.com/,"3705 SE Dixie Hwy, Stuart, FL 34997",Stuart,Boat Dealer,Sportsman Boats, Southport, Stingray, Yamaha dealership
Hinckley Yacht Services,(772) 287-0923,,https://www.hinckleyyachts.com/location/stuart-florida/,"4550 SE Boatyard Ave, Stuart, FL 34997",Stuart,Yacht Services,Luxury yacht repair, boatyard services, marina slips
River Forest Yachting Centers,(772) 287-4131,gwharton@riverforestyc.com,https://riverforestyc.com/,"9150 SW Pennsylvania Avenue, Stuart, FL 34997",Stuart,Yacht Storage,Indoor boat storage, humidity controlled, 45,000 sq ft facility
Manatee Marina,772-283-6714,,https://www.manateemarina.com/,"4905 SE Dixie Hwy, Stuart, FL 34997",Port Salerno,Marina,Dry storage, 20,000 sq ft facility, 120 boats
Sundance Marine,(772) 334-1416,,https://www.sundancemarineusa.com/,"3321 NE Indian River Dr, Jensen Beach, FL 34957",Jensen Beach,Boat Dealer,New and used boats, service, parts
Riverside Marina,(772) 464-2001,,https://www.riversidemarinafla.com/,"2350 N Old Dixie Hwy, Fort Pierce, FL 34946",Fort Pierce,Marina,Self service and full service marina since 1979
Safe Harbor Harbortown,(772) 466-7300,,https://shmarinas.com/locations/safe-harbor-harbortown/,"1936 Harbortown Dr, Fort Pierce, FL 34946",Fort Pierce,Marina,Premier marina with natural island breakwater
Vero Marine Center,(772) 258-4268,Brian@VeroMarine.com,https://www.veromarine.com/,"12 Royal Palm Pt, Vero Beach, FL 32960",Vero Beach,Boat Dealer,Grady White and Robalo boats, over 60 years
Marine Connection of Vero Beach,(772) 222-7850,,https://www.marineconnection.com/,"1530 US 1, Vero Beach, FL 32960",Vero Beach,Boat Dealer,Cobia, Hurricane, Sea Hunt, Pathfinder
Big Kahuna Marine & Transport,(772) 882-6287,,https://bigkahunamarine.com/,"656 SW Carter Ave, Port St. Lucie, FL 34983",Port St. Lucie,Marine Service,30 years experience, repair, storage, transport
Steadfast Marine Inc,(772) 398-1500,,https://www.steadfastmarineinc.com/,"1031 SE Holbrook Ct #C3, Port St. Lucie, FL 34952",Port St. Lucie,Marine Service,Repair, paint and detail boats
Bayshore Marine Repair,(772) 871-0027,,https://bayshoremarinerepair.com/,"1984 SW Biltmore St, Port St. Lucie, FL",Port St. Lucie,Marine Service,Serving Treasure Coast 20 years, boat repair
Hobe Sound JEM Marine,(772) 283-0401,,https://www.hobesoundjemmarine.com/,"10520 SE Federal Hwy, Hobe Sound, FL 33455",Hobe Sound,Boat Dealer,Transport and marine services
St Lucie Outboard Marine,(772) 464-1440,,http://www.stlucieoutboardmarine.com/,"657 N 2nd St, Fort Pierce, FL 34950",Fort Pierce,Marine Service,Outboard motor repair and service
Taylor Creek Marina,(772) 465-2663,,https://www.mywindward.com/,"1700 N 2nd St, Fort Pierce, FL 34950",Fort Pierce,Marina,Windward's largest dry storage, 400 slips
Stuart Boat Cleaning,(772) 677-1113,,https://stuartboatcleaning.com/,,Stuart,Boat Detailing,Professional boat cleaning and detailing
Topside Boat Cleaning,,,https://topsideboatcleaning.com/,,Vero Beach,Boat Detailing,Mobile boat detailing, oxidation removal, waxing
FINN's Boat Detailing,(772) 206-5667,kevinfinnbusiness@gmail.com,,Stuart,Boat Detailing,Mobile detailing for boats, cars, RVs, aircraft
Pelican Yacht Club,(772) 464-2700,,https://www.pelicanyachtclub.com/,"1120 Seaway Dr, Fort Pierce, FL 34949",Fort Pierce,Yacht Club,Full service yacht club with restaurant
Treasure Coast Canvas and Enclosures,(772) 600-7890,,https://www.tccanvasandenclosures.com/,"4113 SE Commerce Ave, Stuart, FL 34997",Stuart,Marine Upholstery,Custom canvas, upholstery, enclosures for boats
Meridian Marina,(772) 221-8198,,https://meridianmarina.com/,"1400 SW Chapman Way, Palm City, FL 34990",Palm City,Marina,Martin County's largest marina, dry stack storage
AMA Upholstery and Repair,(772) 999-5478,amaupholsteryandrepair@gmail.com,https://www.amauphfl.com/,"2264 Old Dixie Hwy SE, Vero Beach, FL 32962",Vero Beach,Marine Upholstery,Custom upholstery, canvas, automotive repair
Treasure Coast Customs LLC,(772) 621-1009,mytccustomsllc@outlook.com,https://treasurecoastcustomsllc.com/,"2131 SW Hayworth Ave, Port St. Lucie, FL 34952",Port St. Lucie,Fiberglass Repair,Gelcoat repair, fiberglass, marine customization
Sea Fix Marine,,,https://seafixmarineco.com/,,Vero Beach,Mobile Marine Service,Boat mechanic, mobile repairs Treasure Coast
West Marine Stuart,(772) 223-1515,Str01284@westmarine.com,https://www.westmarine.com/stores/stuart-fl-1284/,"2506 SE Federal Hwy, Stuart, FL 34994",Stuart,Marine Supply,Boating supplies, parts, fishing gear
Fort Pierce Yacht Club,(772) 461-9152,,https://www.fortpierceyachtclub.com/,"700 N Indian River Dr, Fort Pierce, FL 34950",Fort Pierce,Yacht Club,Promoting safe boating and community activities
Treasure Coast Barge Inc,(772) 220-3625,,https://www.treasurecoastbarge.com/,"1200 SE Dixie Cutoff Rd, Stuart, FL 34994",Stuart,Marine Construction,Boat lifts, seawalls, docks, decks, dredging
METCO Marine Electronics,(772) 600-5701,,https://boatplanet.com/pro/metco-marine-electronics-of-the-treasure-coast,"619 NW Baker Rd, Stuart, FL 34994",Stuart,Marine Electronics,Electronics installation and repair
Treasure Coast Marina Grant,(321) 733-3390,,http://www.treasurecoastmarina.net/,"5185 US Hwy 1, Grant, FL 32949",Grant,Marina,Fishing and boating community marina
Treasure Coast Marine Services Jensen Beach,(772) 341-7470,,http://www.treasurecoastmarineservices.com/,"1050 NE Dixie Hwy, Jensen Beach, FL 34957",Jensen Beach,Marine Service,Boat detailing, gelcoat, fiberglass repair
Treasure Coast Marine Services Vero Beach,(772) 341-7470,,http://www.treasurecoastmarineservices.com/,"1706 1st Pl, Vero Beach, FL 32962",Vero Beach,Marine Service,Boat detailing, gelcoat, fiberglass repair
Shearwater Boatyard,,,https://www.shearwaterfl.com/the-boatyard/,,Fort Pierce,Boatyard,Complete boatyard services, electrical, marine electronics
Fort Pierce Yacht Club,(772) 461-9152,,https://www.fortpierceyachtclub.com/,"700 N Indian River Dr, Fort Pierce, FL 34950",Fort Pierce,Yacht Club,Promoting safe boating and community activities
Treasure Coast Barge Inc,(772) 220-3625,,https://www.treasurecoastbarge.com/,"1200 SE Dixie Cutoff Rd, Stuart, FL 34994",Stuart,Marine Construction,Boat lifts, seawalls, docks, decks, dredging
METCO Marine Electronics,(772) 600-5701,,https://boatplanet.com/pro/metco-marine-electronics-of-the-treasure-coast,"619 NW Baker Rd, Stuart, FL 34994",Stuart,Marine Electronics,Electronics installation and repair
Treasure Coast Marina Grant,(321) 733-3390,,http://www.treasurecoastmarina.net/,"5185 US Hwy 1, Grant, FL 32949",Grant,Marina,Fishing and boating community marina
Treasure Coast Marine Services,(772) 341-7470,,http://www.treasurecoastmarineservices.com/,"1050 NE Dixie Hwy, Jensen Beach, FL 34957",Jensen Beach,Marine Service,Boat detailing, gelcoat, fiberglass repair
Shearwater Boatyard,,,https://www.shearwaterfl.com/the-boatyard/,,Fort Pierce,Boatyard,Complete boatyard services, electrical, marine electronics
Glenn's Trailer Sales,(772) 283-0401,,https://www.glennstrailers.com/,,Hobe Sound,Boat Trailer Sales,Horse, boat, cargo, utility trailers
Treasure Coast Boat Rentals,(772) 466-4680,tcboatrentals@outlook.com,https://treasurecoastboatrentals.com/,"601 Seaway Dr, Fort Pierce, FL 34949",Fort Pierce,Boat Rentals,B rentals at Causeway Cove Marina
Treasure Coast Marine Vero Beach,(772) 341-7470,,http://www.treasurecoastmarineservices.com/,"1706 1st Pl, Vero Beach, FL 32962",Vero Beach,Marine Service,Boat detailing, gelcoat, fiberglass repair
Lady Stuart Deep Sea Fishing,(772) 286-1860,,https://ladystuart.com/,"555 NE Ocean Blvd, Stuart, FL 34996",Stuart,Fishing Charter,Deep sea fishing party boat trips
Stuart Scuba,(772) 600-8288,,https://www.stuartscuba.com/,"3317 SE Federal Hwy, Stuart, FL 34997",Stuart,Scuba Center,Scuba sales, service, training, charters
Treasure Coast Dive Center,(321) 733-3390,,https://tcdivecenter.com/,"8466 US Hwy 1, Vero Beach, FL 32967",Vero Beach,Scuba Center,Dive equipment, scuba classes, charters
D & M Welding Inc,(772) 287-1487,,https://www.dandmwelding.com/,,Stuart,Welding & Fabrication,Aluminum, steel, stainless welding since 1966
Affordable Mobile Welding,(772) 215-6273,,https://www.yelp.com/biz/affordable-mobile-welding-port-saint-lucie-2,"2461 SE Caligua Ave, Port Saint Lucie, FL 34952",Port St. Lucie,Welding,Mobile welding and metal fabrication
Treasure Coast Dive Charters,,https://visitstlucie.com/listing/treasure-coast-dive-charters/,"1002 Seaway Dr, Fort Pierce, FL 34949",Fort Pierce,Dive Charters,Scuba diving day trips and charters
Treasure Coast Boat Detailing,,https://www.tcboatdetailing.com/,,Stuart,Boat Detailing,Expert boat and yacht detailing services
Florida Finest Detailing LLC,(772) 435-2469,,https://www.floridasfinestdetailing.com/,,Jensen Beach,Boat Detailing,Auto, boat, RV detailing, ceramic coating
Maritime Sanitation Services,(954) 370-2628,,https://maritimesanitation.com/,,Galveston County,Marine Sanitation,Boat plumbing, pump out services since 1992
Marine Waste Management,(954) 370-2628,marine-waste@bellsouth.net,https://www.florida-pumpout.com/,,South Florida,Marine Waste Management,Pump out services for marine vessels
Marine and RV Pumping To Go,,,https://marineandrvpumpingtogo.com/,,South Florida,Pump Out Services,Marine waste pump out services across Florida
Island Restrooms Suites,,,https://islandrestrooms.com/rv-and-boat-pump-out-service/,,Multiple,Marine Pump Out,RV and boat pump-out services
Mast Electric Inc,(772) 485-2677,,https://www.mastelectricinc.com/marine-electrician/,Stuart,Marine Electric,Marine electrician services - 15 years experience, ABYC certified
TC Marine Electronics,,,https://tcmarinefl.com/,,Stuart,Marine Electronics,Electronics troubleshooting, refits - latest electronics upgrades
Blair Propeller & Marine Service,,,https://blairpropeller.com/,,Stuart,Propeller Repair,Propeller shaft repair, custom building
Treasure Coast Fasteners,(305) 846-3390,,http://www.treasurecoastfasteners.com/,"1872 E Merritt Island Cwy, Merritt Island, FL 32952",Merritt Island,Marine Hardware,Fasteners and hardware distributor
Sea Tow Treasure Coast,,https://seatow.com/treasure-coast/,"1050 NE Dixie Hwy, Jensen Beach, FL 34957",Jensen Beach,Marine Towing,Professional on-water assistance and boat towing
Treasure Coast Propellers,,,https://tcpropscan.com/,,Stuart,Marine Propellers,Propeller repair, custom building
The Classic Marine,,,https://theclassicmarine.com/,,Stuart,Marine AC,Serving Southeast Florida - marine air conditioning, refrigeration
Ocean Breeze Marine A/C,,,https://www.oceanbreezemarineco.com/,,Multiple,Marine AC,Premium air conditioning, heating, refrigeration
Marine 1 AC,,https://marine1ac.com/,,Multiple,Marine AC,Marine air conditioning, refrigeration for South Florida
Loggerhead Club and Marina,(772) 692-4000,,https://loggerheadmarinas.com/marina/riverwatch-marina,,Stuart,Marina,373 dry storage and wet slips, fuel dock, boat club
SunCoast Marine Surveyor,(772) 210-4168,,https://suncoastmarinesurveyor.com/martin-county/,Martin County,Marine Surveyor,Boat surveyor serving Vero Beach to Hobe Sound
A&L Marine Surveyors,(727) 647-7112,captalainer@almarinesurveyors.com,https://www.almarinesurveyors.com/,,Multiple,Marine Surveyors,Boat inspections appraisals throughout Florida
Dockside Marine Surveyors,,,https://www.docksidemarinesurveyors.com/,,Multiple,Marine Surveyors,Professional marine surveying with sea trials
Hinckley Yacht Services Stuart,(772) 287-0923,,https://www.hinckleyyachts.com/location/stuart-florida/,"4550 SE Boatyard Ave, Stuart, FL 34997",Stuart,Yacht Services,Luxury yacht repair, boatyard services, marina slips
Hinckley Yacht Services Port St. Lucie,(772) 287-0923,,https://www.hinckleyyachts.com/location/stuart-florida/,"4550 SE Boatyard Dr, Port St. Lucie, FL 34952",Port St. Lucie,Yacht Services,Luxury yacht repair, boatyard services, marina slips