business_name,phone,email,website,address,city,state,category,source,date_found,priority,contacted,notes,lead_type,market_phase
PLATFORM LIMITATION - Nextdoor Private,NO_EMAIL,NO_EMAIL,https://nextdoor.com,Stuart,FL,Platform Limitation - Nextdoor,web_search,2026-02-25,N/A No,Nextdoor requires verified local address proof of residency to view content. Discussions only visible to verified local members. No public indexing by search engines. No warm referral leads found.,N/A Phase 1
PLATFORM LIMITATION - Facebook Groups Private,NO_EMAIL,NO_EMAIL,https://facebook.com,Port St Lucie,FL,Platform Limitation - Facebook Groups,web_search,2026-02-25,N/A No,Facebook group content is not indexed by search engines. Requires group membership to view posts and discussions. No contractor recommendation threads found via public search.,N/A Phase 1
PLATFORM LIMITATION - No Local Forums Found,NO_EMAIL,NO_EMAIL,N/A,Treasure Coast,FL,Platform Limitation - Local Forums,web_search,2026-02-25,N/A No,No indexed local Treasure Coast forums found for contractor recommendations. Reddit r/PortStLucie and r/TreasureCoast either don't exist or have no recent contractor recommendation posts.,N/A Phase 1
RESEARCH SUMMARY - Forum Search Failed,NO_EMAIL,NO_EMAIL,N/A,Treasure Coast,FL,Research Summary,web_search,2026-02-25,N/A No,Searched for: who does epoxy Stuart FL, garage floor coating Treasure Coast, handyman recommendations Palm City, kitchen remodel Port St Lucie. All searches returned zero results for local forum discussions. Nextdoor and Facebook are private platforms not indexed by search engines. No warm referral leads found via public web search. Alternative strategy: direct outreach and lead generation via websites,craigslist,business directories recommended.,N/A Phase 1
BUSINESS LEAD - Superior Floor Coating,NO_EMAIL,NO_EMAIL,https://superiorfloorcoating.com/transform-dull-concrete-into-art-with-a-custom-metallic-epoxy-garage-finish/,Suite 5 Port Saint Lucie FL 34986,Port Saint Lucie,FL,Epoxy Flooring Business,web_search,2026-02-25,Medium No,Local epoxy flooring company in Port Saint Lucie. Found while searching for forum discussions. Not a warm lead - this is a competitor business listing. May be potential partner or subcontractor opportunity for KMJK.,Competitor/Partner Phase 1
