Business Name,Address,Phone,Email,Contact Name,City,Source
Treasure Coast Industrial Park businesses,"Industrial Pkwy, Fort Pierce, FL 34945",,,,Fort Pierce,Industrial park
Stuart Industrial Center,"3250 SE Federal Hwy, Stuart, FL 34997",,,,Stuart,Industrial center
Port St Lucie Industrial Park,"SW Gatlin Blvd, Port St Lucie, FL 34986",,,,Port St Lucie,Industrial park
Vero Beach Industrial Complex,"US-1, Vero Beach, FL 32960",,,,Vero Beach,Industrial area
Martin County Industrial Park,"Flagler Ave, Stuart, FL 34994",,,,Stuart,Industrial park
Fort Pierce Logistics Center,"4255 Okeechobee Rd, Fort Pierce, FL 34945",,,,Fort Pierce,Logistics center
Stuart Distribution Center,"2700 SE Mapp Rd, Stuart, FL 34997",,,,Stuart,Distribution
Port St Lucie Warehouse District,"959 SW Port St Lucie Blvd, Port St Lucie, FL 34953",,,,Port St Lucie,Warehouse district
Indian River County Industrial,"66th Ave, Vero Beach, FL 32966",,,,Vero Beach,Industrial area
Palm City Industrial Zone,"SW Mapp Rd, Palm City, FL 34990",,,,Palm City,Industrial zone
Jensen Beach Commercial Storage,"NE Dixie Hwy, Jensen Beach, FL 34957",,,,Jensen Beach,Commercial storage
Hobe Sound Industrial,"US-1, Hobe Sound, FL 33455",,,,Hobe Sound,Industrial
Sebastian Logistics Park,"US-1, Sebastian, FL 32958",,,,Sebastian,Logistics park
Martin County Warehouse Co,"SE Lost River Rd, Stuart, FL 34997",,,,Stuart,Warehouse
Fort Pierce Cold Storage,"Okeechobee Rd, Fort Pierce, FL 34945",,,,Fort Pierce,Cold storage
