business_name,phone,email,website,city,category,source,notes,outreach_method,priority
Kitchen Remodeler Request - Reddit,,https://www.reddit.com/r/PortStLucie/comments/1ilm4hz/kitchen_remodeler/,Port St Lucie,Warm Referral - Homeowner Request,Reddit Direct Request,"Reddit post Feb 2025: Direct homeowner request for kitchen remodeler/cabinet hanger/contractor. ACTIVELY SEEKING SERVICES.",Reddit comment,HIGH
Bathroom Remodel GC Request - Reddit,,https://www.reddit.com/r/PortStLucie/comments/1h985qw/bathroom_remodel_gc_recommendations/,Port St Lucie,Warm Referral - Homeowner Request,Reddit Direct Request,"Reddit post Dec 2024: Looking to hire Florida contractor for bathroom project. ACTIVELY SEEKING CONTRACTOR.",Reddit comment,HIGH
Handyman Request - Vero Beach,,https://www.reddit.com/r/PortStLucie/comments/1jcv4ua/handyman_organizer_recommendations/,Vero Beach,Warm Referral - Homeowner Request,Reddit Direct Request,"Reddit post March 2025: Handyman and organizer recommendations in Vero Beach area. ACTIVELY SEEKING SERVICES.",Reddit comment,HIGH
KG Concrete & Development,,https://nextdoor.com/pages/kg-concrete-development-port-st-lucie-fl/,Port St Lucie,Warm Referral - Neighbor Recommended,Nextdoor Neighbor Recommendation,"Nextdoor business with 13 FAVES from neighbors. High-quality concrete work. STRONG NEIGHBOR RECOMMENDATIONS.",Nextdoor message/website contact,HIGH
Grande Construction Inc,,https://nextdoor.com/pages/grande-construction-port-st-lucie-fl/,Port St Lucie,Warm Referral - Neighbor Recommended,Nextdoor Neighbor Recommendation,"Nextdoor business: One of Florida's most meticulous and detail-oriented general contractors. STRONG LOCAL REPUTATION.",Nextdoor message/website contact,HIGH
Ocean Home Builders,,https://us.nextdoor.com/pages/ocean-home-builders-port-saint-lucie-fl/,Port St Lucie,Warm Referral - Neighbor Recommended,Nextdoor Neighbor Recommendation,"Nextdoor business: Full-service contractor (electrical, plumbing, HVAC, drywall, framing, kitchen, bathrooms).",Nextdoor message/website contact,HIGH
SWAT Contractor INC,,https://nextdoor.com/pages/swat-port-st-lucie-fl/,Port St Lucie,Warm Referral - Neighbor Recommended,Nextdoor Neighbor Recommendation,"Nextdoor business with 5 FAVES: 30 years in business. Screen enclosures, hurricane shutters, windows, doors.",Nextdoor message/website contact,HIGH
Sanders Screening and Repair Inc,772-238-6754,,Stuart,Warm Referral - Neighbor Recommended,Nextdoor Neighbor Recommendation,Neighbor-recommended screen repair service in Stuart.,Phone call,HIGH
Entry Point of The Treasure Coast,772-463-6500,,Stuart,Warm Referral - Neighbor Recommended,Nextdoor Neighbor Recommendation,Neighbor-recommended door replacement service in Stuart.,Phone call,HIGH
South Stuart Remodeler,772-200-8480,,Stuart,Warm Referral - Neighbor Recommended,Nextdoor Neighbor Recommendation,Neighbor-recommended general remodeling contractor in Stuart.,Phone call,HIGH
