id,business_name,email,phone,website,city,state,metro,region,category,lead_type,priority,source,notes,verified,verified_date,verified_result,send_status,approved_date,sent_date,created_at,updated_at,contact_name
5086,"Cheap Storage Units in Vero Beach, FL (from $14)",,,https://www.extraspace.com/storage/facilities/us/florida/vero_beach/,Vero Beach,FL,Vero Beach,Southeast,cold storage facility,client,Medium,brave_national,Snippet: We recommend renting a climate-controlled unit to protect any temperature sensitive items from extreme heat or cold. Our Vero Beach storage facilities,0,,,new,,,2026-02-13 06:43:52,2026-02-13 06:43:52,
5087,"Self Storage Units in Vero Beach, FL, at 8545 20th St",,,https://www.attic60selfstorage.com/,Vero Beach,FL,Vero Beach,Southeast,cold storage facility,client,Medium,brave_national,"Snippet: We’re Vero Beach’s local, family-owned and operated self storage solution. Our storage facility features air-conditioned and non-air-conditioned self ",0,,,new,,,2026-02-13 06:43:52,2026-02-13 06:43:52,
5088,Pre-Owned Dealership in Port St Lucie FL,,772-675-6775,https://www.commutercars.net/,Port St. Lucie,FL,Port St. Lucie,Southeast,auto dealership,client,Medium,brave_national,Snippet: Commuter Cars - Port St Lucie of Port St. Lucie FL serving Fort Pierce is one of the best pre-owned dealerships in FL. Call Sales 772-675-6775,0,,,new,,,2026-02-13 06:43:55,2026-02-13 06:43:55,
5100,Manufacturing,,,https://youredc.com/manufacturing,Fort Pierce,FL,Fort Pierce,Southeast,manufacturing plant,client,Medium,brave_national,"Snippet: 1790 SW Gatlin Blvd., Suite 202 Port St. Lucie, FL 34953 · A-1 Industries of Florida, Inc. is the premier roof truss supplier in Florida. The company ",0,,,new,,,2026-02-13 06:43:57,2026-02-13 06:43:57,
5102,"Manufacturing Companies in Fort Pierce, FL",,,https://www.clearlyrated.com/manufacturing/fl-usa/fort-pierce-fl,Fort Pierce,FL,Fort Pierce,Southeast,manufacturing plant,client,Medium,brave_national,"Snippet: Discover Fort Pierce manufacturing companies specializing in automotive, electronics, natural resources and more in Fort Pierce, Florida.",0,,,new,,,2026-02-13 06:43:57,2026-02-13 06:43:57,
5104,Construction Materials,,(772) 461-1243,https://www.thebluebook.com/iProView/272947/construction-materials/material-suppliers/locations-contacts/,Fort Pierce,FL,Fort Pierce,Southeast,manufacturing plant,client,Medium,brave_national,"Snippet: Home Florida-South-West Palm Beach, Miami, Naples Building Materials · C · Fort Pierce, FL 34946 · Pre-Qual · Home Contact Us · Portfolio · Gallery · ",0,,,new,,,2026-02-13 06:43:57,2026-02-13 06:43:57,
5106,Fort Pierce Concrete Block Plant,,,https://www.cemexusa.com/w/fort-pierce-concrete-block-plant,Fort Pierce,FL,Fort Pierce,Southeast,manufacturing plant,client,Medium,brave_national,"Snippet: Fort Pierce Concrete Block Plant, located on W Midway Rd near the Florida Turnpike, specializes in supplying concrete block for virtually all types of",0,,,new,,,2026-02-13 06:43:57,2026-02-13 06:43:57,
5163,Rumirs Day Spa and Salon,,,https://www.rumirsdayspa.com/,Fort Pierce,FL,Fort Pierce,Southeast,salon spa,client,Medium,brave_national,"Snippet: Rumirs Day Spa and Salon is a full-service body treatment center and salon in the heart of historic Ft. Pierce, Florida. We offer a wide variety of sp",0,,,new,,,2026-02-13 06:44:12,2026-02-13 06:44:12,
5164,Welcome,,,https://bellacorpospa.com/,Fort Pierce,FL,Fort Pierce,Southeast,salon spa,client,Medium,brave_national,"Snippet: She created a fusion between the influence and knowledge from south America, and the north American skin and body care model industry by developing he",0,,,new,,,2026-02-13 06:44:12,2026-02-13 06:44:12,
5165,Contact Us,split_enz_salon@yahoo.com,772-462-2420,https://www.splitenzsalonspa.com/contact/contact-us/,Fort Pierce,FL,Fort Pierce,Southeast,salon spa,client,High,brave_national,"Snippet: (near the Fort Pierce Inlet where A1A splits in two, between Sharky&#x27;s and Cumberland Farms) <strong>Split Enz Salon &amp; Spa</strong> on Hutchin",0,,,new,,,2026-02-13 06:44:12,2026-02-13 06:44:12,
5166,Drift Away Massage & Spa,,772.361.6288,https://www.driftawaymassage.org/,Fort Pierce,FL,Fort Pierce,Southeast,salon spa,client,Medium,brave_national,"Snippet: ©2019-2020 <strong>Drift Away Massage and Spa</strong> · 772.361.6288 · 320 Avenue A Fort Pierce, FL 34950 ·",0,,,new,,,2026-02-13 06:44:12,2026-02-13 06:44:12,
5167,Relentless Salon,,(772) 708-1515,http://www.relentlesssalon.com/,Fort Pierce,FL,Fort Pierce,Southeast,salon spa,client,Medium,brave_national,"Snippet: Fort Pierce, FL, 34950 · (772) 708-1515 · Your Custom Text Here · To follow us on IG for inspiration and on FB for BTS action and tranformations, clic",0,,,new,,,2026-02-13 06:44:12,2026-02-13 06:44:12,
5169,Derma Tech Day Spa,,,https://dermatechdayspa.com/,Fort Pierce,FL,Fort Pierce,Southeast,salon spa,client,Medium,brave_national,"Snippet: 210 Orange Avenue, Fort Pierce, Florida 34950, United States · Send a gift card to friends and family. Copyright © 2022 Derma Tech Day Spa - All Right",0,,,new,,,2026-02-13 06:44:12,2026-02-13 06:44:12,
5192,"Cameron's British Foods in Cape Coral, FL 33909",,239-772-1554,https://www.chamberofcommerce.com/business-directory/florida/cape-coral/gourmet-grocery-store/2000554263-cameron-s-british-foods,Cape Coral,FL,Cape Coral,Southeast,grocery store manager,client,Medium,brave_national,"Snippet: A Cameron&#x27;s British Foods is located at 928 NE 24th Ln, Cape Coral, FL 33909 · A The website (URL) for Cameron&#x27;s British Foods is: https://w",0,,,new,,,2026-02-13 06:44:19,2026-02-13 06:44:19,
5195,Oliver's Plumbing.,,(772) 564-0011,https://www.oliversplumbinginc.com/,Vero Beach,FL,Vero Beach,Southeast,plumber,contractor,Medium,brave_national,"Snippet: Full-service plumbing company in Vero Beach, FL. Licensed and insured for repairs, remodels, renovations, new construction, whole-house re-pipes, and ",0,,,new,,,2026-02-13 06:44:22,2026-02-13 06:44:22,
5196,Vero Beach Plumbers,,,https://verobeachplumbers.com/,Vero Beach,FL,Vero Beach,Southeast,plumber,contractor,Medium,brave_national,Snippet: From upgrading old fixtures to installing brand-new plumbing during a remodel—we ensure everything flows smoothly. Keep your business running with rel,0,,,new,,,2026-02-13 06:44:22,2026-02-13 06:44:22,
5197,"Plumbers Vero Beach, Ft. Pierce & Sebastian FL",,772 564 6980,https://www.southernplumbinginc.com/,Vero Beach,FL,Vero Beach,Southeast,plumber,contractor,Medium,brave_national,"Snippet: At Southern Plumbing, our experienced plumbing contractor are available 24/7 to solve your plumbing problems. Call @ 772 564 6980 to get Free estimate",0,,,new,,,2026-02-13 06:44:22,2026-02-15 06:49:39,V4_NO_DATA
5198,Welcome to Snyder Plumbing,,772-569-3373,https://www.snyderplumbing.com/,Vero Beach,FL,Vero Beach,Southeast,plumber,contractor,Medium,brave_national,"Snippet: 1360 Old Dixie Hwy SW Suite 106 Vero Beach, FL 32962 Vero Beach: 772-569-3373 Sebastian: 772-388-6131",0,,,new,,,2026-02-13 06:44:22,2026-02-13 06:44:22,
5199,"Licensed Plumber, Emergency Plumbing Service",,772-473-4339,https://www.morrisonplumbingservice.net/,Vero Beach,FL,Vero Beach,Southeast,plumber,contractor,Medium,brave_national,Snippet: Call <strong>772-473-4339</strong> now to discuss your project with our licensed plumbers.,0,,,new,,,2026-02-13 06:44:22,2026-02-13 06:44:22,
5200,Plumber Vero Beach FL,,(772) 925-3093,https://www.rotorooter.com/verobeachfl/,Vero Beach,FL,Vero Beach,Southeast,plumber,contractor,Medium,brave_national,"Snippet: Roto-Rooter is the trusted plumber in Vero Beach, FL providing 24-hour emergency plumbing &amp; drain services. Call Roto-Rooter at (772) 925-3093 for",0,,,new,,,2026-02-13 06:44:22,2026-02-13 06:44:22,
5201,Plumbing Services Vero Beach FL| Plumber & Water Heaters,,772-564-6980,https://www.southernplumbinginc.com/vero-beach-fl,Vero Beach,FL,Vero Beach,Southeast,plumber,contractor,Medium,brave_national,"Snippet: 4069 43rd Ave Vero Beach, FL 32960 Tel: 772-564-6980",0,,,new,,,2026-02-13 06:44:22,2026-02-13 06:44:22,
5202,"Plumber in Vero Beach, FL",,772-292-7687,https://www.thetrademarkplumber.com/vero-beach-fl/,Vero Beach,FL,Vero Beach,Southeast,plumber,contractor,Medium,brave_national,"Snippet: When you need a dependable plumber in Vero Beach, FL, trust our licensed and experienced team to deliver exceptional service. Contact us today at 772-",0,,,new,,,2026-02-13 06:44:22,2026-02-13 06:44:22,
5203,"Plumbers in Vero Beach & Sebastian, FL",,,https://bobbysplumbing.com/,Vero Beach,FL,Vero Beach,Southeast,plumber,contractor,Medium,brave_national,"Snippet: The Vero Beach plumbers at Bobby’s Plumbing, Inc. are the convenient and reliable choice. We’re available 24/7. Call now for help in Vero Beach, Sebas",0,,,new,,,2026-02-13 06:44:22,2026-02-13 06:44:22,
5204,H&H Plumbing,,,https://www.besharpcallharp.com/,Vero Beach,FL,Vero Beach,Southeast,plumber,contractor,Medium,brave_national,Snippet: Contact H&amp;H Plumbing for all your sewer repair work.,0,,,new,,,2026-02-13 06:44:22,2026-02-13 06:44:22,
5270,Expert Plumbing Contractor,,(772) 287-0131,https://www.stuartplumbing.com/,Stuart,FL,Stuart,Southeast,plumber,contractor,Medium,brave_national,"Snippet: Find the best in plumbing and metal services in Stuart, FL, when you call Stuart Plumbing at (772) 287-0131 for a name you can trust.",0,,,new,,,2026-02-13 06:44:40,2026-02-13 06:44:40,
5271,"Dave's Plumbing,.",,(772) 287-8128,https://business.stuartmartinchamber.org/members/member/dave-s-plumbing-inc-472,Stuart,FL,Stuart,Southeast,plumber,contractor,Medium,brave_national,Snippet: 499 S.E. Seville Street Stuart FL 34994 · <strong>(772) 287-8128</strong> · Send Email · www.davesplumbinginc.com · × · × · Close · Send an Email · × ,0,,,new,,,2026-02-13 06:44:40,2026-02-13 06:44:40,
5272,Get In Touch,,(772) 287-0131,https://www.stuartplumbing.com/contact-us/,Stuart,FL,Stuart,Southeast,plumber,contractor,Medium,brave_national,"Snippet: Contact Stuart Plumbing today for complete commercial and residential plumbing services in the Stuart, Florida area. Call (772) 287-0131 for immediate",0,,,new,,,2026-02-13 06:44:40,2026-02-13 06:44:40,
5273,Home 2,,(772) 223-8688,https://www.theplumbingco.net/,Stuart,FL,Stuart,Southeast,plumber,contractor,Medium,brave_national,Snippet: Stuart · Port St Lucie · Contact Us · Blog · Call Today! (772) 223-8688 · Plumbing · Kitchen Plumbing Services · Emergency Plumbing Service · Plumbing,0,,,new,,,2026-02-13 06:44:40,2026-02-13 06:44:40,
5274,Plumber Stuart FL,,,https://www.qualityplumbingdrains.com/contact-us,Stuart,FL,Stuart,Southeast,plumber,contractor,Medium,brave_national,"Snippet: Quality Plumbing &amp; Drains, Inc. of Stuart FL, is a family owned and locally operated company that has been serving Martin and St. Lucie Counties, ",0,,,new,,,2026-02-13 06:44:40,2026-02-13 06:44:40,
5275,"Plumber in Stuart, FL",,772-292-7687,https://www.thetrademarkplumber.com/stuart-fl/,Stuart,FL,Stuart,Southeast,plumber,contractor,Medium,brave_national,"Snippet: When you need a reliable and professional plumber in Stuart, FL, look no further. Trademark Plumbing is dedicated to delivering high-quality services ",0,,,new,,,2026-02-13 06:44:40,2026-02-13 06:44:40,
5276,"Reliable Plumber serving Stuart, Hobe Sound and surrounding area",,(772) 283-8640,https://martincountyplumbing.com/,Stuart,FL,Stuart,Southeast,plumber,contractor,Medium,brave_national,"Snippet: You’ve come to the right place when looking for a Stuart FL plumber! Dylewski Plumbing does it all, from emergency plumbing to water heater solutions.",0,,,new,,,2026-02-13 06:44:40,2026-02-13 06:44:40,
5278,Plumbing Services,,(772) 287-0131,https://www.stuartplumbing.com/general-plumbing/,Stuart,FL,Stuart,Southeast,plumber,contractor,Medium,brave_national,"Snippet: For all of your general commercial and residential plumbing needs, look no further than Stuart Plumbing of Stuart, Fl. Call (772) 287-0131 to learn mo",0,,,new,,,2026-02-13 06:44:40,2026-02-14 12:31:37,V4_NO_DATA
5359,"Ocean Resorts Co-op,.",,772-464-4803,https://www.oceanresortsco-opinc.org/,Fort Pierce,FL,Fort Pierce,Southeast,hotel resort manager,client,Medium,brave_national,"Snippet: Contact Us: 5101 N. Highway A1A Fort Pierce, FL 34949 772-464-4803",0,,,new,,,2026-02-13 06:45:02,2026-02-13 06:45:02,
5360,DP Hotel Group,,,https://www.dphotelsgroup.com/,Fort Pierce,FL,Fort Pierce,Southeast,hotel resort manager,client,Medium,brave_national,"Snippet: Learn more about our hotel management chain located in Fort Pierce, Florida.",0,,,new,,,2026-02-13 06:45:02,2026-02-13 06:45:02,
5361,Waterfront Hotel,,(800)286-1745,https://docksideinn.com/,Fort Pierce,FL,Fort Pierce,Southeast,hotel resort manager,client,Medium,brave_national,"Snippet: “Dockside Resort is Now Open” · BOOK YOUR · Reserve Your Suite · 1160 Seaway Drive , S. Hutchinson Island , Fort Pierce, FL 34949 · Toll Free (800)286",0,,,new,,,2026-02-13 06:45:02,2026-02-13 06:45:02,
5362,"Hampton Inn & Suites Fort Pierce, FL Hotel",,,https://www.hilton.com/en/hotels/ftphshx-hampton-suites-ft-pierce/,Fort Pierce,FL,Fort Pierce,Southeast,hotel resort manager,client,Medium,brave_national,"Snippet: Highway location gives easy access to islands &amp; beaches, downtown waterfront, local attractions &amp; all attractions to the Treasure Coast &amp; ",0,,,new,,,2026-02-13 06:45:02,2026-02-13 06:45:02,
5363,Fort Pierce Hotel near Hutchinson Island,,,https://www.ihg.com/holidayinnexpress/hotels/us/en/fort-pierce/fprtp/hoteldetail,Fort Pierce,FL,Fort Pierce,Southeast,hotel resort manager,client,Medium,brave_national,"Snippet: Nestled between I-95 and the Florida Turnpike, the Holiday Inn Express® &amp; Suites Fort Pierce West hotel provides easy access to the area&#x27;s mo",0,,,new,,,2026-02-13 06:45:02,2026-02-13 06:45:02,
5364,Hutchinson Island Hotel & Suites,,,https://hutchinsonislandhotelandsuites.com/,Fort Pierce,FL,Fort Pierce,Southeast,hotel resort manager,client,Medium,brave_national,"Snippet: Offering clean, comfortable rooms just steps away from the beaches, restaurants and activities that Fort Pierce has to offer. The Hutchinson Island Ho",0,,,new,,,2026-02-13 06:45:02,2026-02-13 06:45:02,
5365,HOME,,,https://visitoceanfront.com/,Fort Pierce,FL,Fort Pierce,Southeast,hotel resort manager,client,Medium,brave_national,Snippet: The only resort in st lucie County that is actually ON the beach! It&#x27;s got absolutely beautiful views of the inlet and beach. ... Discover the ti,0,,,new,,,2026-02-13 06:45:02,2026-02-13 06:45:02,
5366,"Hotels in Fort Pierce, FL",,,https://www.hilton.com/en/locations/usa/florida/fort-pierce/,Fort Pierce,FL,Fort Pierce,Southeast,hotel resort manager,client,Medium,brave_national,"Snippet: Explore Hotels in Fort Pierce, FL. Search by destination, check the latest prices, or use the interactive map to find the location for your next stay.",0,,,new,,,2026-02-13 06:45:02,2026-02-13 06:45:02,
5367,Fort Pierce Hotels,,,https://www.ihg.com/fort-pierce-florida,Fort Pierce,FL,Fort Pierce,Southeast,hotel resort manager,client,Medium,brave_national,"Snippet: IHG Hotels offer a variety of amenities such as free Wi-Fi, fitness centers, business centers, restaurants/bars, and much more! IHG has 1 hotels in Fo",0,,,new,,,2026-02-13 06:45:02,2026-02-13 06:45:02,
5368,"Hotel in Fort Pierce, FL",,,https://www.choicehotels.com/florida/fort-pierce/comfort-suites-hotels/fl733,Fort Pierce,FL,Fort Pierce,Southeast,hotel resort manager,client,Medium,brave_national,Snippet: The Comfort Suites® hotel in Fort Pierce offers an array of amenities and spacious suites in a convenient location. Located between Interstate 95 and ,0,,,new,,,2026-02-13 06:45:02,2026-02-13 06:45:02,
5389,Fort Made,,,https://www.cityoffortpierce.com/806/Fort-Made,Fort Pierce,FL,Fort Pierce,Southeast,retail store owner,client,Medium,brave_national,"Snippet: I think how we relate to people is kind of a reflection of Fort Pierce and the people that live here. It has that warm, realistic vibe happening and a",0,,,new,,,2026-02-13 06:45:09,2026-02-13 06:45:09,
5390,"Best Retail Stores in Fort Pierce, FL",,,https://www.chamberofcommerce.com/business-directory/florida/fort-pierce/shopping/retail-stores/,Fort Pierce,FL,Fort Pierce,Southeast,retail store owner,client,Medium,brave_national,"Snippet: 1102 S US Hwy 1 Fort Pierce, FL 34950 · Anthony Cartagena Soto Sep 29th, 2024 · 09/28/24 5pm I will recommend this place the owner is great peoplealwa",0,,,new,,,2026-02-13 06:45:09,2026-02-13 06:45:09,
5392,Fort Pierce in,,(772) 464-7050,https://shopjetson.com/locations/fort-pierce,Fort Pierce,FL,Fort Pierce,Southeast,retail store owner,client,Medium,brave_national,"Snippet: Contact Your Store · Tracking · Wishlist · Cart · Loading map... Get Directions · 4145 S US Highway 1 · Fort Pierce, FL · 34982 · Phone: (772) 464-705",0,,,new,,,2026-02-13 06:45:09,2026-02-13 06:45:09,
5394,"Clothing Store in Fort Pierce, 34982",,844-572-4626,https://stores.rainbowshops.com/fl/fort-pierce/127/,Fort Pierce,FL,Fort Pierce,Southeast,retail store owner,client,Medium,brave_national,"Snippet: What kinds of kids shoes are available at Rainbow Stores in Fort Pierce, FL? Our Rainbow Shops store carries a variety of kids shoes, including sneake",0,,,new,,,2026-02-13 06:45:09,2026-02-13 06:45:09,
5395,"Staff Directory • Fort Pierce, FL • CivicEngage",,772-467-3000,https://cityoffortpierce.com/Directory.aspx,Fort Pierce,FL,Fort Pierce,Southeast,retail store owner,client,Medium,brave_national,"Snippet: Create a Website Account - Manage notification subscriptions, save form progress and more · City of Fort Pierce 100 N U.S. Highway 1 Fort Pierce, FL 3",0,,,new,,,2026-02-13 06:45:09,2026-02-13 06:45:09,
5398,Casa Pasta,,,https://fortcasapasta.com/,Fort Pierce,FL,Fort Pierce,Southeast,restaurant owner,client,Medium,brave_national,"Snippet: Contact Casa Pasta via phone, email, or visit us in person. We look forward to serving you. ... At Casa Pasta, we are dedicated to providing an authen",0,,,new,,,2026-02-13 06:47:32,2026-02-13 06:47:32,
5401,Restaurant,,,https://www.ontheedgebarandgrill.com/,Fort Pierce,FL,Fort Pierce,Southeast,restaurant owner,client,Medium,brave_national,Snippet: We are a family owned business who is passionate to provide a memorable dining experience &quot;On The Edge&quot; of The Fort Pierce Inlet. ... We are,0,,,new,,,2026-02-13 06:47:32,2026-02-13 06:47:32,
5403,Hutchinson Island Bar & Grille Restaurant Review,,(772) 242-8928,https://treasurecoastfoodie.com/hutchinson-island-restaurant-review-fort-pierce-fl/,Fort Pierce,FL,Fort Pierce,Southeast,restaurant owner,client,Medium,brave_national,"Snippet: Hutchinson Island Bar and Grille Address: 2400 S Ocean Dr, Fort Pierce, FL 34949 Phone: (772) 242-8928 https://hutchinsonislandbarandgrille.com/ Keywo",0,,,new,,,2026-02-13 06:47:32,2026-02-13 06:47:32,
5405,2nd Street Bistro is a unique open-air Restaurant in FL,,,https://2ndstreetbistro.com/,Fort Pierce,FL,Fort Pierce,Southeast,restaurant owner,client,Medium,brave_national,"Snippet: Downtown Fort Pierce is a wonderful area where locals and visitors come to enjoy the amazing waterfront area, which includes The City Marina, The Sunr",0,,,new,,,2026-02-13 06:47:32,2026-02-13 06:47:32,
5471,All Around Handyman,,(772) 985-1792,https://all-around-handyman-1.ueniweb.com/,Fort Pierce,FL,Fort Pierce,Southeast,handyman service,contractor,Medium,brave_national,"Snippet: Send Message · Sunday · 9:00 ... · 9:00 AM - 6:00 PM · Saturday · 9:00 AM - 6:00 PM · Fort Pierce, Florida · <strong>(772) 985-1792</strong> · [email ",0,,,new,,,2026-02-13 06:47:50,2026-02-13 06:47:50,
5472,Handyman Service – Fort Pierce Fl,,(772) 321-7390,https://treasurecoasthomeimprovement.com/handyman-service-fort-pierce-fl/,Fort Pierce,FL,Fort Pierce,Southeast,handyman service,contractor,Medium,brave_national,Snippet: Treasure Coast Cabinetry &amp; More your one-stop Service for all your Handyman needs for the Fort Pierce Fl area. Call (772) 321-7390 Today,0,,,new,,,2026-02-13 06:47:50,2026-02-13 06:47:50,
5473,HANDYMAN SERVICES! (Fort Pierce),,,https://meetahandyman.com/care/handyman-services-fort-pierce-fl,Fort Pierce,FL,Fort Pierce,Southeast,handyman service,contractor,Medium,brave_national,Snippet: Your local handyman all flooring/drywall/ light plumbing and electrical !!!WE DO IT ALL!!! No job to big no job to small Competitive rates Call or tex,0,,,new,,,2026-02-13 06:47:50,2026-02-13 06:47:50,
5474,Handyman Services,,,https://theothermanhandymanllc.com/services/home-maintenance/handyman-services-150295128,Fort Pierce,FL,Fort Pierce,Southeast,handyman service,contractor,Medium,brave_national,Snippet: Your email · Your phone number · Tell me about your request · I agree with the Terms &amp; Conditions and the Privacy &amp; Cookies Policy of UENI and,0,,,new,,,2026-02-13 06:47:50,2026-02-15 14:33:25,V4_NO_DATA
5475,Sikorsky,,(561) 775-5200,https://members.pbnchamber.com/list/member/sikorsky-a-lockheed-martin-company-13216,Jupiter,FL,Jupiter,Southeast,aircraft hangar,client,Medium,brave_national,Snippet: Contact Us · Submit News and Events · Requests · ArtiGras · Aerospace and Aviation Manufacturing · 17900 Bee Line Hwy Jupiter FL 33478 · (561) 775-520,0,,,new,,,2026-02-13 06:47:52,2026-02-13 06:47:52,
5476,General Aviation,,,https://www.pbia.org/general-aviation/,Jupiter,FL,Jupiter,Southeast,aircraft hangar,client,Medium,brave_national,Snippet: North Palm Beach County General Aviation Airport (F45) is located in the north portion of the county and provides easy access to the Florida Research ,0,,,new,,,2026-02-13 06:47:52,2026-02-13 06:47:52,
5478,Home Hangar Trader,,,https://www.hangartrader.com/find-hangars/florida,Jupiter,FL,Jupiter,Southeast,aircraft hangar,client,Medium,brave_national,Snippet: List My Hangar for Sale · Brokerage · Auction · Direct Mail · Company · About Us · Testimonials · Store · FAQ&#x27;s · Forum · Contact Us · Directory ,0,,,new,,,2026-02-13 06:47:52,2026-02-13 06:47:52,
5479,ABOUT US – globalaircrafts.com,,,https://globalaircrafts.com/about-us/,Jupiter,FL,Jupiter,Southeast,aircraft hangar,client,Medium,brave_national,"Snippet: Global Aircraft is headquartered at Miami-Opa Locka Airport, Florida, where our main office and state of the art aircraft hangar are located. Global A",0,,,new,,,2026-02-13 06:47:52,2026-02-13 06:47:52,
5480,Jupiter Island Private Jet Charter Flights,charter@paramountbusinessjets.com,877-727-2538,https://www.paramountbusinessjets.com/private-jet-charter/city/jupiter-island-fl-usa,Jupiter,FL,Jupiter,Southeast,aircraft hangar,client,High,brave_national,"Snippet: For more information about Jupiter Island private jet charter services or to book a private jet flight, please call us at +1-877-727-2538, email at <s",0,,,new,,,2026-02-13 06:47:52,2026-02-13 06:47:52,
5481,Elite private aircraft for sale by Florida Jet Sales,Info@flajet.com,(561) 615-8231,http://www.flajet.com/,Jupiter,FL,Jupiter,Southeast,aircraft hangar,client,Low,brave_national,Snippet: Click here to contact us · We have buyers ready with cash. Our extensive experience brings exceptional expertise to those interested in an aircraft pu,0,,,new,,,2026-02-13 06:47:52,2026-02-14 04:26:16,NEEDS_ENRICHMENT
5482,Aviation Property Network,,,https://apn.aero/browse/US/FL,Jupiter,FL,Jupiter,Southeast,aircraft hangar,client,Medium,brave_national,Snippet: This page requires JavaScript to work properly. Please enable JavaScript in your browser,0,,,new,,,2026-02-13 06:47:52,2026-02-13 06:47:52,
5483,"Aviation Real Estate for Sale, Rent, or Lease",,,https://www.trade-a-plane.com/search?state=Florida&s-type=real_estate,Jupiter,FL,Jupiter,Southeast,aircraft hangar,client,Medium,brave_national,"Snippet: Aviation Real Estate for sale, rent, or lease. Search from 100&#x27;s of listings for Commercial Aviation Real Estate in Florida updated daily 1 - 24.",0,,,new,,,2026-02-13 06:47:52,2026-02-13 06:47:52,
5484,Business Directory,,,https://www.flyfxe.com/business/business-directory/-npage-4,Jupiter,FL,Jupiter,Southeast,aircraft hangar,client,Medium,brave_national,"Snippet: Address:3000 NW 59th St. Suite 200; Hangar 25 Fort Lauderdale, FL 33309",0,,,new,,,2026-02-13 06:47:52,2026-02-13 06:47:52,
5503,Rio Coco Beans,riococobeans@gmail.com,(772) 492-6794,https://riococobeans.com/,Vero Beach,FL,Vero Beach,Southeast,coffee shop cafe,client,High,brave_national,"Snippet: Vero Beach, FL 32960 (772) 492-6794 · <strong>riococobeans@gmail.com</strong> · Monday 9am-2:30pm · Tuesday 7:30am-2:30pm · Wednesday 7:30am-2:30pm · ",0,,,new,,,2026-02-13 06:47:58,2026-02-13 06:47:58,
5504,Contact Us – Rio Coco Beans,,,https://riococobeans.com/pages/contact-us,Vero Beach,FL,Vero Beach,Southeast,coffee shop cafe,client,Medium,brave_national,"Snippet: Mail -- PO Box 2151 Vero Beach, FL 32961 · Join the party by adding your email address to learn more about Rio Coco, coffee, and more! Close (esc) Cel",0,,,new,,,2026-02-13 06:47:58,2026-02-13 06:47:58,
5505,Main Home,,,https://coffeehouse1420.com/,Vero Beach,FL,Vero Beach,Southeast,coffee shop cafe,client,Medium,brave_national,Snippet: RELAX. RECHARGE. BELONG. At the corner of downtown. Coffee House 1420 is on the corner of 14th Avenue and 20th Street in Downtown Vero Beach.,0,,,new,,,2026-02-13 06:47:58,2026-02-13 06:47:58,
5506,Rio Coco Cafe Locations,,,https://riococobeans.com/pages/cafes,Vero Beach,FL,Vero Beach,Southeast,coffee shop cafe,client,Medium,brave_national,"Snippet: Join the party by adding your email address to learn more about Rio Coco, coffee, and more!",0,,,new,,,2026-02-13 06:47:58,2026-02-13 06:47:58,
