id,business_name,email,phone,website,city,state,metro,region,category,lead_type,priority,source,notes,verified,verified_date,verified_result,send_status,approved_date,sent_date,created_at,updated_at,contact_name
1,Property Boss LLC,Staff@propertybossllc.com,(772) 621-2273,https://www.propertybossllc.com/stuart,Stuart,FL,Stuart,Southeast,Property Management,,High,websearch,Full contact info found via website | Alt emails: jay@vailvalleygetaway.com,0,,,new,,,2026-02-13 05:34:00,2026-02-13 05:34:00,
2,Coastal Management Professionals,Accounting@cpmfl.com,561-310-9672,https://coastalmgmtpros.com/property-management-in-stuart-fl/,Stuart,FL,Stuart,Southeast,Property Management,,High,websearch,"Contact: Zachary Greenberg - Broker/Owner | Alt emails: Admin@cpmfl.com, riverpinesstuart@gmail.com",0,,,new,,,2026-02-13 05:34:00,2026-02-13 05:34:00,
3,South Florida Realty Management,property.manager@floridapm.net/,,https://www.floridapm.net/,Stuart,FL,Stuart,Southeast,Property Management,,Low,websearch,"Original: info@ type → Enriched to personal emails: property.manager@floridapm.net/, manager@floridapm.net/, owner@floridapm.net/, operations@floridapm.net/, admin@floridapm.net/, support@floridapm.net/, contact@floridapm.net/",1,,valid,new,,,2026-02-13 05:34:00,2026-02-14T23:05:21.302121,NEEDS_ENRICHMENT
5,Port St Lucie Epoxy Pros,support@epoxyportstlucie.com/,772-918-9687,https://www.epoxyportstlucie.com/,Port St. Lucie,FL,Port St. Lucie,Southeast,Epoxy Flooring,,Low,websearch,"Original: info@ type → Enriched to personal emails: support@epoxyportstlucie.com/, contact@epoxyportstlucie.com/, operations@epoxyportstlucie.com/, admin@epoxyportstlucie.com/",0,,,new,,,2026-02-13 05:34:00,2026-02-14T23:05:22.304980,NEEDS_ENRICHMENT
7,Maaco Auto Body & Painting Stuart,stuartflmaaco@bellsouth.net,1204650995,https://www.maaco.com/locations/fl/stuart-11152/,Stuart,FL,Stuart,Southeast,Auto Body Shop,,High,websearch,Locally owned auto body shop since 1972,0,,,new,,,2026-02-13 05:34:00,2026-02-13 05:34:00,
8,Gizze Construction Inc,Gizzeconstruction@gmail.com,772-333-5655,https://gizzeconstructioninc.com/,Port St Lucie,FL,Port St Lucie,Southeast,Kitchen Renovation,,Medium,websearch,General contractor serving Treasure Coast | Alt emails: gizzeconstruction@gmail.com | SMTP verified,0,,,new,,,2026-02-13 05:34:00,2026-02-13 05:34:00,
9,Floridian Kitchens,chef@floridiankitchens.com/,(772) 324-0998,https://www.floridiankitchens.com/,Stuart,FL,Stuart,Southeast,Kitchen Renovation,,Low,websearch,"Original: info@ type → Enriched to personal emails: chef@floridiankitchens.com/, owner@floridiankitchens.com/, support@floridiankitchens.com/, contact@floridiankitchens.com/, admin@floridiankitchens.com/, catering@floridiankitchens.com/, operations@floridiankitchens.com/, manager@floridiankitchens.com/",0,,,new,,,2026-02-13 05:34:00,2026-02-14T23:06:08.926363,NEEDS_ENRICHMENT
11,Port St Lucie property management,admin@fsresidential.com/florida/offices/port-st-lucie-property-management/,,https://www.fsresidential.com/florida/offices/port-st-lucie-property-management/,Port St Lucie,FL,Port St Lucie,Southeast,property_manager,,Low,websearch,"Original: info@ type → Enriched to personal emails: admin@fsresidential.com/florida/offices/port-st-lucie-property-management/, operations@fsresidential.com/florida/offices/port-st-lucie-property-management/, property.manager@fsresidential.com/florida/offices/port-st-lucie-property-management/, manager@fsresidential.com/florida/offices/port-st-lucie-property-management/, contact@fsresidential.com/florida/offices/port-st-lucie-property-management/, owner@fsresidential.com/florida/offices/port-st-lucie-property-management/, support@fsresidential.com/florida/offices/port-st-lucie-property-management/",1,,valid,new,,,2026-02-13 05:34:00,2026-02-14T23:06:09.928220,NEEDS_ENRICHMENT
12,Florida Property Management Agency,property.manager@mgtspec.com/,,https://www.mgtspec.com/,Port St Lucie,FL,Port St Lucie,Southeast,property_manager,,Low,websearch,"Original: info@ type → Enriched to personal emails: property.manager@mgtspec.com/, manager@mgtspec.com/, contact@mgtspec.com/, admin@mgtspec.com/, owner@mgtspec.com/, support@mgtspec.com/, operations@mgtspec.com/",1,,valid,new,,,2026-02-13 05:34:00,2026-02-14T23:06:10.931227,NEEDS_ENRICHMENT
13,Real Property Management Dynamic,support@rpmdynamic.com/,,https://www.rpmdynamic.com/,Port St Lucie,FL,Port St Lucie,Southeast,property_manager,,Low,websearch,"Original: info@ type → Enriched to personal emails: support@rpmdynamic.com/, owner@rpmdynamic.com/, manager@rpmdynamic.com/, contact@rpmdynamic.com/, property.manager@rpmdynamic.com/, admin@rpmdynamic.com/, operations@rpmdynamic.com/",1,,valid,new,,,2026-02-13 05:34:00,2026-02-14T23:06:11.933522,NEEDS_ENRICHMENT
14,"Best Property Management Companies in Port St. Lucie, FL",info@expertise.com,,https://www.expertise.com/business/property-management/florida/port-st-lucie,Port St Lucie,FL,Port St Lucie,Southeast,property_manager,,Low,websearch,"Vero Beach Rent offers its services to clients in and around Port St. Lucie. It manages townhouses,  | Email: SMTP verified at expertise.com",1,,valid,new,,,2026-02-13 05:34:00,2026-02-14 04:26:16,NEEDS_ENRICHMENT
15,Quest Property Management Services for Your Home,,(772) 785-8884,https://questrealestatesolutions.com/,Port St Lucie,FL,Port St Lucie,Southeast,property_manager,,Medium,websearch,"The One Solution for All your Real Estate Needs! Professional listing agent, buyers agent, rental ag",0,,,new,,,2026-02-13 05:34:00,2026-02-13 05:34:00,
16,Property Management,info@nex-genpartners.com,,https://nex-genpartners.com/services/property-management/,Port St Lucie,FL,Port St Lucie,Southeast,property_manager,,Low,websearch,"NeX-Gen Partners Property Management, LLC is one of Florida's premiere property management companies | Email: generic guess (nex-genpartners.com)",0,,,new,,,2026-02-13 05:34:00,2026-02-14 04:26:16,NEEDS_ENRICHMENT
17,Apartments for Rent in Fort Pierce FL,sales-usa@theblueground.com,972 289 8633,https://www.apartments.com/fort-pierce-fl/,Fort Pierce,FL,Fort Pierce,Southeast,apartment_complex,,Medium,websearch,"Fort Pierce, FL's average rent price is $1,550 per month. Compare rent prices and available listings | Alt emails: treasurecay@richpropertiesfl.com",0,,,new,,,2026-02-13 05:34:00,2026-02-13 05:34:00,
18,"Apartments for Rent in Fort Pierce, FL",sales-usa@theblueground.com,972 289 8633,https://www.realtor.com/apartments/Fort-Pierce_FL,Fort Pierce,FL,Fort Pierce,Southeast,apartment_complex,,Medium,websearch,"Explore 410 apartments for rent in Fort Pierce, FL. Compare photos, prices, and amenities to find th | Alt emails: treasurecay@richpropertiesfl.com",0,,,new,,,2026-02-13 05:34:00,2026-02-13 05:34:00,
19,Apartments for Rent in 34947,pinecreekvillage@liveamc.com,(772) 667-5247,https://www.apartments.com/fort-pierce-fl-34947/,Fort Pierce,FL,Fort Pierce,Southeast,apartment_complex,,Medium,websearch,"See all 116 apartments in 34947, Fort Pierce, FL currently available for rent. Each Apartments.com l",0,,,new,,,2026-02-13 05:34:00,2026-02-13 05:34:00,
20,Apartments for Rent in Fort Pierce FL with Utilities Included,,4220639471,https://www.apartments.com/fort-pierce-fl/utilities-included/,Fort Pierce,FL,Fort Pierce,Southeast,apartment_complex,,Medium,websearch,"Browse through 53 apartments for rent in Fort Pierce with utilities like water, electricity, interne",0,,,new,,,2026-02-13 05:34:00,2026-02-13 05:34:00,
21,Signature Property Management,Ira@signaturepropertymgmt.com,772) 219-4474,https://www.signaturepropertymgmt.com/,Stuart,FL,Stuart,Southeast,hoa,,High,websearch,"Signature Property Management provides impactful, solution based association management for condomin",0,,,new,,,2026-02-13 05:34:00,2026-02-13 05:34:00,
22,"Martin, FL Property Management Companies",info@pamartinfl.gov,(772) 631-6450,https://www.campbellpropertymanagement.com/martin-property-management-companies,Stuart,FL,Stuart,Southeast,hoa,,Low,websearch,"Campbell offers professional property management in Martin, FL. Our property management services inc | Alt emails: info@pa.martin.fl.us",0,,,new,,,2026-02-13 05:34:00,2026-02-14 04:26:16,NEEDS_ENRICHMENT
23,Professional HOA & COA Services in Martin County,esposito@macombgov.org,1016146955,https://www.tamcare.com/hoa-coa-services-martin-county/,Stuart,FL,Stuart,Southeast,hoa,,High,websearch,"We specialize in HOA & COA services in Martin County, offering professional janitorial services that",0,,,new,,,2026-02-13 05:34:00,2026-02-13 05:34:00,
24,Coastal Property Management – Stuart & Jupiter – Condominium ...,susan.palmieri@cpmfl.com,772-600-8900,https://www.cpmfl.com/,Stuart,FL,Stuart,Southeast,hoa,,High,websearch,"Jupiter, FL 33477. 561-781-8030. Get Social. © Copyright 2014 - 2026 | Coastal Property Management F | Alt emails: scottgobel@aol.com, info@cpmfl.com",0,,,new,,,2026-02-13 05:34:00,2026-02-13 05:34:00,
25,Palm Beach and Martin Counties Property Management,info@pa.martin.fl.us,(772) 288-5608,https://www.homepropertymanagement.com/south-florida-property-management,Stuart,FL,Stuart,Southeast,hoa,,Low,websearch,"Founded in 1985, Home Property Management has sent more than ninety-four million dollars ($94,000,00 | Alt emails: info@pamartinfl.gov, communityoutreach@pa.martin.fl.us",0,,,new,,,2026-02-13 05:34:00,2026-02-14 04:26:16,NEEDS_ENRICHMENT
26,"Martin Property Management, Martin Property ...",info@pa.martin.fl.us,781.532.8250,https://www.homeriver.com/florida/martin-property-management,Stuart,FL,Stuart,Southeast,hoa,,Low,websearch,"Trust your Martin property management to HomeRiver Group®. Our experienced Martin property managers  | Alt emails: info@pamartinfl.gov, info@stewart-martin.com",0,,,new,,,2026-02-13 05:34:00,2026-02-14 04:26:16,NEEDS_ENRICHMENT
27,Properties & Communities,kevin@stewartteam.com,(248) 759-5474,https://www.watsonassociationmanagement.com/properties/,Stuart,FL,Stuart,Southeast,hoa,,High,websearch,"Properties & Communities. Select a community or property name and access specific information. Searc | Alt emails: info@shipyxe.ca, office@stewartproperty.net",0,,,new,,,2026-02-13 05:34:00,2026-02-13 05:34:00,
28,St. Lucie and Martin County Property Management Agency,info@mgtspec.com,(877) 665-5505,https://www.mgtspec.com/home-1-2/,Stuart,FL,Stuart,Southeast,hoa,,Low,websearch,We offer full service annual property management for both residential and commercial properties in S,0,,,new,,,2026-02-13 05:34:00,2026-02-14 04:26:16,NEEDS_ENRICHMENT
29,"Best Auto Body Shops near Port Saint Lucie, FL",admin@carwise.com,,https://www.carwise.com/auto-body-shops/fl/port%2520saint%2520lucie,Port St Lucie,FL,Port St Lucie,Southeast,auto_shop,,Low,websearch,"Joe Hudson's Collision Center-St. Lucie. 4.9. 1,953 reviews. (772) 336-33731057 SW South Macedo Blvd | Email: SMTP verified at carwise.com",1,,valid,new,,,2026-02-13 05:34:00,2026-02-14 04:26:16,NEEDS_ENRICHMENT
30,Auto Body Shop,info@jhcc.com,,https://jhcc.com/locations/auto-body-shop-port-st-lucie/,Port St Lucie,FL,Port St Lucie,Southeast,auto_shop,,Low,websearch,"JHCC in Port St. Lucie offers expert auto body repairs, including painting & dent removal, efficient | Email: generic guess (jhcc.com)",0,,,new,,,2026-02-13 05:34:00,2026-02-14 04:26:16,NEEDS_ENRICHMENT
31,Classic Collision Port Saint Lucie,contact@classiccollision.com,,https://classiccollision.com/locations/classic-collision-port-saint-lucie/,Port St Lucie,FL,Port St Lucie,Southeast,auto_shop,,Low,websearch,"1048 SW Biltmore St Port St. Lucie, FL 34983 Phone (772) 879-4447 Distance Today's Hours Open from 7 | Email: SMTP verified at classiccollision.com",1,,valid,new,,,2026-02-13 05:34:00,2026-02-14 04:26:16,NEEDS_ENRICHMENT
32,Port St Lucie FL Auto Body Repair,info@gerbercollision.com,,https://www.gerbercollision.com/locations/port-st-lucie-fl,Port St Lucie,FL,Port St Lucie,Southeast,auto_shop,,Low,websearch,Gerber Collision & Glass Port St Lucie - 475 NW Enterprise Dr offers collision auto body repair with | Email: SMTP verified at gerbercollision.com,1,,valid,new,,,2026-02-13 05:34:00,2026-02-14 04:26:16,NEEDS_ENRICHMENT
33,Collision Repair in Port St Lucie,info@crashchampions.com,,https://crashchampions.com/locations/port-st-lucie,Port St Lucie,FL,Port St Lucie,Southeast,auto_shop,,Low,websearch,"Best RV and coach repair in Port St. Lucie, FL with Crash Champions. Quality service and lifetime gu | Email: SMTP verified at crashchampions.com",1,,valid,new,,,2026-02-13 05:34:00,2026-02-14 04:26:16,NEEDS_ENRICHMENT
34,"Auto Body Shop near Port Saint Lucie, FL 34952",admin@carwise.com,,https://www.carwise.com/auto-body-shops/34952,Port St Lucie,FL,Port St Lucie,Southeast,auto_shop,,Low,websearch,"Top 20 Best Auto Body Shops near Port Saint Lucie, FL 34952 with customer reviews - ZIMMER COLLISION | Email: SMTP verified at carwise.com",1,,valid,new,,,2026-02-13 05:34:00,2026-02-14 04:26:16,NEEDS_ENRICHMENT
35,Vantazma Collision,info@vantazma-car-care.com,,https://www.vantazma-car-care.com/,Port St Lucie,FL,Port St Lucie,Southeast,auto_shop,,Low,websearch,"We're committed to delivering high-quality collision repair, clean restorations, and professional pa | Email: generic guess (vantazma-car-care.com)",0,,,new,,,2026-02-13 05:34:00,2026-02-14 04:26:16,NEEDS_ENRICHMENT
36,Auto Body Services,info@allroadsrepair.com,,https://www.allroadsrepair.com/auto-body,Port St Lucie,FL,Port St Lucie,Southeast,auto_shop,,Low,websearch,Visit All Roads Truck & Auto Repair for auto body services. ASE-certified technicians. Same-day serv | Email: SMTP verified at allroadsrepair.com,1,,valid,new,,,2026-02-13 05:34:00,2026-02-14 04:26:16,NEEDS_ENRICHMENT
37,"Get Kitchen Remodeling in Jensen Beach, FL",info@jupiterkitchenrenovation.com,,https://jupiterkitchenrenovation.com/kitchen-remodeling-jensen-beach-fl,Jensen Beach,FL,Jensen Beach,Southeast,restaurant,,Low,websearch,"Kitchen remodeling in Jensen Beach, FL helps property owners update, redesign, and improve kitchen f | Email: generic guess (jupiterkitchenrenovation.com)",0,,,new,,,2026-02-13 05:34:00,2026-02-14 04:26:16,NEEDS_ENRICHMENT
38,Cooke Construction,info@cookeconstructioninc.com,,https://cookeconstructioninc.com/,Jensen Beach,FL,Jensen Beach,Southeast,restaurant,,Low,websearch,Cooke Construction INC offers expert kitchen remodeling in Jensen Beach FL. Transform your space wit | Email: SMTP verified at cookeconstructioninc.com,1,,valid,new,,,2026-02-13 05:34:00,2026-02-14 04:26:16,NEEDS_ENRICHMENT
39,Remodeling Contractor: Island Kitchen & Bath,info@ikbconstruction.com,,https://ikbconstruction.com/,Jensen Beach,FL,Jensen Beach,Southeast,restaurant,,Low,websearch,Reach out to us now at (772) 237-7348 and speak with a professional remodeling contractor. Find out  | Email: generic guess (ikbconstruction.com),0,,,new,,,2026-02-13 05:34:00,2026-02-14 04:26:16,NEEDS_ENRICHMENT
40,Kitchen Remodeling,info@sweetgc.com,,https://sweetgc.com/kitchen-remodeling/,Jensen Beach,FL,Jensen Beach,Southeast,restaurant,,Low,websearch,"750 NE Jensen Beach Blvd. Jensen Beach, FL 34957 PHONE: (772) 206-2670 EMAIL: contact@sweetgc.com HO | Email: SMTP verified at sweetgc.com",1,,valid,new,,,2026-02-13 05:34:00,2026-02-14 04:26:16,NEEDS_ENRICHMENT
41,Jensen Beach FL,info@dreammaker-stuart.com,,https://www.dreammaker-stuart.com/areas-we-serve/jensen-beach-fl/,Jensen Beach,FL,Jensen Beach,Southeast,restaurant,,Low,websearch,Our Remodeling Service · Our Remodeling Process · Virtual Reality · Reviews · Blog ... We recently h | Email: generic guess (dreammaker-stuart.com),0,,,new,,,2026-02-13 05:34:00,2026-02-14 04:26:16,NEEDS_ENRICHMENT
42,Home Services at Jensen Beach #221,cgallant@floridaelkscts.org,(844) 476-2140,https://www.homedepot.com/l/Jensen-Beach/FL/Jensen-Beach/34957/221/services,Jensen Beach,FL,Jensen Beach,Southeast,restaurant,,Medium,websearch,We also provide design services for projects like kitchen remodeling and blinds installation to help | Alt emails: thevinylvillain@hotmail.co.uk,0,,,new,,,2026-02-13 05:34:00,2026-02-13 05:34:00,
43,"Best 15 Kitchen & Bathroom Remodelers in Jensen Beach, FL",info@houzz.com,,https://www.houzz.com/professionals/kitchen-and-bath-remodelers/jensen-beach-fl-us-probr0-bo~t_11825~r_4160171,Jensen Beach,FL,Jensen Beach,Southeast,restaurant,,Low,websearch,Search 467 Jensen Beach kitchen & bathroom remodelers to find the best kitchen and bathroom remodele | Email: SMTP verified at houzz.com,1,,valid,new,,,2026-02-13 05:34:00,2026-02-14 04:26:16,NEEDS_ENRICHMENT
44,"Restaurant Construction in Jensen Beach, FL",info@aegenconstruction.com,,https://www.aegenconstruction.com/restaurant-construction,Jensen Beach,FL,Jensen Beach,Southeast,restaurant,,Low,websearch,"At AEgen Construction, we specialize in building custom restaurants that reflect your vision and mee | Email: SMTP verified at aegenconstruction.com",1,,valid,new,,,2026-02-13 05:34:00,2026-02-14 04:26:16,NEEDS_ENRICHMENT
45,Trusted Cleaning Company in Stuart FL,ncsnatyka@gmail.com,772-220-7915,https://www.customcleaningtc.com/,Stuart,FL,Stuart,Southeast,cleaning,,High,websearch,Custom Cleaning provides expert residential and commercial cleaning services across the Treasure Coa,0,,,new,,,2026-02-13 05:34:00,2026-02-13 05:34:00,
46,"Commercial Cleaning Services in Stuart, Florida",office@customcleaningtc.com,561-935-8549,https://enviro-master.com/commercial-cleaning-locations/melbourne-florida/stuart-florida-service-area,Stuart,FL,Stuart,Southeast,cleaning,,Low,websearch,"Professional commercial cleaning services in Stuart, Florida, by Enviro-Master of Melbourne. Enhance | Alt emails: info@stuartmartinchamber.org",0,,,new,,,2026-02-13 05:34:00,2026-02-14 04:26:16,NEEDS_ENRICHMENT
47,"Stuart, FL Commercial Cleaning and Janitorial Services",info@stuartmartinchamber.org,772-220-7915,https://cleanproservicesllc.com/stuart-fl-commercial-janitorial-cleaning-company/,Stuart,FL,Stuart,Southeast,cleaning,,Low,websearch,"A full-service Stuart, FL commercial cleaning company and janitorial service that provides reliable  | Alt emails: mcjanitorialsupply@gmail.com",0,,,new,,,2026-02-13 05:34:00,2026-02-14 04:26:16,NEEDS_ENRICHMENT
48,"Cleaning Services Stuart, Jensen Beach FL 772-205-3994",info@dustintimecleaning.com,772-205-3994,https://dustintimecleaning.com/,Stuart,FL,Stuart,Southeast,cleaning,,Low,websearch,We are proud to offer a full range of house and commercial cleaning services custom tailored to fit  | Email: generic guess (dustintimecleaning.com),0,,,new,,,2026-02-13 05:34:00,2026-02-14 04:26:16,NEEDS_ENRICHMENT
49,"Fresh and Clean Cleaning Service, Stuart, FL 34997, US",info@cleanandfreshcleaning.com,786-920-2105,https://www.mapquest.com/us/florida/fresh-and-clean-cleaning-service-543047965,Stuart,FL,Stuart,Southeast,cleaning,,Low,websearch,"Olivera House Keeping is a professional cleaning service based in Stuart, FL, offering comprehensive | Alt emails: cleanandfresh2017@aol.com",0,,,new,,,2026-02-13 05:34:00,2026-02-14 04:26:16,NEEDS_ENRICHMENT
50,"Commercial Cleaning Services in Stuart, FL",office@customcleaningtc.com,772-287-1088,https://www.tarltoncleanteam.com/florida-1/commercial-cleaning-services-in-stuart%252C-fl,Stuart,FL,Stuart,Southeast,cleaning,,Low,websearch,"From window cleaning, floor care, and carpet maintenance to trash removal and thorough disinfection, | Alt emails: marroquincleaningservicesfl@gmail.com, info@stuartmartinchamber.org",0,,,new,,,2026-02-13 05:34:00,2026-02-14 04:26:16,NEEDS_ENRICHMENT
51,Florida Investment Properties,nabertke@gmail.com,(772) 763-8506,https://www.treasurecoasthomesales.com/buying-investment-properties/,Stuart,FL,Stuart,Southeast,real_estate,,High,websearch,"Our team will help you build a robust portfolio of quality investment properties, managing your tran | Alt emails: info@stuartmartinchamber.org, Dianne@TradewindRE.com",0,,,new,,,2026-02-13 05:34:00,2026-02-13 05:34:00,
52,Treasure Coast Real Estate,John@tccommercialre.com,(772) 288-0632,https://www.reeftoranch.com/,Stuart,FL,Stuart,Southeast,real_estate,,High,websearch,"With a vast portfolio of listings across diverse locations, we are well-equipped to assist buyers in | Alt emails: nabertke@gmail.com, Nexthometreasurecoast@gmail.com",0,,,new,,,2026-02-13 05:34:00,2026-02-13 05:34:00,
53,Treasure Coast Realty Group,Meluke@treasurecoastrg.com,(772) 288-0632,https://www.treasurecoastrealtygroup.com/,Stuart,FL,Stuart,Southeast,real_estate,,High,websearch,"Search all area real estate for sale on one easy-to-use site. Including homes, condos, townhomes, la",0,,,new,,,2026-02-13 05:34:00,2026-02-13 05:34:00,
54,Excellent Investment,sales@stewartsresort.com,1514742893,https://www.zillow.com/port-saint-lucie-fl/excellent-investment_att/,Stuart,FL,Stuart,Southeast,real_estate,,Low,websearch,Zillow has 78 homes for sale in Port Saint Lucie FL matching Excellent Investment. View listing phot | Alt emails: stuart@orchardhouse.co.uk,0,,,new,,,2026-02-13 05:34:00,2026-02-14 04:26:16,NEEDS_ENRICHMENT
55,RE/MAX Gold,Meconnormckinney.re@gmail.com,973-508-9425,https://www.remaxgoldflorida.com/,Stuart,FL,Stuart,Southeast,real_estate,,High,websearch,"RE/MAX Gold is the premier real estate office on the Treasure Coast serving Port St Lucie, Jensen Be | Alt emails: remaxregency@remax.com.au",0,,,new,,,2026-02-13 05:34:00,2026-02-13 05:34:00,
56,Estate Listings on,spiersrealestate@gmail.com,(868) 622-2685,https://www.slccommercial.com/commercial-real-estate-listings-treasure-coast/,Stuart,FL,Stuart,Southeast,real_estate,,High,websearch,"Search commercial real estate opportunities in the beautiful Treasure Coast of Florida. Whether you  | Alt emails: enquiries@charlesstuart.com.au, Sales@edward-stuart.co.uk",0,,,new,,,2026-02-13 05:34:00,2026-02-13 05:34:00,
57,Luxury Homes of the Treasure Coast,Kevin@TradewindRe.com,800-274-6637,https://luxhomestc.com/,Stuart,FL,Stuart,Southeast,real_estate,,High,websearch,"Find your dream home with us. We specialize in luxury properties and offer personalized service to m | Alt emails: Hoss1228@gmail.com, isabella@isabellascott.com",0,,,new,,,2026-02-13 05:34:00,2026-02-13 05:34:00,
58,Treasure Coast Fl. Real Estate Articles,John@tccommericalre.com,(772) 288-0632,https://realestateexpoinc.com/articles/,Stuart,FL,Stuart,Southeast,real_estate,,High,websearch,Investors can find a range of properties—from beachfront condos and single-family rental homes to co | Alt emails: AlexanderHaighRealtor@Gmail.com,0,,,new,,,2026-02-13 05:34:00,2026-02-13 05:34:00,
59,Treasure Coast Real Estate: Treasure Coast Homes for Sale,info@treasurecoastmlssearch.com,1000570592,http://www.treasurecoastmlssearch.com/,Stuart,FL,Stuart,Southeast,real_estate,,Low,websearch,This website features homes for sale all over the Treasure Coast and is frequently updated every 15  | Email: generic guess (treasurecoastmlssearch.com),0,,,new,,,2026-02-13 05:34:00,2026-02-14 04:26:16,NEEDS_ENRICHMENT
60,"Top Rated Car Dealerships near Stuart, FL",,772-872-0501,https://www.carfax.com/Dealerships-Stuart-FL_c9849,Stuart,FL,Stuart,Southeast,auto_shop,,High,websearch,"Victory Auto is a very nice family ran auto business located in Stuart, Florida! The staff and manag",0,,,new,,,2026-02-13 05:34:00,2026-02-13 05:34:00,
61,New & Used Cars For Sale,info@wallaceautogroup.com,772.218.7007,https://www.wallaceautogroup.com/?srsltid=AfmBOoqHWyl4_9Cg4VRl7tlnhcyWcs0zx0YJDbF6gYjSOELPXPt75ANB,Stuart,FL,Stuart,Southeast,auto_shop,,Low,websearch,The Wallace Auto Group located in Stuart & Ft. Pierce carries 15 new car dealerships & over 400 used | Email: SMTP verified at wallaceautogroup.com,1,,valid,new,,,2026-02-13 05:34:00,2026-02-14 04:26:16,NEEDS_ENRICHMENT
62,Wallace Chevrolet,ewallace@wallacechev.com,772-286-0155,https://www.wallacechevrolet.com/?srsltid=AfmBOopNn__4h6gHfTzP5_LGy-U5YPYAhDbbBEW5SdKXfzjgpjLBLLIe,Stuart,FL,Stuart,Southeast,auto_shop,,High,websearch,"Wallace Chevrolet located at 3575 SE Federal Hwy, Stuart, FL 34997 is the Treasure Coasts premier Ch",0,,,new,,,2026-02-13 05:34:00,2026-02-13 05:34:00,
63,"All Dealers in Stuart, FL 34997",sales@jldauto.net,(772) 288-2099,https://www.autotrader.com/car-dealers/stuart-fl,Stuart,FL,Stuart,Southeast,auto_shop,,Low,websearch,"Find Stuart Dealers. Search for all dealers in Stuart, FL 34997 and view their inventory at Autotrad | Alt emails: jayme@theartofspeed.com",0,,,new,,,2026-02-13 05:34:00,2026-02-14 04:26:16,NEEDS_ENRICHMENT
64,"Starling Buick GMC Dealership in Stuart, FL",info@starlingbuickgmcstuart.com,(772) 210-0299,https://www.starlingbuickgmcstuart.com/,Stuart,FL,Stuart,Southeast,auto_shop,,Low,websearch,"Recognized for our unwavering commitment to quality and service, we proudly stand among the elite to | Email: generic guess (starlingbuickgmcstuart.com)",0,,,new,,,2026-02-13 05:34:00,2026-02-14 04:26:16,NEEDS_ENRICHMENT
65,Honda Dealership Stuart FL,events@hohmartin.org,(772) 286-4673,https://www.johnsonhondaofstuart.com/,Stuart,FL,Stuart,Southeast,auto_shop,,High,websearch,"Visit Johnson Honda of Stuart for all of your Honda needs in Stuart, FL. Shop cars for sale, browse  | Alt emails: info@stuartmartinchamber.org",0,,,new,,,2026-02-13 05:34:00,2026-02-13 05:34:00,
66,Treasure Coast Toyota Of Stuart,info@treasurecoasttoyotaofstuart.com,(772) 283-8300,https://www.treasurecoasttoyotaofstuart.com/,Stuart,FL,Stuart,Southeast,auto_shop,,Low,websearch,Discover top Toyota models serving Port St. Lucie at Treasure Coast Toyota of Stuart. Great deals aw | Email: generic guess (treasurecoasttoyotaofstuart.com),0,,,new,,,2026-02-13 05:34:00,2026-02-14 04:26:16,NEEDS_ENRICHMENT
