id,business_name,email,phone,website,city,state,metro,region,category,lead_type,priority,source,notes,verified,verified_date,verified_result,send_status,approved_date,sent_date,created_at,updated_at,contact_name
1445,Vesta Property Services – Florida HOA & Community Association Management Experts,,,https://vestapropertyservices.com/,Vero Beach,FL,Vero Beach,Southeast,HOA property management,client,Medium,brave_national,"Snippet: Headquartered in Jacksonville and serving communities from Miami and West Palm Beach to Orlando and Tampa, Vesta Property Services combines statewide ",0,,,new,,,2026-02-13 06:12:10,2026-02-13 06:12:10,
1446,"West Palm Beach Community Association Management, HOA, Condominium, Homowners Association and Proper",,,https://vestapropertyservices.com/west-palm-beach/,Vero Beach,FL,Vero Beach,Southeast,HOA property management,client,Medium,brave_national,"Snippet: Whether it be in Vero Beach, Miami, Boca Raton or West Palm Beach, Vesta Property Services will be there to provide superior Community Management to h",0,,,new,,,2026-02-13 06:12:10,2026-02-13 06:12:10,
1447,Professional HOA Management in Florida,,,https://www.realmanage.com/office-locations/florida,Vero Beach,FL,Vero Beach,Southeast,HOA property management,client,Medium,brave_national,Snippet: JavaScript is disabled in your browser · Please enable JavaScript to proceed · A required part of this site couldn’t load. This may be due to a browse,0,,,new,,,2026-02-13 06:12:10,2026-02-13 06:12:10,
1484,Mr. Handyman Serving Vero Beach & Jupiter,,(772) 202-5199,https://business.stuartmartinchamber.org/members/member/mr-handyman-serving-vero-beach-jupiter-16020,Stuart,FL,Stuart,Southeast,handyman service,contractor,Medium,brave_national,"Snippet: 7811 S.W. Ellipse Way, Suite C1 Suite C1 Stuart FL 34997 · <strong>(772) 202-5199</strong> · Send Email · Visit Website · Mr. Handyman and our experie",0,,,new,,,2026-02-13 06:12:22,2026-02-13 06:12:22,
1485,Handyman Services Stuart,,561 529-4549,https://www.handyman-tcs.com/stuart-handyman-services,Stuart,FL,Stuart,Southeast,handyman service,contractor,Medium,brave_national,"Snippet: For more information about our services, please contact TCoast Handyman &amp; Carpentry Services 561 529-4549 Phone/Txt",0,,,new,,,2026-02-13 06:12:22,2026-02-13 06:12:22,
1486,"Top-rated Handyman in Stuart, FL",,,https://www.mrhandyman.com/vero-beach-jupiter/geo/stuart/,Stuart,FL,Stuart,Southeast,handyman service,contractor,Medium,brave_national,"Snippet: You can get prompt service from our customer care team today by calling us or reaching out online for a service request. Our Handyman in Stuart, FL, i",0,,,new,,,2026-02-13 06:12:22,2026-02-13 06:12:22,
1487,"Best Handyman Services Near Stuart, FL",,,https://www.mrhandyman.com/vero-beach-jupiter/handyman-services/repair/,Stuart,FL,Stuart,Southeast,handyman service,contractor,Medium,brave_national,"Snippet: Looking for reliable handyman services near Stuart, FL? Call Mr. Handyman Serving Vero Beach and Jupiter to handle your next home maintenance service ",0,,,new,,,2026-02-13 06:12:22,2026-02-13 06:12:22,
1488,Home,jenn02hernandez@gmail.com,(772) 206-2771,https://hadymanatoz.com/,Stuart,FL,Stuart,Southeast,handyman service,contractor,High,brave_national,Snippet: Handyman A to Z Inc. provides drywall ... You can contact Handyman A to Z Inc. by phone at (772) 206-2771 or by email at <strong>jenn02hernandez@gmail,0,,,new,,,2026-02-13 06:12:22,2026-02-13 06:12:22,
1489,"Handyman & Home Repair Services in Stuart, FL",,,https://www.acehandymanservices.com/offices/port-st-lucie/city/stuart_services,Stuart,FL,Stuart,Southeast,handyman service,contractor,Medium,brave_national,Snippet: <strong>Ace Handyman Services</strong>,0,,,new,,,2026-02-13 06:12:22,2026-02-13 06:12:22,
1490,"KMJ Handyman Services Stuart, FL, 34996",,,https://www.networx.com/c.kmj-handyman-services-llc,Stuart,FL,Stuart,Southeast,handyman service,contractor,Medium,brave_national,"Snippet: Read homeowner reviews of KMJ Handyman Services LLC In Stuart, FL. Get free quotes from KMJ Handyman Services LLC",0,,,new,,,2026-02-13 06:12:22,2026-02-13 06:12:22,
1537,Jupiter Florida's Best Shops and Stores Business,,5615754327,https://www.inflorida.com/companies/search/shops-and-stores,Jupiter,FL,Jupiter,Southeast,retail store owner,client,Medium,brave_national,"Snippet: Jupiter, Florida, United States · 5615754327 · email us · Computer Software Retail Stores · Jupiter, Florida, United States · 5617441913 · email us · ",0,,,new,,,2026-02-13 06:12:35,2026-02-13 06:12:35,
1538,Jupiter Florida Verizon Store Locations,info@verizon.com,,https://www.verizon.com/stores/city/florida/jupiter/,Jupiter,FL,Jupiter,Southeast,retail store owner,client,Medium,brave_national,Snippet: Find all Jupiter Florida Verizon retail store locations near you including store hours and contact information. | Email: generic guess (verizon.com),0,,,new,,,2026-02-13 06:12:35,2026-02-13 06:12:35,
1539,Jupiter Shopping & Retail,,,https://www.localjupiter.com/directory/shopping/,Jupiter,FL,Jupiter,Southeast,retail store owner,client,Medium,brave_national,"Snippet: Need to do some shopping in Jupiter? Find clothing, jewelry, groceries, electronics, appliances, and more in Jupiter, FL!",0,,,new,,,2026-02-13 06:12:35,2026-02-13 06:12:35,
1540,"Shoppes of Jonathan's Landing, Jupiter, FL 33477 – Retail Space",info@regencycenters.com,,https://www.regencycenters.com/property/detail/80080/Shoppes-of-Jonathans-Landing,Jupiter,FL,Jupiter,Southeast,retail store owner,client,Low,brave_national,Snippet: Its retailers and culture reflect the lifestyle needs of the neighborhoods that surround the center. Email <strong>info@regencycenters.com</strong> fo,0,,,new,,,2026-02-13 06:12:35,2026-02-14 04:26:16,NEEDS_ENRICHMENT
1541,Retail Shopping and Office Rental in Jupiter FL,,,https://www.driftwoodplaza.com/,Jupiter,FL,Jupiter,Southeast,retail store owner,client,Medium,brave_national,"Snippet: US Route 1 in Jupiter, Florida · Charming boutique style storefronts with beautiful picture windows. Expansive US Highway One exposure for your busine",0,,,new,,,2026-02-13 06:12:35,2026-02-13 06:12:35,
1542,"The Shoppes of Jupiter Clothing Store in Jupiter, FL",,,https://stores.beallsflorida.com/fl/jupiter/59-us-highway-1-north,Jupiter,FL,Jupiter,Southeast,retail store owner,client,Medium,brave_national,"Snippet: At Bealls Florida, we’re proud to serve the Jupiter community.",0,,,new,,,2026-02-13 06:12:35,2026-02-13 06:12:35,
1543,"Chasewood Plaza, Jupiter, FL 33458 – Retail Space",info@regencycenters.com,,https://www.regencycenters.com/property/detail/82/Chasewood-Plaza,Jupiter,FL,Jupiter,Southeast,retail store owner,client,Low,brave_national,Snippet: Its retailers and culture reflect the lifestyle needs of the neighborhoods that surround the center. ... Email <strong>info@regencycenters.com</strong,0,,,new,,,2026-02-13 06:12:35,2026-02-14 04:26:16,NEEDS_ENRICHMENT
1544,Business Broker in Jupiter,,,https://www.sailfishequityadvisors.com/business-broker-in-jupiter,Jupiter,FL,Jupiter,Southeast,retail store owner,client,Medium,brave_national,"Snippet: Now is the Perfect Time to Sell Your Business in Jupiter, FL. ... Discover the proven strategies and insider tips that have helped business owners lik",0,,,new,,,2026-02-13 06:12:35,2026-02-13 06:12:35,
1604,Spa Estetica Dermalounge,,786 339-7724,https://spaesteticadermalounge.com/,Homestead,FL,Homestead,Southeast,salon spa,client,Medium,brave_national,"Snippet: Contact · Spa Estetica Dermalounge · 42 W Mowry Dr , homestead , FL 33033 · 786 339-7724 · Copyright © 2023 Spa Estetica Dermalounge - All Rights Rese",0,,,new,,,2026-02-13 06:12:51,2026-02-13 06:12:51,
1625,"Seamless Gutters Palm Beach, FL",,(772) 334-3139,https://gutterprofessionalsinc.com/seamless-gutters/,West Palm Beach,FL,West Palm Beach,Southeast,gutter installation,contractor,Medium,brave_national,Snippet: We also offer 6 in. and 7 in. seamless gutters – European Gutter styles available as well! Contact us today at <strong>(772) 334-3139</strong> for a f,0,,,new,,,2026-02-13 06:12:56,2026-02-13 06:12:56,
1676,Fast Food in Jupiter,,(561) 798-7026,https://www.florida.com/jupiter/businesses/3825,Jupiter,FL,Jupiter,Southeast,fast food franchise,client,Medium,brave_national,"Snippet: Restaurant &amp; Bar &amp;nbsp;&gt; Fast Food · 7080 Seminole Pratt Road Loxahatchee, FL 33470 Phone: (561) 798-7026 · Jupiter 336 · No more business ",0,,,new,,,2026-02-13 06:13:11,2026-02-13 06:13:11,
1677,Jupiter Florida's Best Fast Food Business,,,https://www.inflorida.com/companies/search/restaurants/fast-food,Jupiter,FL,Jupiter,Southeast,fast food franchise,client,Medium,brave_national,"Snippet: Fast Food Jupiter, FL Business Directory on InJupiter.com. Best Business Directory in Palm Beach County",0,,,new,,,2026-02-13 06:13:11,2026-02-13 06:13:11,
1678,15 Best Fast Food Delivery Restaurants in Jupiter,,,https://www.grubhub.com/delivery/fl-jupiter/fast_food,Jupiter,FL,Jupiter,Southeast,fast food franchise,client,Medium,brave_national,Snippet: Prepare your taste buds...,0,,,new,,,2026-02-13 06:13:11,2026-02-13 06:13:11,
1679,"KFC® at 6700 W. Indiantown Rd in Jupiter, FL",,,https://locations.kfc.com/fl/jupiter/6700-w-indiantown-rd,Jupiter,FL,Jupiter,Southeast,fast food franchise,client,Medium,brave_national,"Snippet: Join today to receive our special email offers and deals. ... Join our KFC family at 6700 W. Indiantown Rd in Jupiter, FL, and discover a team who cel",0,,,new,,,2026-02-13 06:13:11,2026-02-13 06:13:11,
1680,Franchisee List,,,https://www.franchiseelist.com/,Jupiter,FL,Jupiter,Southeast,fast food franchise,client,Medium,brave_national,Snippet: Unlock direct access to verified franchise owner contact information for franchise businesses across the United States. Whether you are targeting sing,0,,,new,,,2026-02-13 06:13:11,2026-02-13 06:13:11,
1681,THE 10 BEST FAST FOOD DELIVERY in Jupiter 2025| Order Fast Food Near Me,,,https://www.ubereats.com/category/jupiter-fl/fast-food,Jupiter,FL,Jupiter,Southeast,fast food franchise,client,Medium,brave_national,"Snippet: Enjoy Fast Food delivery and takeaway with Uber Eats near you in Jupiter. Browse Jupiter restaurants serving Fast Food nearby, place your order and en",0,,,new,,,2026-02-13 06:13:11,2026-02-13 06:13:11,
1682,THE BEST Fast Food in Jupiter (Updated 2026),,,https://www.tripadvisor.com/Restaurants-g34335-c10646-Jupiter_Florida.html,Jupiter,FL,Jupiter,Southeast,fast food franchise,client,Medium,brave_national,"Snippet: Hotels near Hobe Sound Bible CollegeHotels near Academy For Nursing And Health OccupationsHotels near Medical Institute of Palm Beach Greenacres, FLHo",0,,,new,,,2026-02-13 06:13:11,2026-02-13 06:13:11,
1694,Cape Christian,info@capechristian.com,239-772-5683,https://www.capechristian.com/worship,Cape Coral,FL,Cape Coral,Southeast,church religious facility,client,Low,brave_national,Snippet: 2110 Chiquita Blvd S • Cape Coral FL 33991 · Phone: 239-772-5683 · Email: <strong>info@capechristian.com</strong> CONTACT US · High School: Wednesday ,0,,,new,,,2026-02-13 06:13:16,2026-02-14 04:26:16,NEEDS_ENRICHMENT
1744,Tradition Hospital,,772.345.8100,https://my.clevelandclinic.org/locations/directions/537-tradition-hospital,Port St. Lucie,FL,Port St. Lucie,Southeast,hospital medical facility,client,Medium,brave_national,"Snippet: 10000 SW Innovation Way Port St. Lucie , Florida 34987 · Call 772.345.8100 · Directions · Location Details · Hours of Operation · 24/7 · 24/7 · Sunday",0,,,new,,,2026-02-13 06:13:27,2026-02-13 06:13:27,
1747,Port St. Lucie Hospital – Florida’s Mental Health Treatment,,(772) 335-0400,https://www.portstluciehospitalinc.com/,Port St. Lucie,FL,Port St. Lucie,Southeast,hospital medical facility,client,Medium,brave_national,"Snippet: Please note: For medical emergencies, please call 911. For other urgent matters, please call our dmissions line (772) 335-0400. Submissions after-hour",0,,,new,,,2026-02-13 06:13:27,2026-02-13 06:13:27,
1754,Top Dentist Office in Kissimmee FL 34744,,(407) 935-1772,https://www.coastdental.com/dentist-office/kissimmee-fl-34744,Kissimmee,FL,Kissimmee,Southeast,dental office,client,Medium,brave_national,Snippet: Ready to experience the best dental care in central Florida? Contact us today at (407) 935-1772 to schedule an appointment at our Kissimmee dentist of,0,,,new,,,2026-02-13 06:13:29,2026-02-13 06:13:29,
1786,"Fast Food Enterprises in Vero Beach, FL – Reviews, Hours, and Contact Details",info@local.yahoo.com,(772) 569-3420,https://local.yahoo.com/info-14160764-fast-food-enterprises-vero-beach/,Vero Beach,FL,Vero Beach,Southeast,fast food franchise,client,Medium,brave_national,Snippet: Florida · Vero Beach · Fast Food EnterprisesFast Food · Website · Website:eventseeker.com · Phone:(772) 569-3420 · Cross Streets:Between Vista Royale  | Email: generic guess (local.yahoo.com),0,,,new,,,2026-02-13 06:13:38,2026-02-13 06:13:38,
1787,"QSR & Fast Food Restaurants for Sale in Vero Beach, FL",,888.273.0423,https://www.crexi.com/properties/FL/Vero_Beach/QSR-and-Fast-Food-Restaurants,Vero Beach,FL,Vero Beach,Southeast,fast food franchise,client,Medium,brave_national,"Snippet: For assistance, reach out to our support team at [email protected] or call 888.273.0423 . For press inquiries, contact [email protected]",0,,,new,,,2026-02-13 06:13:38,2026-02-13 06:13:38,
1788,Fast Food in Vero Beach,,(772) 562-4233,https://www.florida.com/vero-beach/businesses/3825,Vero Beach,FL,Vero Beach,Southeast,fast food franchise,client,Medium,brave_national,"Snippet: 6170 20th St. Vero Beach, FL 32966 Phone: (772) 562-4233 · Vero Beach 203 · No more business to show. About · Privacy · Terms · Affiliates · Contact ·",0,,,new,,,2026-02-13 06:13:38,2026-02-13 06:13:38,
1789,Fast Food Enterprises Profile,,,https://www.datanyze.com/companies/fast-food-enterprises/353179254,Vero Beach,FL,Vero Beach,Southeast,fast food franchise,client,Medium,brave_national,"Snippet: Find contact information for Fast Food Enterprises. Learn about their Restaurants, Hospitality market share, competitors, and Fast Food Enterprises&#x",0,,,new,,,2026-02-13 06:13:38,2026-02-13 06:13:38,
1790,"Checkers at 1495 US Highway 1 Vero Beach, FL",,,https://locations.checkersandrallys.com/fl/vero-beach/1495-us-highway-1,Vero Beach,FL,Vero Beach,Southeast,fast food franchise,client,Medium,brave_national,"Snippet: Visit your local Checkers at 1495 US Highway 1 in Vero Beach, FL | For Burgers. Milkshakes, Late night",0,,,new,,,2026-02-13 06:13:38,2026-02-13 06:13:38,
1791,HOME,,772-567-5360,https://www.mfcvero.com/,Vero Beach,FL,Vero Beach,Southeast,fast food franchise,client,Medium,brave_national,"Snippet: 748 21st St. Vero Beach, FL 32960 T: 772-567-5360 · The best fried chicken &amp; seafood in Vero Beach",0,,,new,,,2026-02-13 06:13:38,2026-02-13 06:13:38,
1833,My first place,info@myfirstplaceacademy.com,772-634-0738,https://myfirstplaceacademy.com/,Port St. Lucie,FL,Port St. Lucie,Southeast,daycare center,client,Low,brave_national,Snippet: Why settle for a traditional daycare when you can give your child a lifelong advantage? Send us a message · Monday to Friday: Open from 6:30am – 6:00p,0,,,new,,,2026-02-13 06:15:50,2026-02-14 04:26:16,NEEDS_ENRICHMENT
1851,Contact FIMCO Manufacturing.,info@fimcomfg.com,561.624.3308,https://www.fimcomfg.com/contact-fimco/,Jupiter,FL,Jupiter,Southeast,manufacturing plant,client,Low,brave_national,"Snippet: Contact · Manufacturing Facility/Main Office 15795 Corporate Road North Jupiter, FL 33478 · 561.624.3308 · info@fimcomfg.com · Mon-Thur 7:30AM – 5:00P",0,,,new,,,2026-02-13 06:15:54,2026-02-14 04:26:16,NEEDS_ENRICHMENT
1852,"Find Manufacturing companies in Jupiter, Florida, United States of America",,,https://www.dnb.com/business-directory/company-information.manufacturing.us.florida.jupiter.html,Jupiter,FL,Jupiter,Southeast,manufacturing plant,client,Medium,brave_national,"Snippet: Detailed info on Manufacturing companies in Jupiter, Florida, United States of America, including financial statements, sales and marketing contacts, ",0,,,new,,,2026-02-13 06:15:54,2026-02-13 06:15:54,
1854,"PSI Manufacturing Operations, Profile",,,https://www.dnb.com/business-directory/company-profiles.psi_manufacturing_operations_llc.eabf0e28f69dbd1288214f8a56686f56.html,Jupiter,FL,Jupiter,Southeast,manufacturing plant,client,Medium,brave_national,"Snippet: PSI Manufacturing Operations, LLC is located at 831 Jupiter Park Dr Jupiter, FL, 33458-8946 United States",0,,,new,,,2026-02-13 06:15:54,2026-02-13 06:15:54,
1855,About,,,https://www.psm.com/about,Jupiter,FL,Jupiter,Southeast,manufacturing plant,client,Medium,brave_national,"Snippet: We offer complete plant support—from field services and rotor life extension to monitoring and diagnostics—focused on performance, longevity, and cost",0,,,new,,,2026-02-13 06:15:54,2026-02-13 06:15:54,
1856,Contact Us,,,https://jupfin.com/contact-us/,Jupiter,FL,Jupiter,Southeast,manufacturing plant,client,Medium,brave_national,"Snippet: Please call, email, or complete the form below so we can assist you. Address: 1061 E Indiantown Road, Suite 404 Jupiter, FL 33477",0,,,new,,,2026-02-13 06:15:54,2026-02-13 06:15:54,
1857,Town of Jupiter.com,,,http://www.townofjupiter.com/business.htm,Jupiter,FL,Jupiter,Southeast,manufacturing plant,client,Medium,brave_national,Snippet: Home | New Coupons | New Listings | « A-Z Listings » | Advanced Search | Reverse Lookup | Sign Up | Member Center · National Settlement Services carve,0,,,new,,,2026-02-13 06:15:54,2026-02-13 06:15:54,
1858,Jupiter,info@jil-jupiter.com,,https://jil-jupiter.com/contact-us/,Jupiter,FL,Jupiter,Southeast,manufacturing plant,client,Low,brave_national,Snippet: Manufacturing · Beyond Profit · ESG · CSR · Investor Relations · Media · Events · Infrastructure · Awards &amp; Recognitions · Press Release · Careers,0,,,new,,,2026-02-13 06:15:54,2026-02-14 04:26:16,NEEDS_ENRICHMENT
1898,Fort Pierce Smiles,,772-232-7073,https://www.ftpiercedentist.com/,Fort Pierce,FL,Fort Pierce,Southeast,dental office,client,Medium,brave_national,"Snippet: Fort Pierce Smiles is located at 2102 S 11th St, Fort Pierce, FL. We are currently accepting new patients, and you can schedule an appointment by call",0,,,new,,,2026-02-13 06:16:06,2026-02-13 06:16:06,
1899,Midway Dental Center: Home,,,https://midwaydentalcenter.com/,Fort Pierce,FL,Fort Pierce,Southeast,dental office,client,Medium,brave_national,"Snippet: Welcome to Midway Dental Center, conveniently located near the intersection of S 25th St. and Midway Rd. in Fort Pierce. Our dedicated team of dental ",0,,,new,,,2026-02-13 06:16:06,2026-02-13 06:16:06,
1900,Family Oral Health Associates: Home,,(772) 465-4545,https://familyoralhealth.com/,Fort Pierce,FL,Fort Pierce,Southeast,dental office,client,Medium,brave_national,"Snippet: Fort Pierce, FL 34947 · Call Us:(772) 465-4545Get Directions · Your First Visit · Finding a new dental office can often be a challenge. We are here to",0,,,new,,,2026-02-13 06:16:06,2026-02-13 06:16:06,
1901,Fort Pierce Dentist,,(772) 464-2943,https://smoothsailingdental.com/,Fort Pierce,FL,Fort Pierce,Southeast,dental office,client,Medium,brave_national,Snippet: We are now scheduling appointments ... of your dental need questions. Patients may schedule video chat appointments by calling our office and speaking,0,,,new,,,2026-02-13 06:16:06,2026-02-13 06:16:06,
1902,Free Dental Clinic in Fort Pierce,,(772) 462-5646,https://handsofslc.org/dental-department/,Fort Pierce,FL,Fort Pierce,Southeast,dental office,client,Medium,brave_national,"Snippet: ... We serve low-income residents of St. Lucie County between the ages of 19 and 64 without access to insurance, Medicaid, Medicare, or veteran’s serv",0,,,new,,,2026-02-13 06:16:06,2026-02-13 06:16:06,
1903,Forever Smiles North,FDOH56.Dental@flhealth.gov,,https://stlucie.floridahealth.gov/locations/forever-smiles-north.html,Fort Pierce,FL,Fort Pierce,Southeast,dental office,client,Low,brave_national,"Snippet: 1701 S 23rd Street Fort Pierce, FL 34950 Get Directions · MAILING ADDRESS · 5150 NW Milner Drive Port St. Lucie, FL 34983 · <strong>FDOH56.Dental@flhe",0,,,new,,,2026-02-13 06:16:06,2026-02-14 04:26:16,JUNK_DOMAIN
1904,"Dentist in Fort Pierce, FL 34982",,772-882-9397,https://apexdentistry.net/,Fort Pierce,FL,Fort Pierce,Southeast,dental office,client,Medium,brave_national,"Snippet: At <strong>Apex Dentistry</strong>, we offer a wide range of dental services all conveniently located at 2301 Sunrise Blvd, Suite C, Fort Pierce, FL 3",0,,,new,,,2026-02-13 06:16:06,2026-02-13 06:16:06,
1905,Ft. Pierce Dentist,,,https://www.rowefamilydental.com/,Fort Pierce,FL,Fort Pierce,Southeast,dental office,client,Medium,brave_national,Snippet: We welcome you to contact us via phone or email. READ MORE ... Find out why so many patients in Ft. Pierce turn to our dentist first! READ MORE · Heal,0,,,new,,,2026-02-13 06:16:06,2026-02-13 06:16:06,
1906,"Fort Pierce, FL Dentist Near Me",,(772) 293-6043,https://www.aspendental.com/dentist/fl/fort-pierce/5000-okeechobee-rd-ste-a/,Fort Pierce,FL,Fort Pierce,Southeast,dental office,client,Medium,brave_national,"Snippet: Get in today for affordable dental care with a team that’s in your corner, and on your corner. From general dentistry to dentures and implants, we’ve ",0,,,new,,,2026-02-13 06:16:06,2026-02-13 06:16:06,
1907,"Dentist Offices Near Fort Pierce, FL",,(772) 464-4646,https://www.greatexpressions.com/dental-offices/dentist-in-fort-pierce-florida-s-federal-highway/,Fort Pierce,FL,Fort Pierce,Southeast,dental office,client,Medium,brave_national,"Snippet: 2505 South Federal Highway, Fort Pierce, FL, 34982 · (772) 464-4646 · (772) 461-9117 (fax) Schedule an Appointment · Get Directions · Periodontics · H",0,,,new,,,2026-02-13 06:16:06,2026-02-13 06:16:06,
1960,Tradewind Aviation,,(203) 267-3305,https://business.stuartmartinchamber.org/members/member/tradewind-aviation-15470,Stuart,FL,Stuart,Southeast,aircraft hangar,client,Medium,brave_national,"Snippet: 2315 Witham Field Drive, Hangar 2 Stuart FL 34996 · <strong>(203) 267-3305</strong> · Send Email · www.flytradewind.com · Founded in 2001 by aviation ",0,,,new,,,2026-02-13 06:16:21,2026-02-13 06:16:21,
1961,Atlantic Aviation,,(772) 781-4720,https://business.stuartmartinchamber.org/members/member/atlantic-aviation-stuart-llc-5018,Stuart,FL,Stuart,Southeast,aircraft hangar,client,Medium,brave_national,Snippet: 2240 S.E. Witham Field Drive Stuart FL 34996 · (772) 781-4720 · (877) 453-7827 · (772) 781-4721 · www.atlanticaviation.com · Hours: 6am to 10pm After ,0,,,new,,,2026-02-13 06:16:21,2026-02-13 06:16:21,
1962,"Stuart, FL (SUA)",,,https://www.atlanticaviation.com/locations/SUA,Stuart,FL,Stuart,Southeast,aircraft hangar,client,Medium,brave_national,"Snippet: In addition to our renowned customer service and Atlantic Attitude, this Atlantic FBO puts you right in the heart of one of the true gems of the Treas",0,,,new,,,2026-02-13 06:16:21,2026-02-13 06:16:21,
1963,"Stuart, Florida",,,https://appjetcenter.com/locations/stuart-florida/,Stuart,FL,Stuart,Southeast,aircraft hangar,client,Medium,brave_national,"Snippet: With both long-term and overnight hangar options, we cater to your aircraft’s needs while delivering a personalized experience for passengers and crew",0,,,new,,,2026-02-13 06:16:21,2026-02-13 06:16:21,
1964,Stuart Jet Center (SUA) in Stuart,,(772) 288-6700,https://www.visitflorida.com/listing/stuart-jet-center-(sua)/24348/,Stuart,FL,Stuart,Southeast,aircraft hangar,client,Medium,brave_national,"Snippet: 2501 S.E. Aviation Way Witham Field (SUA) Stuart, FL 34996 · (772) 288-6700 · Visit Website More in Stuart ·",0,,,new,,,2026-02-13 06:16:21,2026-02-13 06:16:21,
1965,stuart jet center hangar a,,,https://www.martin.fl.us/resources/s178-007-stuart-jet-center-hangar-a-rev-maj-final-pdf,Stuart,FL,Stuart,Southeast,aircraft hangar,client,Medium,brave_national,"Snippet: The official website for Martin County government in Martin County, Florida. information for residents, businesses, job postings, services, and more.",0,,,new,,,2026-02-13 06:16:21,2026-02-13 06:16:21,
1966,APP Jet Center,,,https://appjetcenter.com/,Stuart,FL,Stuart,Southeast,aircraft hangar,client,Medium,brave_national,"Snippet: It doesn’t matter if you’re flying a four-seat piston or one of the largest business jets, you’re going to get the same attention to detail and the sa",0,,,new,,,2026-02-13 06:16:21,2026-02-13 06:16:21,
1967,Resources,charter@windsorjet.com,877-938-9508,https://beyondandabove.net/resources/,Stuart,FL,Stuart,Southeast,aircraft hangar,client,High,brave_national,"Snippet: LAUDERDALE, FL United States 33309 Tel: 877-938-9508 Fax: 954-337-8158 Email: <strong>charter@windsorjet.com</strong> Chief pilot: Monti Lisa Head FA ",0,,,new,,,2026-02-13 06:16:21,2026-02-13 06:16:21,
1968,Luxury Private Jet Maintenance,Brian.Whittredge@flyalliance.com,315-717-3580,https://flyalliance.com/maintenance/,Stuart,FL,Stuart,Southeast,aircraft hangar,client,High,brave_national,"Snippet: We are now located at MCO, TEB, SUA, and OPF for onsite services. 📌 Contact: Brian Whittredge, Director of Maintenance 📱 Mobile: 315-717-3580 📧 Email:",0,,,new,,,2026-02-13 06:16:21,2026-02-13 06:16:21,
1969,Hangars,,,https://appjetcenter.com/hangars/,Stuart,FL,Stuart,Southeast,aircraft hangar,client,Medium,brave_national,"Snippet: Hangar Space APP Jet Center has nearly one million square feet of hangar space, ranging from T-hangars to those designed for the largest business jets",0,,,new,,,2026-02-13 06:16:21,2026-02-13 06:16:21,
