id,business_name,email,phone,website,city,state,metro,region,category,lead_type,priority,source,notes,verified,verified_date,verified_result,send_status,approved_date,sent_date,created_at,updated_at,contact_name
8648,Buick GMC Dealer,,,https://www.linusautomotive.com/jupiter/,Jupiter,FL,Jupiter,Southeast,auto dealership,client,Medium,brave_national,Snippet: You found the vehicle you want. Now you have to figure out your financing options. We know that can be stressful. At your leading GMC dealer near Jupi,0,,,new,,,2026-02-13 07:15:36,2026-02-13 07:15:36,
8649,BMW Dealer Jupiter FL New & Pre-Owned Cars for Sale near Tequesta FL,,,https://www.bramanbmwjupiter.com/,Jupiter,FL,Jupiter,Southeast,auto dealership,client,Medium,brave_national,Snippet: Learn More About Our Dealership · About Us · Directions · Hours · Reviews · BMW Blog · BMW YouTube · Braman Motorcars · Braman Motorcars · Management ,0,,,new,,,2026-02-13 07:15:36,2026-02-13 07:15:36,
8650,"Top Rated Car Dealerships near Jupiter, FL",,,https://www.carfax.com/Dealerships-Jupiter-FL_c10390,Jupiter,FL,Jupiter,Southeast,auto dealership,client,Medium,brave_national,"Snippet: Find local dealerships near Jupiter, FL with verified reviews and shop for used cars. All listings include a free CARFAX Report.",0,,,new,,,2026-02-13 07:15:36,2026-02-13 07:15:36,
8677,Aapex Electric – Serving the Treasure Coast Since 2009,,(772) 607-9494,https://aapexelectric.net/,Fort Pierce,FL,Fort Pierce,Southeast,electrician,contractor,Medium,brave_national,"Snippet: (772) 607-9494[email protected]2007 Okeechobee Rd. Ft. Pierce, Fl 34950 · Facebook page opens in new windowInstagram page opens in new window · <stron",0,,,new,,,2026-02-13 07:15:45,2026-02-13 07:15:45,
8678,Fort Pierce Electrician,,,https://www.eliteelectricandair.com/fort-pierce-electrician/,Fort Pierce,FL,Fort Pierce,Southeast,electrician,contractor,Medium,brave_national,"Snippet: Elite Electric, Plumbing &amp; Air is proud to provide superior electrical services in Fort Pierce, FL, and the surrounding area. Our commitment to ex",0,,,new,,,2026-02-13 07:15:45,2026-02-13 07:15:45,
8679,"Fort Pierce, FL",,,https://myelectricianfl.com/fort-pierce-fl/,Fort Pierce,FL,Fort Pierce,Southeast,electrician,contractor,Medium,brave_national,"Snippet: Fort Pierce, FL · Port St Lucie, FL · Expert Electrician in Palm City – My Electrician · Hutchinson Island, FL · Stuart, FL · Hobe Sound, FL · Jupiter",0,,,new,,,2026-02-13 07:15:45,2026-02-13 07:15:45,
8680,"Electricians and Electrical Contractors in Fort Pierce, FL",,(561) 283-4737,https://www.elitepowersolutions.net/Electrician-Services/Fort-Pierce,Fort Pierce,FL,Fort Pierce,Southeast,electrician,contractor,Medium,brave_national,Snippet: This is just a small sample of the electrical contracting services offered by Elite Power Solutions. To speak with one of our professional Fort Pierce,0,,,new,,,2026-02-13 07:15:45,2026-02-13 07:15:45,
8681,Best Electrician in Fort Pierce,,(561) 683-1512,https://swinkelectric.com/best-electrician-in-fort-pierce/,Fort Pierce,FL,Fort Pierce,Southeast,electrician,contractor,Medium,brave_national,Snippet: You can contact us at Swink Electric today or call us at (561) 683-1512 for fast and dependable service. The first step to picking an electrician is c,0,,,new,,,2026-02-13 07:15:45,2026-02-13 07:15:45,
8682,Electrician Fort Pierce Since 1989,office@elconelectric.com,,https://www.elconelectric.com/electrician-fort-pierce-fl/,Fort Pierce,FL,Fort Pierce,Southeast,electrician,contractor,Low,brave_national,"Snippet: If you are unable to reach us, please email us at <strong>office@elconelectric.com</strong> and we will get back to you ASAP. ... Elcon Electric of Fo",0,,,new,,,2026-02-13 07:15:45,2026-02-14 04:26:16,NEEDS_ENRICHMENT
8683,Electrician Fort Pierce,,,https://armanelectric.com/electrician-fort-pierce/,Fort Pierce,FL,Fort Pierce,Southeast,electrician,contractor,Medium,brave_national,"Snippet: Looking for an electrician in Fort Pierce? Arman Electric offers expert electrical repairs, installations, and energy-efficient solutions. Call us tod",0,,,new,,,2026-02-13 07:15:45,2026-02-13 07:15:45,
8684,"Top-Rated Electrician in Fort Pierce, FL",,,https://myelectricianfl.com/service-areas/fort-pierce-fl/,Fort Pierce,FL,Fort Pierce,Southeast,electrician,contractor,Medium,brave_national,"Snippet: Are you looking for a skilled electrician in Fort Pierce, FL? My Electrician, Inc. offers top-rated services to meet all your electrical needs. Contac",0,,,new,,,2026-02-13 07:15:45,2026-02-13 07:15:45,
8720,"Publix Supermarket, #284",,(772) 569-1204,https://business.indianriverchamber.com/list/member/publix-supermarket-284-3071,Vero Beach,FL,Vero Beach,Southeast,grocery store manager,client,Medium,brave_national,Snippet: Groceries &amp; Supermarkets · 2040 58th Ave. Vero Beach FL 32960 · <strong>(772) 569-1204</strong> · Send Email · Visit Website · × · Close · Phone: ,0,,,new,,,2026-02-13 07:15:57,2026-02-13 07:15:57,
8721,"Order from The Fresh Market at The Fresh Market, Vero Beach, Florida",,,https://stores.thefreshmarket.com/fl/vero-beach/115,Vero Beach,FL,Vero Beach,Southeast,grocery store manager,client,Medium,brave_national,Snippet: Learn more about our seafood selection from Seafood Category Manager Mahir Zelihic.,0,,,new,,,2026-02-13 07:15:57,2026-02-13 07:15:57,
8722,"Grocery & Indian River Citrus in Vero Beach, FL",,(772) 794-0040,https://verobeach.com/shop-vero-beach/groceries-citrus-meats-and-vegetables,Vero Beach,FL,Vero Beach,Southeast,grocery store manager,client,Medium,brave_national,"Snippet: With an array of grocery stores, specialty shops, citrus shops, farmers markets and places to get the fresest meats, wines, cheeses, olive oils, veget",0,,,new,,,2026-02-13 07:15:57,2026-02-13 07:15:57,
8723,Business Directory,customerservice@villagebeachmarket.com,,https://verovine.com/business-directory/village-beach-market/,Vero Beach,FL,Vero Beach,Southeast,grocery store manager,client,Low,brave_national,"Snippet: With a large variety of organic and gluten-free items, a vast selection of gourmet products, along with your everyday grocery items, we are sure to ha",0,,,new,,,2026-02-13 07:15:57,2026-02-14 04:26:16,NEEDS_ENRICHMENT
8724,Gourmet Markets in Indian River County,,(772) 500-3663,https://treasurecoastfoodie.com/gourmet-markets-in-indian-river-county/,Vero Beach,FL,Vero Beach,Southeast,grocery store manager,client,Medium,brave_national,"Snippet: His son, Rob, manages the daily operations. The majority of the items in the store have been handpicked from their travels around the world and are ex",0,,,new,,,2026-02-13 07:15:57,2026-02-13 07:15:57,
8725,Market Fresh on the Move,info@tcfoodbank.org,772.489.3034,https://stophunger.org/get-help/market-fresh-onthemove/,Vero Beach,FL,Vero Beach,Southeast,grocery store manager,client,Low,brave_national,"Snippet: Mailing Address: PO Box 370 Fort Pierce, FL 34954 Phone: 772.489.3034 Fax: 772.489.5673 Email: <strong>info@tcfoodbank.org</strong> Web: stophunger.or",0,,,new,,,2026-02-13 07:15:57,2026-02-14 04:26:16,NEEDS_ENRICHMENT
8726,"Grocery Stores in Vero Beach, Florida",,(772) 778-6677,https://us-locations.com/fl/vero-beach/grocery-stores,Vero Beach,FL,Vero Beach,Southeast,grocery store manager,client,Medium,brave_national,"Snippet: 5555 20Th St, Vero Beach Fl 32966 (772) 778-6677 · 1 · 2 · » · Grocery Stores in Alford, Florida · Grocery Stores in Altamonte Springs, Florida · Groc",0,,,new,,,2026-02-13 07:15:57,2026-02-13 07:15:57,
8737,"Veterinarian Stuart, FL",,(772) 677-0584,https://www.montereyanimalclinic.com/,Stuart,FL,Stuart,Southeast,veterinary clinic,client,Medium,brave_national,"Snippet: Veterinarians at Monterey Animal Clinic in Stuart offer wellness, surgery, diagnostics, dental services, &amp; urgent care. Call (772) 677-0584 for he",0,,,new,,,2026-02-13 07:16:01,2026-02-13 07:16:01,
8738,Surfside Pet Hospital,,772-219-8022,https://surfsidepethospital.com/,Stuart,FL,Stuart,Southeast,veterinary clinic,client,Medium,brave_national,Snippet: If you want to ask a question call 772-219-8022 or <strong>email us</strong> and we&#x27;ll promptly get back to you. Surfside Pet Hospital is very ea,0,,,new,,,2026-02-13 07:16:01,2026-02-13 07:16:01,
8739,Vet Near Me 34997,ssah@bellsouth.net,772-287-0024,https://stuartsound.com/,Stuart,FL,Stuart,Southeast,veterinary clinic,client,High,brave_national,"Snippet: 3689 SE Cove Rd, Stuart, Florida 34997 | Mon - Fri 8AM to 5:30PM &amp; Sat 8AM to 12PM | Ph: 772-287-0024 | <strong>ssah@bellsouth.net</strong>",0,,,new,,,2026-02-13 07:16:01,2026-02-13 07:16:01,
8740,Veterinary Medicine,,(772) 497 6386,https://www.coastalanimalhospital.net/,Stuart,FL,Stuart,Southeast,veterinary clinic,client,Medium,brave_national,"Snippet: Contact · Monday | Wednesday | ... Jensen Beach, FL 34957, USA · Emergency · We answer Emergency Calls until 10 P.M. <strong>(772) 497 6386</strong> ·",0,,,new,,,2026-02-13 07:16:01,2026-02-13 07:16:01,
8741,"Veterinarian in Stuart, FL",,,https://www.mypsah.com/,Stuart,FL,Stuart,Southeast,veterinary clinic,client,Medium,brave_national,"Snippet: Contact Us · 4515 SE Dixie Hwy, Stuart, FL 34997 · Learn More Request Appointment · Port Salerno Animal Hospital is a full-service animal hospital who",0,,,new,,,2026-02-13 07:16:01,2026-02-13 07:16:01,
8742,"Vet Near Me Stuart, FL 34997",,,https://allcreatures-stuart.com/contact/,Stuart,FL,Stuart,Southeast,veterinary clinic,client,Medium,brave_national,"Snippet: We look forward to seeing you and your pet soon. Visit All Creatures Animal Hospital at 5885 S Kanner Hwy, Stuart, FL 34997.",0,,,new,,,2026-02-13 07:16:01,2026-02-13 07:16:01,
8744,Pet Clinic Near Me 34997,ssah@bellsouth.net,772-287-0024,https://stuartsound.com/our-practice/,Stuart,FL,Stuart,Southeast,veterinary clinic,client,High,brave_national,"Snippet: 3689 SE Cove Rd, Stuart, Florida 34997 | Mon - Fri 8AM to 5:30PM &amp; Sat 8AM to 12PM | Ph: 772-287-0024 | <strong>ssah@bellsouth.net</strong> ... Ou",0,,,new,,,2026-02-13 07:16:01,2026-02-13 07:16:01,
8745,Pet Emergency of Martin County – Welcome to Pet Emergency of Martin County! Call us today 772-781-33,,772-781-3302,https://petemergencyofmc.com/,Stuart,FL,Stuart,Southeast,veterinary clinic,client,Medium,brave_national,"Snippet: Doctor on site 24/7 including weekends and holidays, we provide emergency care for your pets. Call us at 772-781-3302 to speak with a veterinary techn",0,,,new,,,2026-02-13 07:16:01,2026-02-13 07:16:01,
8746,Boulevard Animal Hospital Stuart Florida Veterinarian Office,,,https://www.boulevardanimalhospitalfl.com/,Stuart,FL,Stuart,Southeast,veterinary clinic,client,Medium,brave_national,Snippet: Boulevard Animal Hospital is located in Stuart Florida and offers Veterinarian services for pets. Dr. Wayne Diamond is the head Veterinarian.,0,,,new,,,2026-02-13 07:16:01,2026-02-13 07:16:01,
8831,Contact Information – Cabinet Makers Warehouse Supply,,,https://stuartcabinetmakers.com/contact/,Stuart,FL,Stuart,Southeast,cabinet maker,contractor,Medium,brave_national,"Snippet: Address:1333 SE Dixie Hwy, Stuart, FL 34994Opens in a new tab ... Yes, we are South Florida’s largest supplier of live edge wood and materials. You ca",0,,,new,,,2026-02-13 07:16:23,2026-02-14 20:30:03,V4_NO_DATA
8832,Cabinet Makers Warehouse Supply – Your Source for Cabinet Supplies,,,https://stuartcabinetmakers.com/,Stuart,FL,Stuart,Southeast,cabinet maker,contractor,Medium,brave_national,"Snippet: We have the supplies, tools and accessories to help you create the most of your home storage. Our Cabinets are perfect for your kitchen, garage, laund",0,,,new,,,2026-02-13 07:16:23,2026-02-13 07:16:23,
8833,Cabinet Makers Warehouse Supply,,(772) 220-7333,https://www.zoominfo.com/c/cabinet-makers-warehouse-supply-inc/529893515,Stuart,FL,Stuart,Southeast,cabinet maker,contractor,Medium,brave_national,Snippet: Cabinet Makers Warehouse Supply contact info: Phone number: (772) 220-7333 Website: <strong>www.stuartcabinetmakers.com</strong> ... Cabinet Makers Wa,0,,,new,,,2026-02-13 07:16:23,2026-02-13 07:16:23,
8834,Kitchen Cabinets Stuart FL,,(818) 835-5888,https://uskitchencabinet.com/location/kitchen-cabinets-stuart-florida/,Stuart,FL,Stuart,Southeast,cabinet maker,contractor,Medium,brave_national,"Snippet: Premium kitchen cabinets in Stuart, FL. Custom cabinet makers serving Palm City, Jensen Beach, Port St. Lucie &amp; all Florida cities. Free estimates",0,,,new,,,2026-02-13 07:16:23,2026-02-13 07:16:23,
8862,Home Remodeler,,(772) 288-6255,https://www.dreammaker-stuart.com/,Stuart,FL,Stuart,Southeast,kitchen renovation contractor,contractor,Medium,brave_national,"Snippet: If you’re looking for Southeast Florida’s premier home remodeling company, look no further! <strong>DreamMaker Bath &amp; Kitchen</strong> has everyth",0,,,new,,,2026-02-13 07:16:33,2026-02-13 07:16:33,
8863,"Stuart, FL",,(772) 288-6255,https://www.dreammaker-stuart.com/areas-we-serve/stuart-fl/,Stuart,FL,Stuart,Southeast,kitchen renovation contractor,contractor,Medium,brave_national,"Snippet: If you are looking to renovate and reinvent your home, call DreamMaker Bath &amp; Kitchen of Stuart, FL. Our staff is fully trained in designing and e",0,,,new,,,2026-02-13 07:16:33,2026-02-13 07:16:33,
8864,Kitchen Renovation,,(772) 365-4877,https://islandhomesfl.com/kitchen-renovation-company-stuart-fl/,Stuart,FL,Stuart,Southeast,kitchen renovation contractor,contractor,Medium,brave_national,"Snippet: Let&#x27;s discuss your next project. Achieve the perfect look for your home. Your dream space is within reach, call <strong>(772) 365-4877</strong>. ",0,,,new,,,2026-02-13 07:16:33,2026-02-13 07:16:33,
8865,Kitchen Remodeling Design Contractor,,(772) 365-4877,https://islandhomesfl.com/kitchen-remodeling-design-contractor-stuart-fl/,Stuart,FL,Stuart,Southeast,kitchen renovation contractor,contractor,Medium,brave_national,Snippet: Call us Today for Kitchen Remodeling Design Contractor in Stuart FL ! <strong>(772) 365-4877</strong> - Island Homes &amp; Renovations.,0,,,new,,,2026-02-13 07:16:33,2026-02-13 07:16:33,
8866,Expert Kitchen Remodeling in Stuart,,(772) 577-2403,https://stuartkitchenremodeling.com/,Stuart,FL,Stuart,Southeast,kitchen renovation contractor,contractor,Medium,brave_national,Snippet: Upgrade your kitchen with expert remodeling services. Contact Stuart Kitchen Remodeling at <strong>(772) 577-2403</strong> or visit our homepage today,0,,,new,,,2026-02-13 07:16:33,2026-02-13 07:16:33,
8867,Kitchen remodeling services in Stuart,info@garciaandsonsconstruct.com,561-631-2025,https://garciaandsonsconstruct.com/solutions/kitchen-remodeling-services-in-stuart/,Stuart,FL,Stuart,Southeast,kitchen renovation contractor,contractor,Low,brave_national,Snippet: We are a full construction company ... Coast and Palm Beaches area. Phone: 561-631-2025 / 772-877-3499 Email: <strong>info@garciaandsonsconstruct.com<,0,,,new,,,2026-02-13 07:16:33,2026-02-14 04:26:16,NEEDS_ENRICHMENT
8868,Kitchen Renovation Contractor,,(772) 365-4877,https://islandhomesfl.com/kitchen-renovation-contractor-stuart-fl/,Stuart,FL,Stuart,Southeast,kitchen renovation contractor,contractor,Medium,brave_national,Snippet: Call us Today for Kitchen Renovation Contractor in Stuart FL ! <strong>(772) 365-4877</strong> - Island Homes &amp; Renovations.,0,,,new,,,2026-02-13 07:16:33,2026-02-13 07:16:33,
8869,Kitchen Remodeling Contractor,,(772) 365-4877,https://islandhomesfl.com/kitchen-remodeling-contractor-stuart-fl/,Stuart,FL,Stuart,Southeast,kitchen renovation contractor,contractor,Medium,brave_national,Snippet: Call us Today for Kitchen Remodeling Contractor in Stuart FL ! <strong>(772) 365-4877</strong> - Island Homes &amp; Renovations.,0,,,new,,,2026-02-13 07:16:33,2026-02-13 07:16:33,
8871,"Home Remodeling in Stuart, FL",Info@allcoastdbr.com,(772) 510-4182,https://allcoastdbr.com,Stuart,FL,Stuart,Southeast,kitchen renovation contractor,contractor,Low,brave_national,"Snippet: Plus, our crew works efficiently, so you can be sure your project will get completed on schedule. Get in touch with us today to arrange a free consult",0,,,new,,,2026-02-13 07:16:33,2026-02-14 04:26:16,NEEDS_ENRICHMENT
8927,Auto Detailing Specialist,,(772) 692-2412,https://www.washnwaxwiz.com/,Stuart,FL,Stuart,Southeast,car wash owner,client,Medium,brave_national,"Snippet: If you are interested in acquiring car wash and automotive detailing services from the friendliest experts in town, or if you would like to learn more",0,,,new,,,2026-02-13 07:16:49,2026-02-13 07:16:49,
8928,Glenn's Touchless Car Wash,glennscarwash@gmail.com,772-208-5448,https://glennscarwash.com/contact-us,Stuart,FL,Stuart,Southeast,car wash owner,client,High,brave_national,"Snippet: South Florida&#x27;s Premier Car Wash · 1761 NW Federal Hwy, Stuart, Florida 34994, United States · <strong>772-208-5448 glennscarwash@gmail.com</stro",0,,,new,,,2026-02-13 07:16:49,2026-02-14 22:31:53,V4_NO_DATA
8929,STUART,,772-380-9274,https://www.paradisecw.com/stuart,Stuart,FL,Stuart,Southeast,car wash owner,client,Medium,brave_national,"Snippet: WASH · 2670 SE FEDERAL HIGHWAY · STUART, FL 34994 · 772-380-9274 · Mon - Sat · 8:30 am – 5:00 pm · Sunday · 8:30 am – 3:00 pm ·",0,,,new,,,2026-02-13 07:16:49,2026-02-13 07:16:49,
8930,Monster Express Car Wash,,,https://www.monsterexpresscarwash.com/,Stuart,FL,Stuart,Southeast,car wash owner,client,Medium,brave_national,"Snippet: We are Stuart, Florida&#x27;s top-rated car wash. Family owned and operated. All car washes come with free vacuums, free window cleaner and towels.",0,,,new,,,2026-02-13 07:16:49,2026-02-13 07:16:49,
8932,Bonjour Car Wash,,,https://www.bonjourcarwash.com/,Stuart,FL,Stuart,Southeast,car wash owner,client,Medium,brave_national,"Snippet: Automatic &amp; Self-Service Car Wash | Stuart, FL Bonjour Stuart! Locally owned Bonjour Car Wash in Stuart, FL is here to help your car shine! Whethe",0,,,new,,,2026-02-13 07:16:49,2026-02-13 07:16:49,
8933,Stuart Car Wash and Detail Center,,,https://stuart-car-wash-and-detail-center.wheree.com/,Stuart,FL,Stuart,Southeast,car wash owner,client,Medium,brave_national,"Snippet: Closed 08:30 AM - 05:00 PM See Hours 1700 SE Federal Hwy, Stuart, FL 34994, United States +1 7722-866-565 Suggest an edit · The Stuart Car Wash and De",0,,,new,,,2026-02-13 07:16:49,2026-02-13 07:16:49,
8934,Top Rated Car Wash in Stuart FL,,,https://www.monsterexpresscarwash.com/location/,Stuart,FL,Stuart,Southeast,car wash owner,client,Medium,brave_national,"Snippet: We’re opening soon – stay tuned for updates! 3373 SE Federal Hwy Stuart, FL 34997 · Top Rated Car Wash in Stuart, Florida ·",0,,,new,,,2026-02-13 07:16:49,2026-02-13 07:16:49,
9040,"Contact Mark Vericella, Email: ****@jupitermarine.com & Phone Number",,,https://www.zoominfo.com/p/Mark-Vericella/-921074244,Jupiter,FL,Jupiter,Southeast,warehouse owner,client,Medium,brave_national,"Snippet: Mark Vericella is a Warehouse at Jupiter Marine International Holdings based in Palmetto, Florida.Explore more",0,,,new,,,2026-02-13 07:19:20,2026-02-13 07:19:20,
9041,"Warehouses for Sale in Jupiter, FL",,888.273.0423,https://www.crexi.com/properties/FL/Jupiter/Warehouses,Jupiter,FL,Jupiter,Southeast,warehouse owner,client,Medium,brave_national,"Snippet: Port St. Lucie Warehouse Space7 properties ... For assistance, reach out to our support team at [email protected] or call 888.273.0423 . For press inq",0,,,new,,,2026-02-13 07:19:20,2026-02-13 07:19:20,
9042,"Warehouses for Lease in Jupiter, FL",,888.273.0423,https://www.crexi.com/lease/properties/FL/Jupiter/Warehouses,Jupiter,FL,Jupiter,Southeast,warehouse owner,client,Medium,brave_national,"Snippet: FL · Jupiter · Retail · Warehouse · Trustpilot · For assistance, reach out to our support team at [email protected] or call 888.273.0423 . For press i",0,,,new,,,2026-02-13 07:19:20,2026-02-13 07:19:20,
9043,Peter Lyn,,(561)624-3634,https://www.smartbackgroundchecks.com/people/peter-lyn/EmLkZQH1AwR3AmpkAGD0AGNjAt,Jupiter,FL,Jupiter,Southeast,warehouse owner,client,Medium,brave_national,"Snippet: <strong>Peter Lyn</strong> is living on 336 Rudder Cay Way in Jupiter,FL. (561)624-3634 Full address, phone, email history available - SmartBackground",0,,,new,,,2026-02-13 07:19:20,2026-02-13 07:19:20,
9046,Jupiter Industrial Space For Rent,,888.273.0423,https://www.crexi.com/lease/properties/FL/Jupiter/Industrial,Jupiter,FL,Jupiter,Southeast,warehouse owner,client,Medium,brave_national,Snippet: Warehouse21 spaces · Distribution19 spaces · Manufacturing18 spaces · Flex7 spaces · R&amp;D4 spaces · Office48 spaces · Retail39 spaces · Special Pur,0,,,new,,,2026-02-13 07:19:20,2026-02-13 07:19:20,
9048,"Jupiter, FL Industrial & Warehouse Space for Rent",,,https://www.commercialsearch.com/industrial/us/fl/jupiter/,Jupiter,FL,Jupiter,Southeast,warehouse owner,client,Medium,brave_national,"Snippet: Warehouses address storage and distribution needs and typically feature high ceilings, large floors, numerous loading docks, and climate control syste",0,,,new,,,2026-02-13 07:19:20,2026-02-13 07:19:20,
9049,Properties in Jupiter,NewLandlords@FloridasPropertyManagement.com,561.516.5283,https://www.floridaspropertymanagement.com/commercial-property-management/Jupiter.html,Jupiter,FL,Jupiter,Southeast,warehouse owner,client,High,brave_national,Snippet: New Landlords | 561.516.5283 <strong>NewLandlords@FloridasPropertyManagement.com</strong> · Apply Now Available Homes Pay Now Maintenance Under Manage,0,,,new,,,2026-02-13 07:19:20,2026-02-13 07:19:20,
9117,CCVB,church@ccvb.net,772-778-8819,https://ccvb.net/,Vero Beach,FL,Vero Beach,Southeast,church religious facility,client,High,brave_national,"Snippet: Vero Beach, FL 32960 · Tuesday ... times or where to find us please call the church office at 772-778-8819 or email <strong>church@ccvb.net</strong>..",0,,,new,,,2026-02-13 07:19:38,2026-02-13 07:19:38,
9118,Welcome and Core Beliefs,,,https://pccvero.org/come/,Vero Beach,FL,Vero Beach,Southeast,church religious facility,client,Medium,brave_national,"Snippet: Mailing address: P.O. BOX 2288 Vero Beach, FL 32961-2288",0,,,new,,,2026-02-13 07:19:38,2026-02-13 07:19:38,
9119,Trinity Episcopal Church & School,ahiser@TrinityVero.org,(772.567.1146,https://trinityvero.org/,Vero Beach,FL,Vero Beach,Southeast,church religious facility,client,High,brave_national,"Snippet: If you are unable to attend the Bible Study in person, you may now join us via Zoom. To receive a Zoom link, please contact Alyssa Hiser in the Church",0,,,new,,,2026-02-13 07:19:38,2026-02-13 07:19:38,
9120,The Community Church: HOME,,,https://www.ccovb.org/,Vero Beach,FL,Vero Beach,Southeast,church religious facility,client,Medium,brave_national,Snippet: 8:30 a.m. in Grace Chapel​​​ · 9:30 a.m. C2 (Contemporary) Live in Community Hall,0,,,new,,,2026-02-13 07:19:38,2026-02-13 07:19:38,
9121,Church in Vero Beach,,,https://pathwayvb.com/,Vero Beach,FL,Vero Beach,Southeast,church religious facility,client,Medium,brave_national,"Snippet: We are located at 1105 58th Ave. Vero Beach, FL 32966 ... At Pathway Church, we love ALL people. That means, come as you are! You will see anything fr",0,,,new,,,2026-02-13 07:19:38,2026-02-13 07:19:38,
9122,Vero Beach Alliance Church,gramsh4christ@yahoo.com,(772) 567-6719,https://www.verobeachalliancechurch.com,Vero Beach,FL,Vero Beach,Southeast,church religious facility,client,High,brave_national,"Snippet: Vero Beach, FL 32960 · Call Pastor Joseph Litton at (772) 567-6719, or email him at <strong>gramsh4christ@yahoo.com</strong>",0,,,new,,,2026-02-13 07:19:38,2026-02-13 07:19:38,
9123,"Church in Vero Beach, FL",,,https://www.christfellowship.church/locations/vero-beach,Vero Beach,FL,Vero Beach,Southeast,church religious facility,client,Medium,brave_national,"Snippet: Here at Christ Fellowship Church in Vero Beach, FL we want to help you live the life you were created for. Every Sunday, we have church services where",0,,,new,,,2026-02-13 07:19:38,2026-02-13 07:19:38,
9124,"Gracespring Church Vero Beach, FL",,772-562-5298,https://www.gracespring.com/,Vero Beach,FL,Vero Beach,Southeast,church religious facility,client,Medium,brave_national,"Snippet: <strong>Gracespring - Evangelical Church</strong> located in Vero Beach, Florida. 1955 20th Street Vero Beach, FL. 32960 772-562-5298",0,,,new,,,2026-02-13 07:19:38,2026-02-13 07:19:38,
9160,Tile Installation Jupiter Florida,,(954) 526-4711,https://uiconstruction.com/tile-installation-jupiter-florida.php,Jupiter,FL,Jupiter,Southeast,tile installation,contractor,Medium,brave_national,Snippet: Which faucet do I pick to work with this sink? All of these questions can be addressed with a call to UI Construction. Let our experts help you make t,0,,,new,,,2026-02-13 07:19:50,2026-02-13 07:19:50,
9161,Lighthouse Tile & Marble,,,https://www.lighthousetileandmarble.com/,Jupiter,FL,Jupiter,Southeast,tile installation,contractor,Medium,brave_national,"Snippet: Lighthouse Tile &amp; Marble Inc. provides expert service in Tile, Marble, Ceramic, Bathroom, Kitchen, and Mosaic to clients in and around Jupiter FL.",0,,,new,,,2026-02-13 07:19:50,2026-02-13 07:19:50,
9162,"Tile Market and Design Luxury Tile in Jupiter, Florida",,,https://www.tilemarketjupiter.com/contact/,Jupiter,FL,Jupiter,Southeast,tile installation,contractor,Medium,brave_national,"Snippet: Come visit us at the Tile Market and Design Center in Jupiter, Florida Please bring photos &amp; samples of any existing elements in your space.",0,,,new,,,2026-02-13 07:19:50,2026-02-13 07:19:50,
