business_name,phone,email,website,address,city,state,category,source,date_found,priority,contacted,notes
Property Boss LLC,(772) 621-2273,,https://www.propertybossllc.com/stuart,770 SE Indian St,Stuart,FL,Property Management,websearch,2026-02-12,High,No,Full contact info found via website
Coastal Management Professionals,561-310-9672,,https://coastalmgmtpros.com/property-management-in-stuart-fl/,Stuart FL Area,Stuart,FL,Property Management,websearch,2026-02-12,High,No,Contact: Zachary Greenberg - Broker/Owner
South Florida Realty Management,,,https://www.floridapm.net/,Stuart FL,Stuart,FL,Property Management,websearch,2026-02-12,Medium,No,Website visited but specific contact info not found in extracted content
JC Epoxy Coatings,(954) 994-8204,,https://jcepoxycoatings.com/,Port St. Lucie,Port St. Lucie,FL,Epoxy Flooring,websearch,2026-02-12,Medium,No,Epoxy flooring contractor with 5+ years experience
Port St Lucie Epoxy Pros,,,https://www.epoxyportstlucie.com/,Port St. Lucie,Port St. Lucie,FL,Epoxy Flooring,websearch,2026-02-12,Medium,No,Decades of experience in concrete and epoxy flooring
Choice Epoxy Coatings,,,https://choiceepoxycoatings.com/,Treasure Coast Area,Treasure Coast,FL,Epoxy Flooring,websearch,2026-02-12,Medium,No,Family owned with 20-year warranty offered
Maaco Auto Body & Painting Stuart,,,https://www.maaco.com/locations/fl/stuart-11152/,Stuart,Stuart,FL,Auto Body Shop,websearch,2026-02-12,High,No,Locally owned auto body shop since 1972
Gizze Construction Inc,,,https://gizzeconstructioninc.com/,Port St Lucie Area,Port St Lucie,FL,Kitchen Renovation,websearch,2026-02-12,Medium,No,General contractor serving Treasure Coast
Floridian Kitchens,,,https://www.floridiankitchens.com/,Stuart,Stuart,FL,Kitchen Renovation,websearch,2026-02-12,High,No,Kitchen and bathroom remodeling since 2016
Garcia & Sons Construction LLC,,,https://garciaandsonsconstruct.com/solutions/kitchen-remodelers-in-treasure-coast/,Treasure Coast Area,Treasure Coast,FL,Kitchen Renovation,websearch,2026-02-12,Medium,No,Specialized in drywall and metal framing, expanded to kitchen remodeling"Property Managers in Port Saint Lucie, FL",,,https://www.zillow.com/professionals/property-manager-reviews/port-saint-lucie-fl/,,Port St Lucie,FL,property_manager,websearch,2026-02-12,Medium,No,"We found 147 property management companies in Port Saint Lucie, FL. Find the best Port Saint Lucie, "
Port St Lucie property management,,,https://www.fsresidential.com/florida/offices/port-st-lucie-property-management/,,Port St Lucie,FL,property_manager,websearch,2026-02-12,Medium,No,"FirstService Residential provides Port St Lucie property management, going above and beyond to enhan"
Florida Property Management Agency,,,https://www.mgtspec.com/,,Port St Lucie,FL,property_manager,websearch,2026-02-12,Medium,No,We offer full service annual property management for both residential and commercial properties in S
Real Property Management Dynamic,,,https://www.rpmdynamic.com/,,Port St Lucie,FL,property_manager,websearch,2026-02-12,Medium,No,Real Property Management Dynamic is the affordable solution to managing real estate in Port St Lucie
"Best Property Management Companies in Port St. Lucie, FL",,,https://www.expertise.com/business/property-management/florida/port-st-lucie,,Port St Lucie,FL,property_manager,websearch,2026-02-12,Medium,No,"Vero Beach Rent offers its services to clients in and around Port St. Lucie. It manages townhouses, "
Quest Property Management Services for Your Home,,,https://questrealestatesolutions.com/,,Port St Lucie,FL,property_manager,websearch,2026-02-12,Medium,No,"The One Solution for All your Real Estate Needs! Professional listing agent, buyers agent, rental ag"
Property Management,,,https://nex-genpartners.com/services/property-management/,,Port St Lucie,FL,property_manager,websearch,2026-02-12,Medium,No,"NeX-Gen Partners Property Management, LLC is one of Florida's premiere property management companies"
Apartments for Rent in Fort Pierce FL,,,https://www.apartments.com/fort-pierce-fl/,,Fort Pierce,FL,apartment_complex,websearch,2026-02-12,Medium,No,"Fort Pierce, FL's average rent price is $1,550 per month. Compare rent prices and available listings"
"Apartments for Rent in Fort Pierce, FL",,,https://www.realtor.com/apartments/Fort-Pierce_FL,,Fort Pierce,FL,apartment_complex,websearch,2026-02-12,Medium,No,"Explore 410 apartments for rent in Fort Pierce, FL. Compare photos, prices, and amenities to find th"
Apartments for Rent in 34947,,,https://www.apartments.com/fort-pierce-fl-34947/,,Fort Pierce,FL,apartment_complex,websearch,2026-02-12,Medium,No,"See all 116 apartments in 34947, Fort Pierce, FL currently available for rent. Each Apartments.com l"
Apartments for Rent in Fort Pierce FL with Utilities Included,,,https://www.apartments.com/fort-pierce-fl/utilities-included/,,Fort Pierce,FL,apartment_complex,websearch,2026-02-12,Medium,No,"Browse through 53 apartments for rent in Fort Pierce with utilities like water, electricity, interne"
Signature Property Management,,,https://www.signaturepropertymgmt.com/,,Stuart,FL,hoa,websearch,2026-02-12,High,No,"Signature Property Management provides impactful, solution based association management for condomin"
"Martin, FL Property Management Companies",,,https://www.campbellpropertymanagement.com/martin-property-management-companies,,Stuart,FL,hoa,websearch,2026-02-12,High,No,"Campbell offers professional property management in Martin, FL. Our property management services inc"
Professional HOA & COA Services in Martin County,,,https://www.tamcare.com/hoa-coa-services-martin-county/,,Stuart,FL,hoa,websearch,2026-02-12,High,No,"We specialize in HOA & COA services in Martin County, offering professional janitorial services that"
Coastal Property Management – Stuart & Jupiter – Condominium ...,,,https://www.cpmfl.com/,,Stuart,FL,hoa,websearch,2026-02-12,High,No,"Jupiter, FL 33477. 561-781-8030. Get Social. © Copyright 2014 - 2026 | Coastal Property Management F"
Palm Beach and Martin Counties Property Management,,,https://www.homepropertymanagement.com/south-florida-property-management,,Stuart,FL,hoa,websearch,2026-02-12,High,No,"Founded in 1985, Home Property Management has sent more than ninety-four million dollars ($94,000,00"
"Martin Property Management, Martin Property ...",,,https://www.homeriver.com/florida/martin-property-management,,Stuart,FL,hoa,websearch,2026-02-12,High,No,Trust your Martin property management to HomeRiver Group®. Our experienced Martin property managers 
Properties & Communities,,,https://www.watsonassociationmanagement.com/properties/,,Stuart,FL,hoa,websearch,2026-02-12,High,No,Properties & Communities. Select a community or property name and access specific information. Searc
St. Lucie and Martin County Property Management Agency,,,https://www.mgtspec.com/home-1-2/,,Stuart,FL,hoa,websearch,2026-02-12,High,No,We offer full service annual property management for both residential and commercial properties in S
"Best Auto Body Shops near Port Saint Lucie, FL",,,https://www.carwise.com/auto-body-shops/fl/port%2520saint%2520lucie,,Port St Lucie,FL,auto_shop,websearch,2026-02-12,Medium,No,"Joe Hudson's Collision Center-St. Lucie. 4.9. 1,953 reviews. (772) 336-33731057 SW South Macedo Blvd"
Auto Body Shop,,,https://jhcc.com/locations/auto-body-shop-port-st-lucie/,,Port St Lucie,FL,auto_shop,websearch,2026-02-12,Medium,No,"JHCC in Port St. Lucie offers expert auto body repairs, including painting & dent removal, efficient"
Classic Collision Port Saint Lucie,,,https://classiccollision.com/locations/classic-collision-port-saint-lucie/,,Port St Lucie,FL,auto_shop,websearch,2026-02-12,Medium,No,"1048 SW Biltmore St Port St. Lucie, FL 34983 Phone (772) 879-4447 Distance Today's Hours Open from 7"
Port St Lucie FL Auto Body Repair,,,https://www.gerbercollision.com/locations/port-st-lucie-fl,,Port St Lucie,FL,auto_shop,websearch,2026-02-12,Medium,No,Gerber Collision & Glass Port St Lucie - 475 NW Enterprise Dr offers collision auto body repair with
Collision Repair in Port St Lucie,,,https://crashchampions.com/locations/port-st-lucie,,Port St Lucie,FL,auto_shop,websearch,2026-02-12,Medium,No,"Best RV and coach repair in Port St. Lucie, FL with Crash Champions. Quality service and lifetime gu"
"Auto Body Shop near Port Saint Lucie, FL 34952",,,https://www.carwise.com/auto-body-shops/34952,,Port St Lucie,FL,auto_shop,websearch,2026-02-12,Medium,No,"Top 20 Best Auto Body Shops near Port Saint Lucie, FL 34952 with customer reviews - ZIMMER COLLISION"
Vantazma Collision,,,https://www.vantazma-car-care.com/,,Port St Lucie,FL,auto_shop,websearch,2026-02-12,Medium,No,"We're committed to delivering high-quality collision repair, clean restorations, and professional pa"
Auto Body Services,,,https://www.allroadsrepair.com/auto-body,,Port St Lucie,FL,auto_shop,websearch,2026-02-12,Medium,No,Visit All Roads Truck & Auto Repair for auto body services. ASE-certified technicians. Same-day serv
"Get Kitchen Remodeling in Jensen Beach, FL",,,https://jupiterkitchenrenovation.com/kitchen-remodeling-jensen-beach-fl,,Jensen Beach,FL,restaurant,websearch,2026-02-12,Medium,No,"Kitchen remodeling in Jensen Beach, FL helps property owners update, redesign, and improve kitchen f"
Cooke Construction,,,https://cookeconstructioninc.com/,,Jensen Beach,FL,restaurant,websearch,2026-02-12,Medium,No,Cooke Construction INC offers expert kitchen remodeling in Jensen Beach FL. Transform your space wit
Remodeling Contractor: Island Kitchen & Bath,,,https://ikbconstruction.com/,,Jensen Beach,FL,restaurant,websearch,2026-02-12,Medium,No,Reach out to us now at (772) 237-7348 and speak with a professional remodeling contractor. Find out 
Kitchen Remodeling,,,https://sweetgc.com/kitchen-remodeling/,,Jensen Beach,FL,restaurant,websearch,2026-02-12,Medium,No,"750 NE Jensen Beach Blvd. Jensen Beach, FL 34957 PHONE: (772) 206-2670 EMAIL: contact@sweetgc.com HO"
Jensen Beach FL,,,https://www.dreammaker-stuart.com/areas-we-serve/jensen-beach-fl/,,Jensen Beach,FL,restaurant,websearch,2026-02-12,Medium,No,Our Remodeling Service · Our Remodeling Process · Virtual Reality · Reviews · Blog ... We recently h
Home Services at Jensen Beach #221,,,https://www.homedepot.com/l/Jensen-Beach/FL/Jensen-Beach/34957/221/services,,Jensen Beach,FL,restaurant,websearch,2026-02-12,Medium,No,We also provide design services for projects like kitchen remodeling and blinds installation to help
"Best 15 Kitchen & Bathroom Remodelers in Jensen Beach, FL",,,https://www.houzz.com/professionals/kitchen-and-bath-remodelers/jensen-beach-fl-us-probr0-bo~t_11825~r_4160171,,Jensen Beach,FL,restaurant,websearch,2026-02-12,Medium,No,Search 467 Jensen Beach kitchen & bathroom remodelers to find the best kitchen and bathroom remodele
"Restaurant Construction in Jensen Beach, FL",,,https://www.aegenconstruction.com/restaurant-construction,,Jensen Beach,FL,restaurant,websearch,2026-02-12,Medium,No,"At AEgen Construction, we specialize in building custom restaurants that reflect your vision and mee"
Trusted Cleaning Company in Stuart FL,,,https://www.customcleaningtc.com/,,Stuart,FL,cleaning,websearch,2026-02-12,High,No,Custom Cleaning provides expert residential and commercial cleaning services across the Treasure Coa
"Commercial Cleaning Services in Stuart, Florida",,,https://enviro-master.com/commercial-cleaning-locations/melbourne-florida/stuart-florida-service-area,,Stuart,FL,cleaning,websearch,2026-02-12,High,No,"Professional commercial cleaning services in Stuart, Florida, by Enviro-Master of Melbourne. Enhance"
"Stuart, FL Commercial Cleaning and Janitorial Services",,,https://cleanproservicesllc.com/stuart-fl-commercial-janitorial-cleaning-company/,,Stuart,FL,cleaning,websearch,2026-02-12,High,No,"A full-service Stuart, FL commercial cleaning company and janitorial service that provides reliable "
"Cleaning Services Stuart, Jensen Beach FL 772-205-3994",,,https://dustintimecleaning.com/,,Stuart,FL,cleaning,websearch,2026-02-12,High,No,We are proud to offer a full range of house and commercial cleaning services custom tailored to fit 
"Fresh and Clean Cleaning Service, Stuart, FL 34997, US",,,https://www.mapquest.com/us/florida/fresh-and-clean-cleaning-service-543047965,,Stuart,FL,cleaning,websearch,2026-02-12,High,No,"Olivera House Keeping is a professional cleaning service based in Stuart, FL, offering comprehensive"
"Commercial Cleaning Services in Stuart, FL",,,https://www.tarltoncleanteam.com/florida-1/commercial-cleaning-services-in-stuart%252C-fl,,Stuart,FL,cleaning,websearch,2026-02-12,High,No,"From window cleaning, floor care, and carpet maintenance to trash removal and thorough disinfection,"
Florida Investment Properties,,,https://www.treasurecoasthomesales.com/buying-investment-properties/,,Stuart,FL,real_estate,websearch,2026-02-12,High,No,"Our team will help you build a robust portfolio of quality investment properties, managing your tran"
Treasure Coast Real Estate,,,https://www.reeftoranch.com/,,Stuart,FL,real_estate,websearch,2026-02-12,High,No,"With a vast portfolio of listings across diverse locations, we are well-equipped to assist buyers in"
Treasure Coast Realty Group,,,https://www.treasurecoastrealtygroup.com/,,Stuart,FL,real_estate,websearch,2026-02-12,High,No,"Search all area real estate for sale on one easy-to-use site. Including homes, condos, townhomes, la"
Excellent Investment,,,https://www.zillow.com/port-saint-lucie-fl/excellent-investment_att/,,Stuart,FL,real_estate,websearch,2026-02-12,High,No,Zillow has 78 homes for sale in Port Saint Lucie FL matching Excellent Investment. View listing phot
RE/MAX Gold,,,https://www.remaxgoldflorida.com/,,Stuart,FL,real_estate,websearch,2026-02-12,High,No,"RE/MAX Gold is the premier real estate office on the Treasure Coast serving Port St Lucie, Jensen Be"
Estate Listings on,,,https://www.slccommercial.com/commercial-real-estate-listings-treasure-coast/,,Stuart,FL,real_estate,websearch,2026-02-12,High,No,Search commercial real estate opportunities in the beautiful Treasure Coast of Florida. Whether you 
Luxury Homes of the Treasure Coast,,,https://luxhomestc.com/,,Stuart,FL,real_estate,websearch,2026-02-12,High,No,Find your dream home with us. We specialize in luxury properties and offer personalized service to m
Treasure Coast Fl. Real Estate Articles,,,https://realestateexpoinc.com/articles/,,Stuart,FL,real_estate,websearch,2026-02-12,High,No,Investors can find a range of properties—from beachfront condos and single-family rental homes to co
Treasure Coast Real Estate: Treasure Coast Homes for Sale,,,http://www.treasurecoastmlssearch.com/,,Stuart,FL,real_estate,websearch,2026-02-12,High,No,This website features homes for sale all over the Treasure Coast and is frequently updated every 15 
"Top Rated Car Dealerships near Stuart, FL",,,https://www.carfax.com/Dealerships-Stuart-FL_c9849,,Stuart,FL,auto_shop,websearch,2026-02-12,High,No,"Victory Auto is a very nice family ran auto business located in Stuart, Florida! The staff and manag"
New & Used Cars For Sale,,,https://www.wallaceautogroup.com/?srsltid=AfmBOoqHWyl4_9Cg4VRl7tlnhcyWcs0zx0YJDbF6gYjSOELPXPt75ANB,,Stuart,FL,auto_shop,websearch,2026-02-12,High,No,The Wallace Auto Group located in Stuart & Ft. Pierce carries 15 new car dealerships & over 400 used
Wallace Chevrolet,,,https://www.wallacechevrolet.com/?srsltid=AfmBOopNn__4h6gHfTzP5_LGy-U5YPYAhDbbBEW5SdKXfzjgpjLBLLIe,,Stuart,FL,auto_shop,websearch,2026-02-12,High,No,"Wallace Chevrolet located at 3575 SE Federal Hwy, Stuart, FL 34997 is the Treasure Coasts premier Ch"
"All Dealers in Stuart, FL 34997",,,https://www.autotrader.com/car-dealers/stuart-fl,,Stuart,FL,auto_shop,websearch,2026-02-12,High,No,"Find Stuart Dealers. Search for all dealers in Stuart, FL 34997 and view their inventory at Autotrad"
"Starling Buick GMC Dealership in Stuart, FL",,,https://www.starlingbuickgmcstuart.com/,,Stuart,FL,auto_shop,websearch,2026-02-12,High,No,"Recognized for our unwavering commitment to quality and service, we proudly stand among the elite to"
Honda Dealership Stuart FL,,,https://www.johnsonhondaofstuart.com/,,Stuart,FL,auto_shop,websearch,2026-02-12,High,No,"Visit Johnson Honda of Stuart for all of your Honda needs in Stuart, FL. Shop cars for sale, browse "
Treasure Coast Toyota Of Stuart,,,https://www.treasurecoasttoyotaofstuart.com/,,Stuart,FL,auto_shop,websearch,2026-02-12,High,No,Discover top Toyota models serving Port St. Lucie at Treasure Coast Toyota of Stuart. Great deals aw
"Wallace Chrysler, Jeep, Dodge, Ram & Wagoneer Dealership In ...",,,https://www.wallacecjd.com/?srsltid=AfmBOorlSn6JaJN7zDU4gP6dI2IL6n2skx1ksjZz0VgzKlEPoooQxAhB,,Stuart,FL,auto_shop,websearch,2026-02-12,High,No,"Wallace Chrysler, Jeep, Dodge, RAM, Wagoneer is your premier Treasure Coast dealer located at 2755 S"
Fort Pierce Warehouses For Rent & Lease,,,https://www.loopnet.com/search/listings/warehouses/fort-pierce-fl/for-lease/,,Fort Pierce,FL,warehouse,websearch,2026-02-12,Medium,No,"There are 20 Warehouses For Rent in Fort Pierce, FL · 2820 Reynolds Dr · 2610 Orange Ave · 1605 Oran"
Fort Pierce Industrial Space For Rent,,,https://www.crexi.com/lease/properties/FL/Fort_Pierce/Industrial,,Fort Pierce,FL,warehouse,websearch,2026-02-12,Medium,No,"Search Industrial properties for lease in Fort Pierce. Review property details, see photos & contact"
Fort Pierce Industrial and Warehouse Space For Rent,,,https://www.showcase.com/fl/fort-pierce/warehouses/for-rent/,,Fort Pierce,FL,warehouse,websearch,2026-02-12,Medium,No,"View Exclusive Photos, Floorplans, and Pricing Details for all Fort Pierce, FL Industrial and Wareho"
"Fort Pierce, FL Warehouses for Rent & Lease",,,https://realmo.com/warehouses/for-lease/fl/fort-pierce/,,Fort Pierce,FL,warehouse,websearch,2026-02-12,Medium,No,"Explore 74 Fort Pierce, FL Warehouses properties available for lease, featuring detailed listings, i"
"Fort Pierce, FL Industrial & Warehouse Spaces for Rent",,,https://www.propertyshark.com/cre/industrial/us/fl/fort-pierce/,,Fort Pierce,FL,warehouse,websearch,2026-02-12,Medium,No,"Discover Fort Pierce, FL industrial & warehouse spaces for rent. Browse for the latest listings and "
"Fort Pierce, FL Industrial & Warehouse Space for Rent",,,https://www.commercialsearch.com/industrial/us/fl/fort-pierce/,,Fort Pierce,FL,warehouse,websearch,2026-02-12,Medium,No,"Warehouse space available for rent in Fort Pierce ranges in size from 1,536 square feet to 1,102,950"
"Fort Pierce, FL Warehouses for Rent",,,https://rent.warehouseexchange.com/search/warehouse/fort%2520pierce-fl/for-rent/1439,,Fort Pierce,FL,warehouse,websearch,2026-02-12,Medium,No,"Discover warehouses for rent in Fort Pierce, FL. Find best leasing options for warehouses on Warehou"
"2700 Industrial Ave 2 , Fort Pierce, FL 34946",,,https://warehousespaces.com/warehouse-for-rent/United-States/FL/Fort%2520Pierce/2700-Industrial-Ave-2-Fort-Pierce-FL-34946/,,Fort Pierce,FL,warehouse,websearch,2026-02-12,Medium,No,"2700 Industrial Ave 2 , Fort Pierce, FL 34946 provides tenants 70000 square feet of warehouse space "
"Industrial Warehouse/Flex Space, Fort Pierce, FL for lease",,,http://www.slccommercial.com/commercial-real-estate-listings-treasure-coast/?propertyId=1578324-lease,,Fort Pierce,FL,warehouse,websearch,2026-02-12,Medium,No,"Industrial Warehouse/Flex Space. 883 S Kings Hwy, Fort Pierce, FL 34945. Overview. Price: $16.00 SF/"
Jupiter Mobile Detailing,,,https://jupitermobiledetailing.com/,,Jupiter,FL,mobile_detailing,websearch,2026-02-12,Low,No,Our Services · Standard Interior & Exterior Cleaning: · Headlight Restoration: · Upholstery Cleaning
Fleet services,,,https://gruntservices.com/service/fleet-services,,Jupiter,FL,mobile_detailing,websearch,2026-02-12,Low,No,"Reliable fleet services with mobile maintenance and concierge solutions in Jupiter, Florida. Keep yo"
Jupiter Detail: Car Detailing in Jupiter FL,,,https://jupiterdetail.com/,,Jupiter,FL,mobile_detailing,websearch,2026-02-12,Low,No,"Jupiter's own mobile car, truck and RV detailers. Mobile car wash, interior/exterior deep clean, wax"
Fleet Washing Jupiter FL,,,https://danryanspressurecleaning.com/fleet-washing/jupiter-fl/,,Jupiter,FL,mobile_detailing,websearch,2026-02-12,Low,No,"Expert Fleet Washing Services in Jupiter, FL. (561) 313-3569 · Get A Quote ... Cleaning & Window Cle"
Tru Mobile Detailing,,,https://trumobiledetailing.com/,,Jupiter,FL,mobile_detailing,websearch,2026-02-12,Low,No,"Tru Mobile Auto Detailing is your go-to mobile detailing service proudly serving Jupiter, Loxahatche"
"Car Detailing Jupiter, FL",,,https://localsautomarinedetailing.com/,,Jupiter,FL,mobile_detailing,websearch,2026-02-12,Low,No,"We offer comprehensive cleaning packages for your vehicle, including interior upholstery care and ex"
"Clearshine Detailing: Vehicle Detailing Services Jupiter, FL",,,https://www.clearshinedetailingfl.net/,,Jupiter,FL,mobile_detailing,websearch,2026-02-12,Low,No,"Discover efficient vehicle detailing services in Jupiter, FL. Contact us at (772) 304-4919 today for"
"Premium Car Detailing in Jupiter, FL",,,https://beyondlimitsdetailing.com/index.php/jupiter-florida/,,Jupiter,FL,mobile_detailing,websearch,2026-02-12,Low,No,"Elevate your ride with our top-tier car detailing services in Jupiter, Florida. Contact Us Today To "
"Jupiter, FL",,,https://www.estebanbrothersmobilecarwash.com/jupiter-fl,,Jupiter,FL,mobile_detailing,websearch,2026-02-12,Low,No,"Keep your car spotless with Esteban Brothers Mobile Car Wash. We offer detailing, paint correction, "
Vero Beach Epoxy Floors by CJ Epoxy,,,https://cjepoxy.com/,,Vero Beach,FL,auto_shop,websearch,2026-02-12,Low,No,"At CJ Epoxy & Advanced Floor Coatings, we specialize in delivering exceptional epoxy and concrete co"
Garage Floor Coating: Professional Epoxy Flooring,,,https://indianriverconcretecoatings.com/,,Vero Beach,FL,auto_shop,websearch,2026-02-12,Low,No,"Transform your Garage, Porch, or Sidewalk with our durable polyaspartic and Professional epoxy floor"
ABOUT US,,,https://www.rtiepoxyfloors.com/about-us,,Vero Beach,FL,auto_shop,websearch,2026-02-12,Low,No,"RTI Epoxy Floors is a top-notch Flooring contractor, Serving - Indian River County, Vero Beach Flori"
Epoxy Flooring,,,https://www.buciopainting.net/epoxy-flooring,,Vero Beach,FL,auto_shop,websearch,2026-02-12,Low,No,"For epoxy flooring solutions, call Bucio Painting Inc. in Vero Beach, FL at 772-360-5052."
"Best 15 Flooring Companies & Installers in Vero Beach, FL",,,https://www.houzz.com/professionals/hardwood-flooring-dealers/vero-beach-fl-us-probr0-bo~t_28349~r_4176409,,Vero Beach,FL,auto_shop,websearch,2026-02-12,Low,No,"Superior Floor Coatings is a leader in the industry, servicing the Port St. Lucie area, providing ep"
Epoxy Garage Flooring Solutions in Vero Beach,,,https://enhanceyourgarage.com/epoxy-garage-flooring-solutions-vero-beach/,,Vero Beach,FL,auto_shop,websearch,2026-02-12,Low,No,"Discover unparalleled excellence at The Garage Enhancement Company, where our exceptional garage flo"
Modern Concrete Floor Coatings Vero Beach FL,,,https://customsurfacellc.com/service-areas/florida/indian-river-county/vero-beach/,,Vero Beach,FL,auto_shop,websearch,2026-02-12,Low,No,"As Vero Beach's trusted epoxy flooring provider, we focus on quality work and honest service. We use"
"Our Experienced Handyman Palm City, FL",,,https://www.mrhandyman.com/vero-beach-jupiter/geo/palm-city/,,Palm City,FL,property_manager,websearch,2026-02-12,High,No,We have a range of excellent services to help Palm City homeowners get the simple repairs or major r
Palm City Handyman Service,,,https://therepairguyservices.com/handyman-services/,,Palm City,FL,property_manager,websearch,2026-02-12,High,No,"Our team of experts offers a variety of Palm City property maintenance services, from general repair"
"Handyman & Home Repair Services in Palm City, FL",,,https://www.acehandymanservices.com/offices/port-st-lucie/city/palm_city_services,,Palm City,FL,property_manager,websearch,2026-02-12,High,No,"Reliable residential & commercial handyman services in Palm City, FL. Quality repairs, upgrades, & m"
Martin County,,,https://scpmllc.com/service-areas/martin-county/,,Palm City,FL,property_manager,websearch,2026-02-12,High,No,"We specialize in landscape maintenance, design, irrigation, tree care, and hardscapes to keep proper"
Lawn Care and Lawn Maintenance,,,https://alphazetaent.com/lawn-care-and-lawn-maintenance-palm-city-fl/,,Palm City,FL,property_manager,websearch,2026-02-12,High,No,Get expert lawn care and lawn maintenance in Palm City with Alpha Zeta. We deliver estate-level turf
Wolf's Landscape & Maintenance,,,https://www.mapquest.com/us/florida/wolfs-landscape-maintenance-470477436,,Palm City,FL,property_manager,websearch,2026-02-12,High,No,"Palm City, FL 34990. +1 (772) 631-7643. Wolf's Landscape & Maintenance is a professional landscaping"
Martin County Condo & Homeowners Association Attorneys,,,https://www.treasurecoastlegal.com/condo-homeowner-associations/,,Stuart,FL,apartment_complex,zai_search,2026-02-12,High,No,
Martin Downs Property Owners Association: Home,,,https://mdpoa.org/,,Stuart,FL,apartment_complex,zai_search,2026-02-12,High,No,
Beau Rivage Estates HOA,,,https://beaurivageestateshoa.org/,,Stuart,FL,apartment_complex,zai_search,2026-02-12,High,No,
Martin Meadows | Home Owners Association – MMHOA,,,https://martinmeadows.com/,,Stuart,FL,apartment_complex,zai_search,2026-02-12,High,No,
Circle Bay Yacht Club,,,https://www.circlebay.org/home/,,Stuart,FL,apartment_complex,zai_search,2026-02-12,High,No,
"The Landings of Martin County | HOA in Stuart, FL",,,https://tlomc.communitysite.com/,,Stuart,FL,apartment_complex,zai_search,2026-02-12,High,No,
