business_name,phone,email,website,address,city,state,category,source,date_found,priority,contacted,notes
Master Association - Welcome to Hammock Creek,,,https://www.hammockcreekhoa.com/master-association.html,,Stuart,FL,apartment_complex,zai_search,2026-02-12,High,No,
Community Association - Reblawpa,,,https://reblawpa.com/areas-of-practice/community-association/,,Stuart,FL,apartment_complex,zai_search,2026-02-12,High,No,
Boca Raton Kitchen Remodeling by Boca Kitchens & Baths,,,https://www.bocakitchens.com/,,Boca Raton,FL,esh_scout,zai_search,2026-02-12,Low,No,
Kitchen Renovations Perfected | Remodeling Contractor,,,https://kitchenrenovationsperfected.com/,,Boca Raton,FL,esh_scout,zai_search,2026-02-12,Low,No,
"Kitchen Remodeling in Boca Raton, FL",,,https://grmkb.com/kitchen-remodeling/,,Boca Raton,FL,esh_scout,zai_search,2026-02-12,Low,No,
"Professional Remodeling Contractor In Boca Raton, FL | CabinetIQ",,,https://cabinetiq.com/boca-raton/kitchen-remodeling/,,Boca Raton,FL,esh_scout,zai_search,2026-02-12,Low,No,
"West Boca Raton Custom Cabinets, Refacing & Remodeling",,,https://www.kitchentuneup.com/west-boca-raton/,,Boca Raton,FL,esh_scout,zai_search,2026-02-12,Low,No,
"Treasure Coast, FL - TourSeniorLiving.org",,,https://tourseniorliving.org/area/treasure-coast-fl/?type[]=ch,,Stuart,FL,healthcare,zai_search,2026-02-12,High,No,
"The Best Assisted Living Facilities in Port St. Lucie, FL",,,https://www.assistedliving.org/florida/port-saint-lucie/,,Stuart,FL,healthcare,zai_search,2026-02-12,High,No,
Treasure Coast Senior Living Communities,,,https://sonataseniorliving.com/our-communities/treasure-coast/,,Stuart,FL,healthcare,zai_search,2026-02-12,High,No,
JD Treasure Coast ALF in Florida - Oasis Senior Advisors,,,https://www.oasissenioradvisors.com/community-guide/florida/port-saint-lucie/jd-treasure-coast-alf/,,Stuart,FL,healthcare,zai_search,2026-02-12,High,No,
The Gardens of Port St. Lucie Senior Living,,,https://sinceriseniorliving.com/the-gardens-of-port-st-lucie/,,Stuart,FL,healthcare,zai_search,2026-02-12,High,No,
Castlewood Assisted Living Residence,,,https://www.castlewoodresidence.com/,,Stuart,FL,healthcare,zai_search,2026-02-12,High,No,
"jd treasure coast assisted living facility, llc - Florida Health Finder",,,https://quality.healthfinder.fl.gov/Facility-Provider/Profile/?LID=538978,,Stuart,FL,healthcare,zai_search,2026-02-12,High,No,
"Treasure Coast ALF | Port St. Lucie, Florida Senior Living Community",,,https://seniorplacementgroup.com/community/treasure-coast-alf/,,Stuart,FL,healthcare,zai_search,2026-02-12,High,No,
"10 Best Assisted Living Facilities in St Lucie County, FL",,,https://www.aplaceformom.com/assisted-living/florida/st-lucie-county,,Stuart,FL,healthcare,zai_search,2026-02-12,High,No,
Independent Living - CarePatrol of The Treasure Coast,,,https://carepatrol.com/the-treasure-coast/services/independent-living/,,Stuart,FL,healthcare,zai_search,2026-02-12,High,No,
"RENOVA - Kitchen, Bath Remodeling Contractors in Delray Beach ...",,,https://www.letrenova.com/,,Delray Beach,FL,esh_scout,zai_search,2026-02-12,Low,No,
Kitchen and Bath remodeling Delray Beach contractors BBB A+,,,https://www.wymanbuilders.com/fl/delray-beach-remodeling/,,Delray Beach,FL,esh_scout,zai_search,2026-02-12,Low,No,
"Delray Beach Kitchen, Bathroom & Home Remodeling",,,https://www.bocakitchens.com/delray-beach-bathroom-kitchen-remodeling.html,,Delray Beach,FL,esh_scout,zai_search,2026-02-12,Low,No,
Custom Kitchen and Bathroom Remodeling in Delray Beach,,,https://www.alliedkitchenandbath.com/areas-we-serve/custom-kitchen-and-bathroom-remodeling-in-delray-beach/,,Delray Beach,FL,esh_scout,zai_search,2026-02-12,Low,No,
Delray Beach Kitchen Remodeling Services | JR Stone Design,,,https://jrstonedesign.net/delray-beach-remodeling/,,Delray Beach,FL,esh_scout,zai_search,2026-02-12,Low,No,
"Home Remodeling & General Contractor in Delray Beach, & Boca ...",,,https://www.kmr-gc.com/,,Delray Beach,FL,esh_scout,zai_search,2026-02-12,Low,No,
"Kitchen, Flooring & Bathroom Remodeling | Liberty Kitchen Design ...",,,http://www.libertykitchendesign.com/,,Delray Beach,FL,esh_scout,zai_search,2026-02-12,Low,No,
Premium Concrete Floor Coatings Services Stuart FL 2026,,,https://customsurfacellc.com/service-areas/florida/martin-county/stuart/,,Stuart,FL,epoxy,zai_search,2026-02-12,High,No,
Epoxy Garage Floor Solutions in Stuart,,,https://enhanceyourgarage.com/epoxy-garage-floor-solutions-stuart/,,Stuart,FL,epoxy,zai_search,2026-02-12,High,No,
"Garage Floor Installations in Stuart, FL – 10X Better",,,https://www.floortekcoatings.com/posts/garage-floor-installations-stuart-fl,,Stuart,FL,epoxy,zai_search,2026-02-12,High,No,
Jupiter Custom Garage Floor Coatings & Cabinets | GarageExperts®,,,https://www.garageexperts.com/treasure-coast/,,Stuart,FL,epoxy,zai_search,2026-02-12,High,No,
Top Flooring Alternatives to Epoxy in Stuart - Floortek Coatings,,,https://www.floortekcoatings.com/posts/top-flooring-alternatives-to-epoxy-floors-in-stuart,,Stuart,FL,epoxy,zai_search,2026-02-12,High,No,
Sewalls Point Property Management | South Florida Realty ...,,,https://www.floridapm.net/sewalls-point-property-management,,Sewall's Point,FL,property_manager,zai_search,2026-02-12,High,No,
"Luxury Airbnb Property Management in Sewall's Point, FL | Five Star ...",,,https://fivestarpropertiesfl.com/airbnb-property-management-sewalls-point/,,Sewall's Point,FL,property_manager,zai_search,2026-02-12,High,No,
"REALTORS® & real estate agents in Sewall's Point, FL",,,https://www.realtor.com/realestateagents/sewall's-point_fl,,Sewall's Point,FL,property_manager,zai_search,2026-02-12,High,No,
"Kathi Lundstrom, Real Estate Agent - Illustrated Properties",,,https://www.ipre.com/agent/55720-kathi-lundstrom,,Sewall's Point,FL,property_manager,zai_search,2026-02-12,High,No,
Florida Commercial Real Estate Company: HOME,,,https://www.florida-commercial.net/,,Sewall's Point,FL,property_manager,zai_search,2026-02-12,High,No,
Stuart Florida Real Estate | Premier Group at ONE Sotheby's ...,,,https://premierrealtygroup.com/,,Sewall's Point,FL,property_manager,zai_search,2026-02-12,High,No,
About Us - Management Specialists Port St Lucie FL,,,https://www.mgtspec.com/about/,,Sewall's Point,FL,property_manager,zai_search,2026-02-12,High,No,
We Acquired R. Russell Properties!,,,https://trusthomeproperties.com/trusthome-properties-and-r-russell-properties/,,Sewall's Point,FL,property_manager,zai_search,2026-02-12,High,No,
Palm City Garage Floor Coatings | GarageExperts®,,,https://www.garageexperts.com/treasure-coast/palm-city/,,Palm City,FL,epoxy,zai_search,2026-02-12,High,No,
"Professional Garage Floors in Palm City, FL - Floortek Coatings",,,https://www.floortekcoatings.com/garage-floor-palm-city,,Palm City,FL,epoxy,zai_search,2026-02-12,High,No,
Professional Concrete Floor Coatings Palm City FL | Call Us!,,,https://customsurfacellc.com/service-areas/florida/martin-county/palm-city/,,Palm City,FL,epoxy,zai_search,2026-02-12,High,No,
"Metallic Epoxy Flooring Experts in Palm City, Florida",,,https://superiorfloorcoating.com/metallic-epoxy-palm-city-fl/,,Palm City,FL,epoxy,zai_search,2026-02-12,High,No,
"flooring contractors in palm city, fl",,,https://www.astonstuart.com/flooring-installation-in-palm-city-fl,,Palm City,FL,epoxy,zai_search,2026-02-12,High,No,
"Concrete Flooring Installation in Palm City, FL",,,https://palmcityconcrete.com/concrete-flooring-installation,,Palm City,FL,epoxy,zai_search,2026-02-12,High,No,
General Contractor Boca Raton | Miller Construction Company,,,https://millerconstruction.com/general-contractor-boca-raton/,,Boca Raton,FL,esh_scout,zai_search,2026-02-12,Low,No,
General Contractor Services in Boca Raton - Garzone Construction,,,https://garzoneconstruction.com/general-contractors-in-boca-raton/,,Boca Raton,FL,esh_scout,zai_search,2026-02-12,Low,No,
General Building Contractor Boca Raton FL - KMR Enterprises,,,https://www.kmr-gc.com/full-service-general-contractor/,,Boca Raton,FL,esh_scout,zai_search,2026-02-12,Low,No,
THE 10 BEST Restaurants in Stuart (Updated February 2026),,,https://www.tripadvisor.com/Restaurants-g34657-Stuart_Florida.html,,Stuart,FL,restaurant,zai_search,2026-02-12,High,No,
Dining - Historic Downtown Stuart,,,https://downtownstuartflorida.com/dining/,,Stuart,FL,restaurant,zai_search,2026-02-12,High,No,
"The 10 Best Restaurants Near Me in Stuart, FL | OpenTable",,,https://www.opentable.com/nearby/restaurants-near-me-stuart,,Stuart,FL,restaurant,zai_search,2026-02-12,High,No,
"Home - BOATHOUSE - Fish restaurant in Stuart, FL",,,https://www.stuartboathouse.com/,,Stuart,FL,restaurant,zai_search,2026-02-12,High,No,
The Sailor's Return Restaurant in Stuart Florida (772) 872-7250,,,https://thesailorsreturn.com/,,Stuart,FL,restaurant,zai_search,2026-02-12,High,No,
"Stuart Fish Grill - Stuart, FL",,,https://stuartfishgrill.com/,,Stuart,FL,restaurant,zai_search,2026-02-12,High,No,
"The Black Marlin | Bar & Restaurant in Historic Stuart, Florida",,,https://theblackmarlin.net/,,Stuart,FL,restaurant,zai_search,2026-02-12,High,No,
Hudson's On The River | Waterfront Dining | Best restaurants in ...,,,https://www.hudsonontheriver.com/,,Stuart,FL,restaurant,zai_search,2026-02-12,High,No,
"New Construction Homes for Sale in Port St. Lucie, FL | Realtor.com®",,,https://www.realtor.com/realestateandhomes-search/Port-St.-Lucie_FL/shw-nc,,Port St Lucie,FL,construction,zai_search,2026-02-12,Medium,No,
"New Construction Homes in Port Saint Lucie, FL | 87 Communities",,,https://www.newhomesource.com/communities/fl/martin-st.-lucie-okeechobee-counties-area/port-saint-lucie,,Port St Lucie,FL,construction,zai_search,2026-02-12,Medium,No,
"Port Saint Lucie, FL New Construction Homes For Sale - 763 Listings",,,"https://www.trulia.com/for_sale/Port_Saint_Lucie,FL/new_homes_lt/",,Port St Lucie,FL,construction,zai_search,2026-02-12,Medium,No,
"New Homes In Port St. Lucie, Florida For Sale",,,https://www.ryanhomes.com/new-homes/communities/florida/port-st.-lucie,,Port St Lucie,FL,construction,zai_search,2026-02-12,Medium,No,
"Port Saint Lucie, FL New Construction Homes for Sale",,,https://www.homes.com/port-saint-lucie-fl/new-construction/,,Port St Lucie,FL,construction,zai_search,2026-02-12,Medium,No,
"New homes for sale & real estate in Port St. Lucie, FL - Redfin",,,https://www.redfin.com/city/15203/FL/Port-St-Lucie/new-homes,,Port St Lucie,FL,construction,zai_search,2026-02-12,Medium,No,
"Port St. Lucie, FL New Homes For Sale by Lennar",,,https://www.lennar.com/new-homes/florida/treasure-coast/port-st-lucie,,Port St Lucie,FL,construction,zai_search,2026-02-12,Medium,No,
New Homes Port St. Lucie | Maronda Homes,,,https://www.marondahomes.com/fl/port-st-lucie/port-st-lucie-34983.html,,Port St Lucie,FL,construction,zai_search,2026-02-12,Medium,No,
Gutter Installation & Downspout Services | Gutter Guy Inc.,,,https://gutterguyofflorida.com/,,Jensen Beach,FL,gutter,zai_search,2026-02-12,High,No,
Jensen Beach FL Seamless Gutter Services by Gutter Hawk,,,https://www.gutterhawks.com/locations/jensen-beach,,Jensen Beach,FL,gutter,zai_search,2026-02-12,High,No,
"Gutter Installation in Jensen Beach, FL, 34957 - Lowe's",,,https://www.lowes.com/store/0703-jensen-beach-fl/gutter-installation,,Jensen Beach,FL,gutter,zai_search,2026-02-12,High,No,
Jensen Seamless Gutters,,,https://unitedseamlessgutters.com/jensen-seamless-gutters,,Jensen Beach,FL,gutter,zai_search,2026-02-12,High,No,
"Gutter Installation Jensen Beach, FL – Veteran Owned – Stateline ...",,,https://www.statelinegutters.com/florida/jensen-beach-gutter-installation/,,Jensen Beach,FL,gutter,zai_search,2026-02-12,High,No,
"Seamless Gutters | Jensen Beach, FL",,,https://budgetgutters.com/contact-us/martin-county-gutters/jensen-beach-gutters/,,Jensen Beach,FL,gutter,zai_search,2026-02-12,High,No,
Jensen Beach Seamless Gutters,,,https://raincontrolseamlessgutters.com/jensen-beach-gutters/,,Jensen Beach,FL,gutter,zai_search,2026-02-12,High,No,
Jensen Beach Kitchen and Bath Remodeling,,,https://jensenbeachkitchenandbath.com/,,Jensen Beach,FL,kitchen,zai_search,2026-02-12,High,No,
GLS Remodeling | Kitchen & Bathroom Remodeling | Martin & St ...,,,https://www.glsremodeling.com/,,Jensen Beach,FL,kitchen,zai_search,2026-02-12,High,No,
"Victory Kitchen & Bath | Remodeling, Cabinetry, Countertops & more",,,https://victorykb.com/,,Jensen Beach,FL,kitchen,zai_search,2026-02-12,High,No,
General Contractor Jensen Beach Florida Sweet Industries,,,https://sweetgc.com/,,Jensen Beach,FL,kitchen,zai_search,2026-02-12,High,No,
Martin North Hospital | Cleveland Clinic,,,https://my.clevelandclinic.org/locations/directions/546-martin-north-hospital,,Stuart,FL,healthcare,zai_search,2026-02-12,High,No,
"Hospitals near Stuart, FL - Healthgrades",,,https://www.healthgrades.com/hospital-directory/fl-florida/stuart,,Stuart,FL,healthcare,zai_search,2026-02-12,High,No,
Martin North Hospital | Cleveland Clinic Florida,,,https://my.clevelandclinic.org/florida/locations/martin-north-hospital,,Stuart,FL,healthcare,zai_search,2026-02-12,High,No,
HCA Florida Stuart Emergency,,,https://www.hcafloridahealthcare.com/locations/stuart-emergency,,Stuart,FL,healthcare,zai_search,2026-02-12,High,No,
HOSPITALS/EMERGENCY ROOM Category | Stuart Martin County ...,,,https://business.stuartmartinchamber.org/members/category/hospitals-154,,Stuart,FL,healthcare,zai_search,2026-02-12,High,No,
"Cleveland Clinic Martin Health-Stuart in Stuart, FL - Health US News",,,https://health.usnews.com/best-hospitals/area/fl/martin-medical-center-6391000,,Stuart,FL,healthcare,zai_search,2026-02-12,High,No,
"Martin Memorial Hospital South, Stuart, FL - WellMed",,,https://doctors.wellmedhealthcare.com/locations/details/4901,,Stuart,FL,healthcare,zai_search,2026-02-12,High,No,
Cleveland Clinic Martin North Hospital - Medicare,,,https://www.medicare.gov/care-compare/details/hospital/100044/view-all?city=Port%2520St.%2520Lucie&state=FL&zipcode=34987,,Stuart,FL,healthcare,zai_search,2026-02-12,High,No,
"Top-rated Handyman in Stuart, FL",,,https://www.mrhandyman.com/vero-beach-jupiter/geo/stuart/,,Stuart,FL,handyman,zai,2026-02-12,High,No,
Handyman Services in Stuart FL | Home & Beyond,,,https://www.homeandbeyondfl.com/handyman,,Stuart,FL,handyman,zai,2026-02-12,High,No,
"Handyman & Home Repair Services in Stuart, FL",,,https://www.acehandymanservices.com/offices/port-st-lucie/city/stuart_services,,Stuart,FL,handyman,zai,2026-02-12,High,No,
Stuart Pressure Washing & Handyman LLC: Expert Pressure ...,,,https://www.pressurewashingandhandyman.com/,,Stuart,FL,handyman,zai,2026-02-12,High,No,
"Bathroom Remodeling in Boca Raton, Florida - KBC General Services",,,https://www.kbcgeneralservices.com/bathroom-remodeling,,Boca Raton,FL,esh_scout,zai,2026-02-12,Low,No,
Boca Raton Luxury Bathroom Overhaul - RENOVA,,,https://www.letrenova.com/project/boca-raton-luxury-bathroom-overhaul/,,Boca Raton,FL,esh_scout,zai,2026-02-12,Low,No,
Ocean Remodeling | Home Remodeling Contractors Boca Raton FL,,,https://www.oceanremodeling.com/,,Boca Raton,FL,esh_scout,zai,2026-02-12,Low,No,
"Everlast Bathrooms in Boca Raton, FL",,,https://www.everlastbathrooms.com/boca-raton-fl.html,,Boca Raton,FL,esh_scout,zai,2026-02-12,Low,No,
"Luxury Bathroom Remodeling & Renovation Services Boca Raton, FL",,,https://uemiccontracting.com/bathroom-remodeling-services/,,Boca Raton,FL,esh_scout,zai,2026-02-12,Low,No,
Treasure Coast Auto Spa: Treasure Coast Auto Detailing,,,https://tcautodetail.com/,,Stuart,FL,detailing,zai,2026-02-12,High,No,
MDS Auto Detailing,,,https://www.mdsautodetailing.com/,,Stuart,FL,detailing,zai,2026-02-12,High,No,
Doctor Detail of the Treasure Coast: Auto Detailing,,,https://ddoftc.com/,,Stuart,FL,detailing,zai,2026-02-12,High,No,
Lio's Quality detailing,,,https://www.liosqualitydetailing.com/,,Stuart,FL,detailing,zai,2026-02-12,High,No,
Florida Finest Detailing: Home,,,https://www.floridasfinestdetailing.com/,,Stuart,FL,detailing,zai,2026-02-12,High,No,
"Ceramic Coating Experts | Best Auto Detailing in Port St Lucie, Fort ...",,,https://www.redlinepremiumdetailing.com/,,Stuart,FL,detailing,zai,2026-02-12,High,No,
Lion Heartz Detailing: Mobile Auto Detailing Services,,,https://lionheartzdetail.com/,,Stuart,FL,detailing,zai,2026-02-12,High,No,
Booking - Showtime Detailing,,,https://showtimedetailing.org/booking/,,Stuart,FL,detailing,zai,2026-02-12,High,No,
HOME - DA Detailing - PSL,,,https://dadetailingpsl.com/,,Stuart,FL,detailing,zai,2026-02-12,High,No,
Full Service Catering | Treasure Coast | Home,,,https://www.snlevents.com/,,Stuart,FL,restaurant,zai,2026-02-12,High,No,
"Catering services along the Treasure Coast, FL - Corporate Caterers",,,https://www.corporatecaterers.com/location/corporate-caterers-treasure-coast-fl/,,Stuart,FL,restaurant,zai,2026-02-12,High,No,
True Roots Catering | Vero Beach | Stuart | Palm Beach,,,https://www.truerootscatering.com/,,Stuart,FL,restaurant,zai,2026-02-12,High,No,
"Catering Revolution: Catering Services in Stuart, FL",,,https://cateringrevolution.com/,,Stuart,FL,restaurant,zai,2026-02-12,High,No,
Premier Catering Services in Fort Pierce | Shelly's Bistro,,,https://shellyzbistro.com/,,Stuart,FL,restaurant,zai,2026-02-12,High,No,
CT Catering,,,https://www.cheftablecatering.com/,,Stuart,FL,restaurant,zai,2026-02-12,High,No,
"Caterer Service in Treasure Coast, FL | Corporate Caterers - Menu",,,https://chicago.corpcaterers.com/location/corporate-caterers-treasure-coast-fl/full-menu/,,Stuart,FL,restaurant,zai,2026-02-12,High,No,
"Purple Olive: Catering Service | Saint Augustine, FL",,,https://www.purple-olive.com/,,Stuart,FL,restaurant,zai,2026-02-12,High,No,
Investment properties Martin County FL - Landmark Realty,,,https://www.landmarkinvestmentsflorida.com/properties/investment-properties-martin-county-fl/,,Stuart,FL,real_estate,zai,2026-02-12,High,No,
CRA Investment Program | Martin County Florida,,,https://www.martin.fl.us/CRAInvestmentProgram,,Stuart,FL,real_estate,zai,2026-02-12,High,No,
"Martin County, FL commercial real estate for sale - Realmo",,,https://realmo.com/commercial-real-estate/for-sale/fl/martin-county/,,Stuart,FL,real_estate,zai,2026-02-12,High,No,
Martin County Existing Condo Sales Climb - MIAMI REALTORS®,,,https://www.miamirealtors.com/2025/11/20/martin-county-existing-condo-sales-climb/,,Stuart,FL,real_estate,zai,2026-02-12,High,No,
"Martin County, FL Homes for Sale - The Zecca Group",,,https://www.thezeccagroup.com/martin-county-fl-homes-for-sale/?page=12,,Stuart,FL,real_estate,zai,2026-02-12,High,No,
Martin County Real Estate Market Update – September 2025,,,https://www.echofineproperties.com/martin-county-real-estate-market-update-september-2025/,,Stuart,FL,real_estate,zai,2026-02-12,High,No,
Restaurants In Jensen Beach Florida | Discover Martin County,,,https://discovermartin.com/see-do/dining-food/,,Jensen Beach,FL,restaurant,zai,2026-02-12,High,No,
"The 10 Best Restaurants Near Me in Jensen Beach, FL | OpenTable",,,https://www.opentable.com/nearby/restaurants-near-me-jensen-beach,,Jensen Beach,FL,restaurant,zai,2026-02-12,High,No,
"The Nest | American Restaurant in Jensen Beach, FL",,,https://www.nestontheriver.com/,,Jensen Beach,FL,restaurant,zai,2026-02-12,High,No,
Where to eat? Downtown Jensen Beach teems with restaurants,,,https://www.tcpalm.com/story/entertainment/dining/2024/09/07/where-to-eat-downtown-jensen-beach-restaurants-near-me/73949353007/,,Jensen Beach,FL,restaurant,zai,2026-02-12,High,No,
Mulligan's Beach House,,,https://www.mulligansbeachhouse.com/,,Jensen Beach,FL,restaurant,zai,2026-02-12,High,No,
Restaurants Jensen Beach | Seafood Restaurant Jensen Beach,,,https://conchyjoes.com/,,Jensen Beach,FL,restaurant,zai,2026-02-12,High,No,
Crawdaddy - Jensen Beach,,,https://crawdaddysjensenbeach.com/,,Jensen Beach,FL,restaurant,zai,2026-02-12,High,No,
"The Best Restaurants in Jensen Beach, Florida - Trip Canvas - AAA",,,https://www.aaa.com/tripcanvas/jensen-beach-fl/category/restaurants,,Jensen Beach,FL,restaurant,zai,2026-02-12,High,No,
Office Cleaning in Stuart FL | Serving Treasure Coast,,,https://www.customcleaningtc.com/commercial/office-cleaning-services/,,Stuart,FL,cleaning,zai,2026-02-12,High,No,
"Snap Clean: Cleaning Services in Treasure Coast, FL",,,https://www.snapcleanservices.com/,,Stuart,FL,cleaning,zai,2026-02-12,High,No,
Commercial Cleaning Services in Palm Beach and Treasure Coast,,,https://www.vanguardcleaning.com/cleaning/florida-palm-beach/,,Stuart,FL,cleaning,zai,2026-02-12,High,No,
Janitorial Services - FREEDOM COAST CLEANING SERVICES ...,,,https://freedomcoastcleaningservices.com/,,Stuart,FL,cleaning,zai,2026-02-12,High,No,
Treasure Coast Commercial Cleaning and Janitorial Services,,,https://cleanproservicesllc.com/treasure-coast-commercial-janitorial-cleaning-company/,,Stuart,FL,cleaning,zai,2026-02-12,High,No,
Office Cleaning Services in South Florida,,,https://www.akbuildingservices.com/cleaning-services-industries/office-cleaning-services/,,Stuart,FL,cleaning,zai,2026-02-12,High,No,
Top Treasure Coast Cleaning Company 360 Cleaning Solutions LLC,,,https://treasurecoastcleaningsolutions.com/,,Stuart,FL,cleaning,zai,2026-02-12,High,No,
Reliable Cleaning Services Of Treasure Coast LLC - Home,,,https://rcsoftreasurecoast.com/,,Stuart,FL,cleaning,zai,2026-02-12,High,No,
"Best Epoxy & Garage Floor Company Austin, TX",,,https://garageup.com/austin/services/garage-flooring/,,Austin,TX,esh_scout,zai,2026-02-12,Low,No,
Epoxy Floors Austin TX with ATX Epoxy Flooring | Garage ...,,,https://atxepoxyfloors.com/,,Austin,TX,esh_scout,zai,2026-02-12,Low,No,
"15 Best Commercial Epoxy floor Contractors Austin, TX - Downtobid",,,https://downtobid.com/contractors/expoxy-floor/austin,,Austin,TX,esh_scout,zai,2026-02-12,Low,No,
Epoxy Garage Flooring Contractor in Texas - Zion Outdoors,,,https://zionoutdoors.com/epoxy-garage-flooring/,,Austin,TX,esh_scout,zai,2026-02-12,Low,No,
Texas Tough Tops Epoxy Flooring,,,https://www.texastoughtops.com/,,Austin,TX,esh_scout,zai,2026-02-12,Low,No,
"HOA Management Companies in Port St. Lucie, Florida",,,https://www.hoamanagement.com/city/port-st-lucie-fl/,,Port St Lucie,FL,hoa,zai,2026-02-12,Medium,No,
Watson Association Management - HOA & Property Management,,,https://www.watsonassociationmanagement.com/,,Port St Lucie,FL,hoa,zai,2026-02-12,Medium,No,
Keystone Property Management Group,,,https://www.kpmgcommunitycare.com/,,Port St Lucie,FL,hoa,zai,2026-02-12,Medium,No,
Divine Association Management LLC: Community Association | Florida,,,https://www.divineassociations.com/,,Port St Lucie,FL,hoa,zai,2026-02-12,Medium,No,
Vesta Property Services – Florida HOA & Community Association ...,,,https://vestapropertyservices.com/,,Port St Lucie,FL,hoa,zai,2026-02-12,Medium,No,
Lang Management - Association Management Services,,,https://langmgmt.com/,,Port St Lucie,FL,hoa,zai,2026-02-12,Medium,No,
Port St. Lucie Property Management,,,https://www.campbellpropertymanagement.com/port-st-lucie-property-management,,Port St Lucie,FL,hoa,zai,2026-02-12,Medium,No,
"General Contractor | Kirchman Construction Co. | Stuart, FL",,,https://www.kirchmanconstruction.com/,,Stuart,FL,construction,zai,2026-02-12,High,No,
MEL-RY Construction Commercial & Residential Builders in Stuart FL,,,https://www.mel-ry.com/,,Stuart,FL,construction,zai,2026-02-12,High,No,
Bayview Construction Services,,,https://www.bayviewconstruction.com/,,Stuart,FL,construction,zai,2026-02-12,High,No,
West Building Contractors | Stuart FL Construction Experts,,,https://www.westbuildingcontractors.com/,,Stuart,FL,construction,zai,2026-02-12,High,No,
Crosby's Construction LLC: Home,,,https://crosbysconstructionfl.com/,,Stuart,FL,construction,zai,2026-02-12,High,No,
"Masterpiece Builders | Custom Home Builder Martin County, FL",,,https://masterpiecebuilders.com/,,Stuart,FL,construction,zai,2026-02-12,High,No,
Straticon | South Florida Based Construction Management Company,,,https://straticon.com/,,Stuart,FL,construction,zai,2026-02-12,High,No,
Commercial Cleaning - Eastside Chem-Dry,,,https://eastsidechemdry.com/commercial-cleaning,,Stuart,FL,cleaning,zai,2026-02-12,High,No,
General Cleaning and Janitorial Services - Servpro,,,https://www.servpro.com/locations/fl/servpro-of-martin-county/services/cleaning/general,,Stuart,FL,cleaning,zai,2026-02-12,High,No,
Top 5 Renovation Contractors in Palm Beach County,,,https://www.westpalmbeachrenovations.com/top-5-renovation-contractors-in-palm-beach-county/,,West Palm Beach,FL,esh_scout,zai,2026-02-12,Low,No,
Home Remodeling & Renovation Contractors - Greenview,,,https://greenviewrenovation.com/,,West Palm Beach,FL,esh_scout,zai,2026-02-12,Low,No,
"Professional Home Remodeling in West Palm Beach, FL by Renuity",,,https://renuityhome.com/florida/west-palm-beach-fl/,,West Palm Beach,FL,esh_scout,zai,2026-02-12,Low,No,
General Renovation Contractor West Palm Beach - Gentile,,,https://gentilellc.com/general-renovation-contractor-west-palm-beack/,,West Palm Beach,FL,esh_scout,zai,2026-02-12,Low,No,
"Apartments for Rent in Fort Pierce, FL - Homes.com",,,https://www.homes.com/fort-pierce-fl/apartments-for-rent/,,Fort Pierce,FL,apartments,zai,2026-02-12,Medium,No,
"Apartments for Rent in Fort Pierce, FL - New Listings Daily",,,https://www.rentcafe.com/apartments-for-rent/us/fl/fort-pierce/,,Fort Pierce,FL,apartments,zai,2026-02-12,Medium,No,
B & S Auto Detailing LLC: Superior Auto Detailing Services in Stuart ...,,,https://bnsautodetailing.com/,,Stuart,FL,detailing,zai,2026-02-12,High,No,
"Mobile Car Detailing in Stuart, FL | AIRLITE",,,https://airliteautodetailing.com/pages/mobile-car-detailing-stuart-fl?srsltid=AfmBOopWagPB1T1yUSqZS9bSQ6AU8UbDGOeUB0YX4jnToRm8LRRUiDWI,,Stuart,FL,detailing,zai,2026-02-12,High,No,
