name,phone,website,address,source
"Sailfish Pools LLC: Pool Maintenance in Stuart, FL",772-283-0898,https://www.sailfishpools.com/,N/A,pool service Stuart FL
Stuart Pool Supplies & Service | Pinch A Penny #39,N/A,https://pinchapenny.com/stores/stuart-fl-39,N/A,pool service Stuart FL
"Pool Construction, Cleaning, Maintenance, and Repair Company ...",N/A,https://coastlifepools.com/,N/A,pool service Stuart FL
Printable NFL Weekly Pick'em Pool Sheets and Schedules - 2025,N/A,https://www.printyourbrackets.com/nflweekly.html,N/A,pool service Stuart FL
"Stuart, FL - Barefoot Pools",N/A,https://www.barefoot-pools.com/service-area/stuart-fl/,N/A,pool service Stuart FL
"Mahalo Pool Service, Stuart, FL 34997, US",N/A,https://www.mapquest.com/us/florida/mahalo-pool-service-519978841,N/A,pool service Stuart FL
"Oasis Pool Solutions | Jensen Beach, FL",N/A,https://www.oasispoolsolutions.com/,N/A,pool maintenance Jensen Beach FL
"Custom Pool & Spa Mechanics: Expert Pool Service in Stuart FL, Palm ...",N/A,https://custompoolmechanics.com/,N/A,pool maintenance Jensen Beach FL
Printable NFL Weekly Pick'em Pool Sheets and Schedules - 2025,N/A,https://www.printyourbrackets.com/nflweekly.html,N/A,pool maintenance Jensen Beach FL
"Best 15 Swimming Pool Cleaners in Jensen Beach, FL",N/A,https://www.houzz.com/professionals/spa-and-pool-maintenance/jensen-beach-fl-us-probr0-bo~t_28351~r_4160171,N/A,pool maintenance Jensen Beach FL
"Swimming Pool Contractor | Port St. Lucie, FL | Pools By",N/A,https://www.poolsbygreginc.com/,N/A,pool contractor Port St Lucie FL
🥇 Port St. Lucie FL Pool Builders | Best Swimming Pool Design Contractors,N/A,https://www.sunsationalpoolsandspas.com/port-st-lucie-pool-builders/,N/A,pool contractor Port St Lucie FL
Platinum Blu Pools: Pool Builder Port St Lucie FL,N/A,https://platinumblupoolsfl.com/,N/A,pool contractor Port St Lucie FL
"A&G Concrete Pools – Dive Into Luxury | Port St. Lucie, FL",772-878-7752,https://www.angpools.com/,N/A,pool contractor Port St Lucie FL
Printable NFL Weekly Pick'em Pool Sheets and Schedules - 2025,N/A,https://www.printyourbrackets.com/nflweekly.html,N/A,pool contractor Port St Lucie FL
"Pool Construction and Services in Port St. Lucie, Florida",N/A,https://rpdfl.com/pool-construction-and-services-in-port-st-lucie-florida/,N/A,pool contractor Port St Lucie FL
"Northern Fort Pierce, FL | All Pro Pool & Spa Repair Services",772-494-7067,https://www.allpropools.net/northern-fort-pierce-fl,N/A,Fort Pierce pool service
"Fort Pierce North, FL | Pool Cleaning",N/A,https://www.bluedolphinpoolservice.com/fort-pierce-fl,N/A,Fort Pierce pool service
Florida Pool Cleaning Service | Spotless Pools | Florida,N/A,https://www.spotlesspoolsfl.com/,N/A,Fort Pierce pool service
"Blue Dolphin Pool Service | Vero Beach, FL | Swimming Pool Service ...",N/A,https://www.bluedolphinpoolservice.com/,N/A,Vero Beach pool service
Molinari Pools | Luxury Pool Builder | Weekly Service Vero Beach,N/A,https://www.molinaripools.com/,N/A,Vero Beach pool service
"Pool Repair: All Pro Pool & Spa Repair Services Inc. | Vero Beach, FL",N/A,https://www.allpropools.net/,N/A,Vero Beach pool service
"Pool Service and Cleaning Companies in Vero Beach, FL",N/A,https://verobeach.com/vero-beach-directories/pools-and-pool-service,N/A,Vero Beach pool service
"Feeley Brothers Pool Service, LLC: Pool Service Vero Beach, FL",N/A,https://www.feeleybrotherspoolservice.com/,N/A,Vero Beach pool service
"The Best Pool Cleaning Service Companies in Vero Beach, Florida",N/A,https://verovine.com/top-9-pool-cleaning-companies-in-vero-beach-florida/,N/A,Vero Beach pool service
