Company,Owner First,Owner Last,Personal Email,Phone,LinkedIn,Background
Property Management Treasure Coast,Debbie,Grise,debbie.grise@toliveinparadise.com,772-486-1035,https://www.linkedin.com/in/debbie-grise-8953115b,Business owner since 1974, entrepreneur with successful preschools and medical clinics
Real Property Management Sailfish Coast,John,McMurry,John@rpmsailfishcoast.com,772-242-9094,https://www.linkedin.com/in/john-mcmurry-0a3625285,Principal with 30+ years investment property experience, operates in Palm City/Stuart area
Wallace Auto Group,Bill,Wallace,,,https://www.linkedin.com/in/bill-wallace-3b609790,President/Owner of Wallace Automotive Group in Stuart & Fort Pierce
Riverwalk Cafe & Oyster Bar,Steve,Feder,,772-221-1511,,Chef/Owner of Riverwalk Cafe & Oyster Bar in historic downtown Stuart, trained gourmet chef with passion for food
Coastal Property Management,Richard,Krett,,772-600-8900,https://www.linkedin.com/in/richard-krett-ed-d-mpa-lcam-0a1691106,President and Founder of Coastal Property Management, Ed.D., MPA, LCAM certified
Stor-A-Way Self Storage,Joseph,Pritchard,,,https://www.zoominfo.com/p/Joseph-Pritchard/1813193693,Manager at Stor-A-Way II storage facility in Stuart, long-term employee
South Florida Realty Management,Christopher,Lundstrom,,772-220-0844,https://www.zillow.com/profile/christopherlundstrom,Real estate agent with South Florida Realty Management, located at 206 SW Ocean Blvd Stuart